481902,Eugenia egensis var. tenuiramis (Miq.) O.Berg,Syzygium zeylanicum (L.) DC.,Syzygium zeylanicum (L.) DC.,Syzygium zeylanicum (L.) DC.,Syzygium zeylanicum,Eugenia egensis DC.,Eugenia egensis,Syzygium,Eugenia
483308,"Leucojum ionicum Kit Tan, Mullaj, Sfikas & Strid","Acis ionica Bareka, Kamari & Phitos","Acis ionica Bareka, Kamari & Phitos","Acis ionica Bareka, Kamari & Phitos",Acis ionica,"Leucojum ionicum Kit Tan, Mullaj, Sfikas & Strid",Leucojum ionicum,Acis,Leucojum
485082,Psidium hians var. cuneatum O.Berg,Campomanesia pubescens (Mart. ex DC.) O.Berg,Campomanesia pubescens (Mart. ex DC.) O.Berg,Campomanesia pubescens (Mart. ex DC.) O.Berg,Campomanesia pubescens,Psidium guineense Sw.,Psidium guineense,Campomanesia,Psidium
485083,Psidium hians var. truncatum O.Berg,Campomanesia pubescens (Mart. ex DC.) O.Berg,Campomanesia pubescens (Mart. ex DC.) O.Berg,Campomanesia pubescens (Mart. ex DC.) O.Berg,Campomanesia pubescens,Psidium guineense Sw.,Psidium guineense,Campomanesia,Psidium
485119,Psychotria cuspidata var. vulgatior Schltdl.,Psychotria bahiensis DC.,Psychotria bahiensis DC.,Psychotria bahiensis DC.,Psychotria bahiensis,Palicourea hoffmannseggiana (Willd. ex Schult.) Borhidi,Palicourea hoffmannseggiana,Psychotria,Palicourea
485928,Specklinia minutissima (Luer) Luer,Anathallis barbulata (Lindl.) Pridgeon & M.W.Chase,Anathallis barbulata (Lindl.) Pridgeon & M.W.Chase,Anathallis barbulata (Lindl.) Pridgeon & M.W.Chase,Anathallis barbulata,Specklinia minutissima (Luer) Luer,Specklinia minutissima,Anathallis,Specklinia
486504,Tradescantia elongata var. triandra (Kunth) C.B.Clarke,Tripogandra serrulata (Vahl) Handlos,Tripogandra serrulata (Vahl) Handlos,Tripogandra serrulata (Vahl) Handlos,Tripogandra serrulata,Callisia ciliata Kunth,Callisia ciliata,Tripogandra,Callisia
486841,Zoellnerallium serenense (Ravenna) Crosa,Nothoscordum serenense Ravenna,Nothoscordum serenense Ravenna,Nothoscordum serenense Ravenna,Nothoscordum serenense,Latace serenense (Ravenna) Sassone,Latace serenense,Nothoscordum,Latace
491426,Echites torosus Llanos,Parameria laevigata (Juss.) Moldenke,Parameria laevigata (Juss.) Moldenke,Urceola laevigata (Juss.) D.J.Middleton & Livsh.,Urceola laevigata,Mandevilla torosa (Jacq.) Woodson,Mandevilla torosa,Urceola,Mandevilla
494050,Potamogeton angustifolius f. longipedunculatus (Tiselius) A.A.Bobrov & Chemeris,Stuckenia pectinata (L.) Börner,Stuckenia pectinata (L.) Börner,Stuckenia pectinata (L.) Börner,Stuckenia pectinata,Potamogeton × angustifolius J.Presl,Potamogeton angustifolius,Stuckenia,Potamogeton
494758,Xenosia macrorhiza (Lindl.) Luer,Stelis purpurea (Ruiz & Pav.) Willd.,Stelis purpurea (Ruiz & Pav.) Willd.,Stelis purpurea (Ruiz & Pav.) Willd.,Stelis purpurea,Andinia spiralis (Ruiz & Pav.) Karremans & Mark Wilson,Andinia spiralis,Stelis,Andinia
495966,Anacamptis pyramidalis subsp. durandii (Bréb.) K.Richt.,Anacamptis pyramidalis (L.) Rich.,Anacamptis pyramidalis (L.) Rich.,Anacamptis pyramidalis (L.) Rich.,Anacamptis pyramidalis,× Neotinacamptis × durandii (Bréb.) B.Bock,Neotinacamptis durandii,Anacamptis,× Neotinacamptis
498371,Lobelia lanceolata Hook. & Arn.,Lobelia laxiflora Kunth,Lobelia laxiflora Kunth,Lobelia laxiflora Kunth,Lobelia laxiflora,"Cyanea lanceolata (Gaudich.) Lammers, Givnish & Sytsma",Cyanea lanceolata,Lobelia,Cyanea
499115,Ligustrum hookeri Decne.,Olea capensis L.,Olea capensis L.,Olea capensis L.,Olea capensis,Ligustrum lucidum W.T.Aiton,Ligustrum lucidum,Olea,Ligustrum
500144,Ligustrum nepalense var. glabrum Hook.,Olea capensis L.,Olea capensis L.,Olea capensis L.,Olea capensis,Ligustrum lucidum W.T.Aiton,Ligustrum lucidum,Olea,Ligustrum
502938,Lobelia micrantha Hook.,Lobelia heyneana Schult.,Lobelia heyneana Schult.,Lobelia heyneana Schult.,Lobelia heyneana,Scaevola micrantha C.Presl,Scaevola micrantha,Lobelia,Scaevola
503127,Lobelia micrantha (E.Mey.) Heynh.,"Wimmerella pygmaea (Thunb.) Serra, M.B.Crespo & Lammers","Wimmerella pygmaea (Thunb.) Serra, M.B.Crespo & Lammers","Wimmerella pygmaea (Thunb.) Serra, M.B.Crespo & Lammers",Wimmerella pygmaea,Scaevola micrantha C.Presl,Scaevola micrantha,Wimmerella,Scaevola
505180,Cattleyopsis guanensis Acuña,Cattleya warscewiczii Rchb.f.,Cattleya warscewiczii Rchb.f.,Cattleya warscewiczii Rchb.f.,Cattleya warscewiczii,Broughtonia lindenii (Lindl.) Dressler,Broughtonia lindenii,Cattleya,Broughtonia
506876,Cephaelis crebrinervia Standl.,Psychotria berteroana DC.,Psychotria berteroana DC.,Palicourea berteroana (DC.) Borhidi,Palicourea berteroana,Carapichea crebrinervia (Standl.) C.M.Taylor,Carapichea crebrinervia,Palicourea,Carapichea
508153,Campanula polymorpha (Witasek) Prain,Campanula tatrae Borbás,Campanula tatrae Borbás,Campanula tatrae Borbás,Campanula tatrae,Wahlenbergia gracilis (G.Forst.) A.DC.,Wahlenbergia gracilis,Campanula,Wahlenbergia
509073,Campanula willdenowiana (Boiss.) Boiss.,Asyneuma limonifolium subsp. pestalozzae (Boiss.) Damboldt,Asyneuma limonifolium subsp. pestalozzae (Boiss.) Damboldt,Asyneuma limonifolium subsp. pestalozzae (Boiss.) Damboldt,Asyneuma limonifolium,Campanula versicolor Andrews,Campanula versicolor,Asyneuma,Campanula
510972,Faulia verrucosa Raf.,Olea capensis L.,Olea capensis L.,Olea capensis L.,Olea capensis,Ligustrum lucidum W.T.Aiton,Ligustrum lucidum,Olea,Ligustrum
517336,Gymnadenia odoratissima var. heteroglossa Rchb.f.,Gymnadenia odoratissima (L.) Rich.,Gymnadenia odoratissima (L.) Rich.,Gymnadenia odoratissima (L.) Rich.,Gymnadenia odoratissima,× Chamodenia heteroglossa (Rchb.f.) Peitz,Chamodenia heteroglossa,Gymnadenia,× Chamodenia
518473,Chassalia tetrandra (Blume) Miq.,Chassalia curviflora (Wall.) Thwaites,Chassalia curviflora (Wall.) Thwaites,Chassalia curviflora (Wall.) Thwaites,Chassalia curviflora,Eumachia rostrata (Blume) I.M.Turner,Eumachia rostrata,Chassalia,Eumachia
518678,Achnatherum petriei (Buchanan) S.W.L.Jacobs & J.Everett,Stipa setacea R.Br.,Stipa setacea R.Br.,Austrostipa setacea (R.Br.) S.W.L.Jacobs & J.Everett,Austrostipa setacea,Stipa petriei Buchanan,Stipa petriei,Austrostipa,Stipa
519777,Agropyron littorale Dumort.,Elymus pycnanthus (Godr.) Melderis,Elymus pycnanthus (Godr.) Melderis,Thinopyrum acutum (DC.) Banfi,Thinopyrum acutum,Elymus athericus (Link) Kerguélen,Elymus athericus,Thinopyrum,Elymus
519807,Agropyron mucronatum Opiz,Elymus hispidus (Opiz) Melderis,Elymus hispidus (Opiz) Melderis,Thinopyrum intermedium subsp. intermedium ,Thinopyrum intermedium,Thinoelymus mucronatus (Opiz) Banfi,Thinoelymus mucronatus,Thinopyrum,Thinoelymus
519892,Agropyron pungens var. setigerum Dumort.,Elymus pycnanthus (Godr.) Melderis,Elymus pycnanthus (Godr.) Melderis,Thinopyrum acutum (DC.) Banfi,Thinopyrum acutum,Elymus athericus (Link) Kerguélen,Elymus athericus,Thinopyrum,Elymus
519955,Agropyron scabrum (R.Br.) P.Beauv.,Elymus scabrus (R.Br.) Á.Löve,Elymus scabrus (R.Br.) Á.Löve,Elymus scabrus (R.Br.) Á.Löve,Elymus scabrus,Anthosachne scabra (R.Br.) Nevski,Anthosachne scabra,Elymus,Anthosachne
520441,Agrostis delicatula subsp. durieui (Boiss. & Reut. ex Willk.) Rivas Mart.,Agrostis delicatula Pourr. ex Lapeyr.,Agrostis delicatula Pourr. ex Lapeyr.,Agrostis castellana Boiss. & Reut.,Agrostis castellana,"Agrostula truncatula subsp. durieui (Boiss. & Reut. ex Willk.) P.M.Peterson, Romasch., Soreng & Sylvester",Agrostula truncatula,Agrostis,Agrostula
520563,Agrostis font-queri Maire,Agrostis delicatula Pourr. ex Lapeyr.,Agrostis delicatula Pourr. ex Lapeyr.,Agrostis castellana Boiss. & Reut.,Agrostis castellana,Agrostula truncatula subsp. truncatula ,Agrostula truncatula,Agrostis,Agrostula
520568,Agrostis frondosa Ten. ex Spreng.,Agrostis castellana Boiss. & Reut.,Agrostis castellana Boiss. & Reut.,Agrostis castellana Boiss. & Reut.,Agrostis castellana,Polypogon viridis (Gouan) Breistr.,Polypogon viridis,Agrostis,Polypogon
520637,Agrostis hispida Brot. ex Nyman,Agrostis delicatula Pourr. ex Lapeyr.,Agrostis delicatula Pourr. ex Lapeyr.,Agrostis castellana Boiss. & Reut.,Agrostis castellana,Agrostula truncatula subsp. truncatula ,Agrostula truncatula,Agrostis,Agrostula
520958,Agrostis pauciflora Schrad.,Agrostis stolonifera L.,Agrostis stolonifera L.,Agrostis stolonifera L.,Agrostis stolonifera,Muhlenbergia schreberi J.F.Gmel.,Muhlenbergia schreberi,Agrostis,Muhlenbergia
521050,Agrostis purpurascens Bertero ex Steud.,Panicum agrostoides Spreng.,Panicum agrostoides Spreng.,Steinchisma laxum (Sw.) Zuloaga,Steinchisma laxum,Coleataenia rigidula (Bosc ex Nees) LeBlond,Coleataenia rigidula,Steinchisma,Coleataenia
521107,Agrostis robinsonii Druce,Agrostis stolonifera L.,Agrostis stolonifera L.,Agrostis stolonifera L.,Agrostis stolonifera,Agropogon × robinsonii (Druce) Melderis & D.C.McClint.,Agropogon robinsonii,Agrostis,Agropogon
521427,Agrostis truncatula Parl.,Agrostis delicatula Pourr. ex Lapeyr.,Agrostis delicatula Pourr. ex Lapeyr.,Agrostis castellana Boiss. & Reut.,Agrostis castellana,"Agrostula truncatula (Parl.) P.M.Peterson, Romasch., Soreng & Sylvester",Agrostula truncatula,Agrostis,Agrostula
521428,Agrostis truncatula subsp. commista Castrov. & Charpin,Agrostis delicatula Pourr. ex Lapeyr.,Agrostis delicatula Pourr. ex Lapeyr.,Agrostis castellana Boiss. & Reut.,Agrostis castellana,"Agrostula truncatula subsp. durieui (Boiss. & Reut. ex Willk.) P.M.Peterson, Romasch., Soreng & Sylvester",Agrostula truncatula,Agrostis,Agrostula
521591,Aira brevifolia Pursh,Pseudosclerochloa rupestris (With.) Tzvelev,Pseudosclerochloa rupestris (With.) Tzvelev,Puccinellia rupestris (With.) Fernald & Weath.,Puccinellia rupestris,Poa secunda subsp. secunda ,Poa secunda,Puccinellia,Poa
521653,Aira corsica Tausch,Deschampsia media (Gouan) Roem. & Schult.,Deschampsia media (Gouan) Roem. & Schult.,Deschampsia media (Gouan) Roem. & Schult.,Deschampsia media,Avenella flexuosa subsp. corsica (Tausch) Holub,Avenella flexuosa,Deschampsia,Avenella
521712,Aira halleri Honck.,Trisetum rigidum (M.Bieb.) Roem. & Schult.,Trisetum rigidum (M.Bieb.) Roem. & Schult.,Trisetum rigidum (M.Bieb.) Roem. & Schult.,Trisetum rigidum,Acrospelion distichophyllum (Vill.) Barberá,Acrospelion distichophyllum,Trisetum,Acrospelion
521776,Aira missurica Spreng. ex B.D.Jacks.,Pseudosclerochloa rupestris (With.) Tzvelev,Pseudosclerochloa rupestris (With.) Tzvelev,Puccinellia rupestris (With.) Fernald & Weath.,Puccinellia rupestris,Poa secunda subsp. secunda ,Poa secunda,Puccinellia,Poa
521789,Aira nitida (J.Presl) Steud.,Calamagrostis tolucensis (Kunth) Trin. ex Steud.,Calamagrostis tolucensis (Kunth) Trin. ex Steud.,"Peyritschia tolucensis (Kunth) P.M.Peterson, Soreng, Romasch. & Barberá",Peyritschia tolucensis,Avenella flexuosa subsp. flexuosa ,Avenella flexuosa,Peyritschia,Avenella
521847,Aira scabrosetacea Knapp,Deschampsia flexuosa (L.) Trin.,Deschampsia flexuosa (L.) Trin.,Avenella flexuosa (L.) Drejer,Avenella flexuosa,Deschampsia setacea (Huds.) Hack.,Deschampsia setacea,Avenella,Deschampsia
521920,Airopsis brevifolia (Pursh) Roem. & Schult.,Pseudosclerochloa rupestris (With.) Tzvelev,Pseudosclerochloa rupestris (With.) Tzvelev,Puccinellia rupestris (With.) Fernald & Weath.,Puccinellia rupestris,Poa secunda subsp. secunda ,Poa secunda,Puccinellia,Poa
522899,Andropogon dulcis Burm.f.,Sorghum bicolor (L.) Moench,Sorghum bicolor (L.) Moench,Sorghum bicolor (L.) Moench,Sorghum bicolor,Eleocharis dulcis (Burm.f.) Trin. ex Hensch.,Eleocharis dulcis,Sorghum,Eleocharis
522901,Andropogon durus (Trin.) Steud.,Saccharum strictum (Host) Spreng.,Saccharum strictum (Host) Spreng.,Tripidium strictum (Host) H.Scholz,Tripidium strictum,Erianthus strictus Baldwin,Erianthus strictus,Tripidium,Erianthus
522957,Andropogon feensis E.Fourn.,Schizachyrium tenerum Nees,Schizachyrium tenerum Nees,Andropogon tener (Nees) Kunth,Andropogon tener,Schizachyrium sanguineum (Retz.) Alston,Schizachyrium sanguineum,Andropogon,Schizachyrium
523129,Andropogon hirtiflorus var. feensis (E.Fourn.) Hack.,Schizachyrium tenerum Nees,Schizachyrium tenerum Nees,Andropogon tener (Nees) Kunth,Andropogon tener,Schizachyrium sanguineum (Retz.) Alston,Schizachyrium sanguineum,Andropogon,Schizachyrium
523134,Andropogon hirtifolius var. pubiflorus (E.Fourn.) Hack.,Schizachyrium sanguineum (Retz.) Alston,Schizachyrium sanguineum (Retz.) Alston,Schizachyrium sanguineum (Retz.) Alston,Schizachyrium sanguineum,Bothriochloa hirtifolia (J.Presl) Henrard,Bothriochloa hirtifolia,Schizachyrium,Bothriochloa
523326,Andropogon luxurians Ekman,Schizachyrium tenerum Nees,Schizachyrium tenerum Nees,Andropogon tener (Nees) Kunth,Andropogon tener,Schizachyrium luxurians (Ekman) Peichoto & Welker,Schizachyrium luxurians,Andropogon,Schizachyrium
523415,Andropogon myosurus J.Presl,Schizachyrium tenerum Nees,Schizachyrium tenerum Nees,Andropogon tener (Nees) Kunth,Andropogon tener,Schizachyrium sanguineum (Retz.) Alston,Schizachyrium sanguineum,Andropogon,Schizachyrium
523621,Andropogon pubiflorus E.Fourn.,Schizachyrium sanguineum (Retz.) Alston,Schizachyrium sanguineum (Retz.) Alston,Schizachyrium sanguineum (Retz.) Alston,Schizachyrium sanguineum,Bothriochloa hirtifolia (J.Presl) Henrard,Bothriochloa hirtifolia,Schizachyrium,Bothriochloa
523710,Andropogon schaffneri Griseb. ex E.Fourn.,Schizachyrium sanguineum (Retz.) Alston,Schizachyrium sanguineum (Retz.) Alston,Schizachyrium sanguineum (Retz.) Alston,Schizachyrium sanguineum,Bothriochloa hirtifolia (J.Presl) Henrard,Bothriochloa hirtifolia,Schizachyrium,Bothriochloa
523867,Andropogon stolonifer (Nash) Hitchc.,Schizachyrium stoloniferum Nash,Schizachyrium stoloniferum Nash,Schizachyrium stoloniferum Nash,Schizachyrium stoloniferum,Andropogon stolonifer (Nash) Hitchc.,Andropogon stolonifer,Schizachyrium,Andropogon
523969,Andropogon undulatus Pers.,Bothriochloa ischaemum (L.) Keng,Bothriochloa ischaemum (L.) Keng,Bothriochloa ischaemum (L.) Keng,Bothriochloa ischaemum,Dichanthium annulatum var. annulatum ,Dichanthium annulatum,Bothriochloa,Dichanthium
524283,Anthosachne scabra (R.Br.) Nevski,Elymus scabrus (R.Br.) Á.Löve,Elymus scabrus (R.Br.) Á.Löve,Elymus scabrus (R.Br.) Á.Löve,Elymus scabrus,Anthosachne scabra (R.Br.) Nevski,Anthosachne scabra,Elymus,Anthosachne
524581,Aristavena setacea (Huds.) F.Albers & Butzin,Helictotrichon setaceum (Vill.) Henrard,Helictotrichon setaceum (Vill.) Henrard,Helictotrichon setaceum (Vill.) Henrard,Helictotrichon setaceum,Deschampsia setacea (Huds.) Hack.,Deschampsia setacea,Helictotrichon,Deschampsia
525255,Aristida pennata var. rigida Roshev.,Stipa pennata L.,Stipa pennata L.,Stipa pennata L.,Stipa pennata,Stipagrostis pennata (Trin.) De Winter,Stipagrostis pennata,Stipa,Stipagrostis
525679,Arrhenatherum pubescens (Huds.) Samp.,Helictotrichon pubescens (Huds.) Schult. & Schult.f.,Helictotrichon pubescens (Huds.) Schult. & Schult.f.,Helictotrichon pubescens (Huds.) Schult. & Schult.f.,Helictotrichon pubescens,Avenula pubescens (Huds.) Dumort.,Avenula pubescens,Helictotrichon,Avenula
525958,Chomelia panamensis (Standl.) Dwyer,Chomelia microloba Donn.Sm.,Chomelia microloba Donn.Sm.,Chomelia microloba Donn.Sm.,Chomelia microloba,Stenostomum acreanum (K.Krause) Achille & Delprete,Stenostomum acreanum,Chomelia,Stenostomum
525999,Arundarbor maxima (Poir.) Kuntze,Gigantochloa verticillata (Willd.) Munro,Gigantochloa verticillata (Willd.) Munro,Gigantochloa verticillata (Willd.) Munro,Gigantochloa verticillata,Bambusa bambos (L.) Voss,Bambusa bambos,Gigantochloa,Bambusa
526094,Arundinaria clarkei Gamble,Cephalostachyum mannii (Gamble) Stapleton,Cephalostachyum mannii (Gamble) Stapleton,Cephalostachyum mannii (Gamble) Stapleton,Cephalostachyum mannii,Melocanna clarkei (Gamble) P.Kumari & P.Singh,Melocanna clarkei,Cephalostachyum,Melocanna
526117,Chomelia recordii var. paucipubescens Dwyer,Chomelia recordii Standl.,Chomelia recordii Standl.,Chomelia recordii Standl.,Chomelia recordii,Randia armata subsp. panamensis (Standl.) Lorence,Randia armata,Chomelia,Randia
526201,Arundinaria ibityensis A.Camus,Thamnocalamus tessellatus (Nees) Soderstr. & R.P.Ellis,Thamnocalamus tessellatus (Nees) Soderstr. & R.P.Ellis,Bergbambos tessellata (Nees) Stapleton,Bergbambos tessellata,"Oldeania ibityensis (A.Camus) D.Z.Li, Y.X.Zhang & Haev.",Oldeania ibityensis,Bergbambos,Oldeania
526707,Arundo calamaria Salisb.,Stipa calamagrostis (L.) Wahlenb.,Stipa calamagrostis (L.) Wahlenb.,Achnatherum calamagrostis (L.) P.Beauv.,Achnatherum calamagrostis,Calamagrostis canescens (Weber) Roth,Calamagrostis canescens,Achnatherum,Calamagrostis
526750,Arundo egmontiana Roem. & Schult.,Phragmites australis (Cav.) Trin. ex Steud.,Phragmites australis (Cav.) Trin. ex Steud.,Phragmites australis (Cav.) Trin. ex Steud.,Phragmites australis,"Cortaderia egmontiana (Roem. & Schult.) M.Lyle ex Giussani, Soreng & Anton",Cortaderia egmontiana,Phragmites,Cortaderia
526815,Arundo neglecta Ehrh.,Calamagrostis stricta (Timm) Koeler,Calamagrostis stricta (Timm) Koeler,Calamagrostis stricta (Timm) Koeler,Calamagrostis stricta,Achnatherum calamagrostis (L.) P.Beauv.,Achnatherum calamagrostis,Calamagrostis,Achnatherum
527021,Atropis canbyi (Scribn.) Beal,Pseudosclerochloa rupestris (With.) Tzvelev,Pseudosclerochloa rupestris (With.) Tzvelev,Puccinellia rupestris (With.) Fernald & Weath.,Puccinellia rupestris,Poa secunda subsp. secunda ,Poa secunda,Puccinellia,Poa
527059,Atropis laevis Beal,Pseudosclerochloa rupestris (With.) Tzvelev,Pseudosclerochloa rupestris (With.) Tzvelev,Puccinellia rupestris (With.) Fernald & Weath.,Puccinellia rupestris,Poa secunda subsp. secunda ,Poa secunda,Puccinellia,Poa
527060,Atropis laevis var. rigida Beal,Pseudosclerochloa rupestris (With.) Tzvelev,Pseudosclerochloa rupestris (With.) Tzvelev,Puccinellia rupestris (With.) Fernald & Weath.,Puccinellia rupestris,Poa secunda subsp. secunda ,Poa secunda,Puccinellia,Poa
527092,Atropis scabrella Thurb.,Pseudosclerochloa rupestris (With.) Tzvelev,Pseudosclerochloa rupestris (With.) Tzvelev,Puccinellia rupestris (With.) Fernald & Weath.,Puccinellia rupestris,Poa secunda var. scabrella (Thurb.) Soreng,Poa secunda,Puccinellia,Poa
527098,Atropis tenuifolia Thurb.,Pseudosclerochloa rupestris (With.) Tzvelev,Pseudosclerochloa rupestris (With.) Tzvelev,Puccinellia rupestris (With.) Fernald & Weath.,Puccinellia rupestris,Poa secunda subsp. secunda ,Poa secunda,Puccinellia,Poa
527101,Atropis tenuifolia var. stenophylla Vasey ex Beal,Pseudosclerochloa rupestris (With.) Tzvelev,Pseudosclerochloa rupestris (With.) Tzvelev,Puccinellia rupestris (With.) Fernald & Weath.,Puccinellia rupestris,Poa secunda subsp. secunda ,Poa secunda,Puccinellia,Poa
527193,Austrodanthonia oreophila (H.P.Linder & N.G.Walsh) H.P.Linder,Chionochloa oreophila (Petrie) Zotov,Chionochloa oreophila (Petrie) Zotov,Chionochloa oreophila (Petrie) Zotov,Chionochloa oreophila,Rytidosperma oreophilum H.P.Linder & N.G.Walsh,Rytidosperma oreophilum,Chionochloa,Rytidosperma
527308,Avena alopecuros Roth,Helictotrichon pubescens (Huds.) Schult. & Schult.f.,Helictotrichon pubescens (Huds.) Schult. & Schult.f.,Helictotrichon pubescens (Huds.) Schult. & Schult.f.,Helictotrichon pubescens,Avenula pubescens (Huds.) Dumort.,Avenula pubescens,Helictotrichon,Avenula
527311,Avena alpina Latourr.,Helictotrichon versicolor (Vill.) Schult. & Schult.f.,Helictotrichon versicolor (Vill.) Schult. & Schult.f.,Helictotrichon versicolor (Vill.) Schult. & Schult.f.,Helictotrichon versicolor,Helictochloa versicolor subsp. versicolor ,Helictochloa versicolor,Helictotrichon,Helictochloa
527312,Chonemorpha dichotoma G.Don,Amphineurion marginatum (Roxb.) D.J.Middleton,Amphineurion marginatum (Roxb.) D.J.Middleton,Amphineurion marginatum (Roxb.) D.J.Middleton,Amphineurion marginatum,Aganosma heynei (Spreng.) I.M.Turner,Aganosma heynei,Amphineurion,Aganosma
527318,Avena amethystina DC.,Helictotrichon pubescens (Huds.) Schult. & Schult.f.,Helictotrichon pubescens (Huds.) Schult. & Schult.f.,Helictotrichon pubescens (Huds.) Schult. & Schult.f.,Helictotrichon pubescens,Avenula pubescens (Huds.) Dumort.,Avenula pubescens,Helictotrichon,Avenula
527332,Avena aspera var. parviflora Hook.f.,Helictotrichon junghuhnii (Buse) Henrard,Helictotrichon junghuhnii (Buse) Henrard,Trisetopsis junghuhnii (Buse) Röser & A.Wölk,Trisetopsis junghuhnii,Tzveleviochloa parviflora (Hook.f.) Röser & A.Wölk,Tzveleviochloa parviflora,Trisetopsis,Tzveleviochloa
527341,Avena balloniana Kirschl.,Helictotrichon pubescens (Huds.) Schult. & Schult.f.,Helictotrichon pubescens (Huds.) Schult. & Schult.f.,Helictotrichon pubescens (Huds.) Schult. & Schult.f.,Helictotrichon pubescens,Avenula pubescens (Huds.) Dumort.,Avenula pubescens,Helictotrichon,Avenula
527356,Avena baumgartenii Steud.,Helictotrichon pubescens (Huds.) Schult. & Schult.f.,Helictotrichon pubescens (Huds.) Schult. & Schult.f.,Helictotrichon pubescens (Huds.) Schult. & Schult.f.,Helictotrichon pubescens,Avenula pubescens (Huds.) Dumort.,Avenula pubescens,Helictotrichon,Avenula
527362,Avena bornmuelleri Domin,Helictotrichon pubescens (Huds.) Schult. & Schult.f.,Helictotrichon pubescens (Huds.) Schult. & Schult.f.,Helictotrichon pubescens (Huds.) Schult. & Schult.f.,Helictotrichon pubescens,Avenula pubescens (Huds.) Dumort.,Avenula pubescens,Helictotrichon,Avenula
527395,Avena carpatica Host,Helictotrichon pubescens (Huds.) Schult. & Schult.f.,Helictotrichon pubescens (Huds.) Schult. & Schult.f.,Helictotrichon pubescens (Huds.) Schult. & Schult.f.,Helictotrichon pubescens,Avenula pubescens (Huds.) Dumort.,Avenula pubescens,Helictotrichon,Avenula
527517,Avena glabra K.Koch,Helictotrichon pubescens (Huds.) Schult. & Schult.f.,Helictotrichon pubescens (Huds.) Schult. & Schult.f.,Helictotrichon pubescens (Huds.) Schult. & Schult.f.,Helictotrichon pubescens,Avenula pubescens (Huds.) Dumort.,Avenula pubescens,Helictotrichon,Avenula
527532,Avena hirtifolia Boiss.,Helictotrichon pubescens (Huds.) Schult. & Schult.f.,Helictotrichon pubescens (Huds.) Schult. & Schult.f.,Helictotrichon pubescens (Huds.) Schult. & Schult.f.,Helictotrichon pubescens,Avenula pubescens (Huds.) Dumort.,Avenula pubescens,Helictotrichon,Avenula
527542,Avena hugeninii De Not. ex Steud.,Helictotrichon pubescens (Huds.) Schult. & Schult.f.,Helictotrichon pubescens (Huds.) Schult. & Schult.f.,Helictotrichon pubescens (Huds.) Schult. & Schult.f.,Helictotrichon pubescens,Avenula pubescens (Huds.) Dumort.,Avenula pubescens,Helictotrichon,Avenula
527545,Avena insubrica (Asch. & Graebn.) Dalla Torre & Sarnth.,Helictotrichon pubescens (Huds.) Schult. & Schult.f.,Helictotrichon pubescens (Huds.) Schult. & Schult.f.,Helictotrichon pubescens (Huds.) Schult. & Schult.f.,Helictotrichon pubescens,Avenula pubescens (Huds.) Dumort.,Avenula pubescens,Helictotrichon,Avenula
527558,Avena laevigata Schur,Helictotrichon pubescens (Huds.) Schult. & Schult.f.,Helictotrichon pubescens (Huds.) Schult. & Schult.f.,Helictotrichon pubescens (Huds.) Schult. & Schult.f.,Helictotrichon pubescens,Avenula pubescens (Huds.) Dumort.,Avenula pubescens,Helictotrichon,Avenula
527559,Avena laevigata var. insubrica Asch. & Graebn.,Helictotrichon pubescens (Huds.) Schult. & Schult.f.,Helictotrichon pubescens (Huds.) Schult. & Schult.f.,Helictotrichon pubescens (Huds.) Schult. & Schult.f.,Helictotrichon pubescens,Avenula pubescens (Huds.) Dumort.,Avenula pubescens,Helictotrichon,Avenula
527580,Avena lucida Bertol.,Helictotrichon pubescens (Huds.) Schult. & Schult.f.,Helictotrichon pubescens (Huds.) Schult. & Schult.f.,Helictotrichon pubescens (Huds.) Schult. & Schult.f.,Helictotrichon pubescens,Avenula pubescens (Huds.) Dumort.,Avenula pubescens,Helictotrichon,Avenula
527710,Avena pseudolucida Schur,Helictotrichon pubescens (Huds.) Schult. & Schult.f.,Helictotrichon pubescens (Huds.) Schult. & Schult.f.,Helictotrichon pubescens (Huds.) Schult. & Schult.f.,Helictotrichon pubescens,Avenula pubescens (Huds.) Dumort.,Avenula pubescens,Helictotrichon,Avenula
527714,Avena pubescens Huds.,Helictotrichon pubescens (Huds.) Schult. & Schult.f.,Helictotrichon pubescens (Huds.) Schult. & Schult.f.,Helictotrichon pubescens (Huds.) Schult. & Schult.f.,Helictotrichon pubescens,Avenula pubescens (Huds.) Dumort.,Avenula pubescens,Helictotrichon,Avenula
527715,Avena pubescens f. diantha Heuff.,Helictotrichon pubescens (Huds.) Schult. & Schult.f.,Helictotrichon pubescens (Huds.) Schult. & Schult.f.,Helictotrichon pubescens (Huds.) Schult. & Schult.f.,Helictotrichon pubescens,Avenula pubescens (Huds.) Dumort.,Avenula pubescens,Helictotrichon,Avenula
527716,Avena pubescens f. latifolia Printz,Helictotrichon pubescens (Huds.) Schult. & Schult.f.,Helictotrichon pubescens (Huds.) Schult. & Schult.f.,Helictotrichon pubescens (Huds.) Schult. & Schult.f.,Helictotrichon pubescens,Avenula pubescens (Huds.) Dumort.,Avenula pubescens,Helictotrichon,Avenula
527717,Avena pubescens f. stenophylla Domin,Helictotrichon pubescens (Huds.) Schult. & Schult.f.,Helictotrichon pubescens (Huds.) Schult. & Schult.f.,Helictotrichon pubescens (Huds.) Schult. & Schult.f.,Helictotrichon pubescens,Avenula pubescens (Huds.) Dumort.,Avenula pubescens,Helictotrichon,Avenula
527718,Avena pubescens subsp. insubrica (Asch. & Graebn.) Hegi,Helictotrichon pubescens (Huds.) Schult. & Schult.f.,Helictotrichon pubescens (Huds.) Schult. & Schult.f.,Helictotrichon pubescens (Huds.) Schult. & Schult.f.,Helictotrichon pubescens,Avenula pubescens (Huds.) Dumort.,Avenula pubescens,Helictotrichon,Avenula
527719,Avena pubescens var. alpina Gaudin,Helictotrichon pubescens (Huds.) Schult. & Schult.f.,Helictotrichon pubescens (Huds.) Schult. & Schult.f.,Helictotrichon pubescens (Huds.) Schult. & Schult.f.,Helictotrichon pubescens,Avenula pubescens (Huds.) Dumort.,Avenula pubescens,Helictotrichon,Avenula
527720,Avena pubescens var. glabrescens Schur,Helictotrichon pubescens (Huds.) Schult. & Schult.f.,Helictotrichon pubescens (Huds.) Schult. & Schult.f.,Helictotrichon pubescens (Huds.) Schult. & Schult.f.,Helictotrichon pubescens,Avenula pubescens (Huds.) Dumort.,Avenula pubescens,Helictotrichon,Avenula
