154139,Palicourea insularis Ridl.,Erithalis fruticosa L.,Erithalis fruticosa L.,Erithalis fruticosa L.,Erithalis fruticosa,Chiococca insularis (Ridl.) C.M.Taylor & M.R.V.Barbosa,Chiococca insularis,Erithalis,Chiococca
155315,Papilionanthe cylindrica (Lindl.) Seidenf.,Papilionanthe subulata (Willd.) Garay,Papilionanthe subulata (Willd.) Garay,Thrixspermum filiforme (Hook.f.) Kuntze,Thrixspermum filiforme,Papilionanthe cylindrica (Lindl.) Seidenf.,Papilionanthe cylindrica,Thrixspermum,Papilionanthe
155667,Parechites bowringii Hance,Trachelospermum jasminoides (Lindl.) Lem.,Trachelospermum jasminoides (Lindl.) Lem.,Trachelospermum jasminoides (Lindl.) Lem.,Trachelospermum jasminoides,Gymnanthera oblonga (Burm.f.) P.S.Green,Gymnanthera oblonga,Trachelospermum,Gymnanthera
158343,Petesia carnosa Hook. & Arn.,Bikkia tetrandra (L.f.) A.Rich.,Bikkia tetrandra (L.f.) A.Rich.,Bikkia tetrandra (L.f.) A.Rich.,Bikkia tetrandra,Kadua romanzoffiensis Cham. & Schltdl.,Kadua romanzoffiensis,Bikkia,Kadua
161268,Phyllanthus flueggeiformis Müll.Arg.,Flueggea virosa (Roxb. ex Willd.) Royle,Flueggea virosa (Roxb. ex Willd.) Royle,Flueggea virosa (Roxb. ex Willd.) Royle,Flueggea virosa,Phyllanthus glaucus Wall. ex Müll.Arg.,Phyllanthus glaucus,Flueggea,Phyllanthus
161335,Phyllanthus glaucus Wall. ex Müll.Arg.,Flueggea virosa (Roxb. ex Willd.) Royle,Flueggea virosa (Roxb. ex Willd.) Royle,Flueggea virosa (Roxb. ex Willd.) Royle,Flueggea virosa,Phyllanthus glaucus Wall. ex Müll.Arg.,Phyllanthus glaucus,Flueggea,Phyllanthus
162154,Phyllanthus racemosus L.f.,Sauropus bacciformis (L.) Airy Shaw,Sauropus bacciformis (L.) Airy Shaw,Synostemon bacciformis (L.) G.L.Webster,Synostemon bacciformis,Phyllanthus racemosus L.f.,Phyllanthus racemosus,Synostemon,Phyllanthus
163592,Pinalia carinata (Gibson) Kuntze,Eria carinata Gibson,Eria carinata Gibson,Eria carinata Gibson,Eria carinata,"Cryptochilus acuminatus (Griff.) Schuit., Y.P.Ng & H.A.Pedersen",Cryptochilus acuminatus,Eria,Cryptochilus
164121,Planchonella africana (A.DC.) Baehni,Chrysophyllum africanum A.DC.,Chrysophyllum africanum A.DC.,Chrysophyllum africanum A.DC.,Chrysophyllum africanum,Gambeya africana Pierre,Gambeya africana,Chrysophyllum,Gambeya
164123,Planchonella albida (G.Don) Baehni,Chrysophyllum albidum G.Don,Chrysophyllum albidum G.Don,Chrysophyllum albidum G.Don,Chrysophyllum albidum,Gambeya albida (G.Don) Aubrév. & Pellegr.,Gambeya albida,Chrysophyllum,Gambeya
164133,Planchonella brownlessiana (F.Muell.) P.Royen,"Beccariella brownlessiana (F.Muell.) Swenson, Bartish & Munzinger","Beccariella brownlessiana (F.Muell.) Swenson, Bartish & Munzinger","Beccariella brownlessiana (F.Muell.) Swenson, Bartish & Munzinger",Beccariella brownlessiana,Pleioluma brownlessiana (F.Muell.) Swenson & Munzinger,Pleioluma brownlessiana,Beccariella,Pleioluma
164153,Planchonella dubia (Pierre ex Guillaumin) P.Royen,Beccariella lasiantha (Baill.) Aubrév.,Beccariella lasiantha (Baill.) Aubrév.,Beccariella lasiantha (Baill.) Aubrév.,Beccariella lasiantha,Pichonia dubia (Pierre ex Guillaumin) Swenson & Munzinger,Pichonia dubia,Beccariella,Pichonia
164176,Planchonella krausei H.J.Lam,Pouteria krausei (H.J.Lam) Baehni,Pouteria krausei (H.J.Lam) Baehni,Pouteria krausei (H.J.Lam) Baehni,Pouteria krausei,Pleioluma krausei (H.J.Lam) Swenson,Pleioluma krausei,Pouteria,Pleioluma
164185,Planchonella lecardii (Baill.) Guillaumin,Beccariella balansana (Pierre ex Baill.) Aubrév.,Beccariella balansana (Pierre ex Baill.) Aubrév.,Beccariella balansana (Pierre ex Baill.) Aubrév.,Beccariella balansana,Pleioluma balansana (Baill.) Swenson & Munzinger,Pleioluma balansana,Beccariella,Pleioluma
164207,Planchonella novocaledonica Dubard,Beccariella novocaledonica (Dubard) Aubrév.,Beccariella novocaledonica (Dubard) Aubrév.,Beccariella novocaledonica (Dubard) Aubrév.,Beccariella novocaledonica,Pleioluma novocaledonica (Dubard) Swenson & Munzinger,Pleioluma novocaledonica,Beccariella,Pleioluma
164244,Planchonella subnuda (Baker) Baehni,Chrysophyllum subnudum Baker,Chrysophyllum subnudum Baker,Chrysophyllum subnudum Baker,Chrysophyllum subnudum,Gambeya subnuda Pierre,Gambeya subnuda,Chrysophyllum,Gambeya
165231,Plectranthus cooperi T.Cooke,Plectranthus dolichopodus Briq.,Plectranthus dolichopodus Briq.,Coleus dolichopodus (Briq.) A.J.Paton,Coleus dolichopodus,Plectranthus grallatus Briq.,Plectranthus grallatus,Coleus,Plectranthus
165533,Plectranthus moschatus R.Br.,Plectranthus parviflorus Willd.,Plectranthus parviflorus Willd.,Coleus australis (R.Br.) A.J.Paton,Coleus australis,Basilicum polystachyon (L.) Moench,Basilicum polystachyon,Coleus,Basilicum
166309,Pleurothallis alexandrae Schltr.,Acianthera glumacea (Lindl.) Pridgeon & M.W.Chase,Acianthera glumacea (Lindl.) Pridgeon & M.W.Chase,Acianthera glumacea (Lindl.) Pridgeon & M.W.Chase,Acianthera glumacea,Echinosepala alexandrae (Schltr.) Pupulin & Bogarín,Echinosepala alexandrae,Acianthera,Echinosepala
167425,Pleurothallis macrorhiza Lindl.,Stelis purpurea (Ruiz & Pav.) Willd.,Stelis purpurea (Ruiz & Pav.) Willd.,Stelis purpurea (Ruiz & Pav.) Willd.,Stelis purpurea,Andinia spiralis (Ruiz & Pav.) Karremans & Mark Wilson,Andinia spiralis,Stelis,Andinia
167530,Pleurothallis minutissima Luer,Anathallis barbulata (Lindl.) Pridgeon & M.W.Chase,Anathallis barbulata (Lindl.) Pridgeon & M.W.Chase,Anathallis barbulata (Lindl.) Pridgeon & M.W.Chase,Anathallis barbulata,Specklinia minutissima (Luer) Luer,Specklinia minutissima,Anathallis,Specklinia
167796,Pleurothallis pfisteri Braem & Braas,Anathallis bocainensis (Porto & Brade) F.Barros & Barberena,Anathallis bocainensis (Porto & Brade) F.Barros & Barberena,Anathallis bocainensis (Porto & Brade) F.Barros & Barberena,Anathallis bocainensis,Pabstiella pleurothalloides (Cogn.) Luer,Pabstiella pleurothalloides,Anathallis,Pabstiella
168167,Pleurothallis spiralis (Ruiz & Pav.) Lindl.,Stelis purpurea (Ruiz & Pav.) Willd.,Stelis purpurea (Ruiz & Pav.) Willd.,Stelis purpurea (Ruiz & Pav.) Willd.,Stelis purpurea,Andinia spiralis (Ruiz & Pav.) Karremans & Mark Wilson,Andinia spiralis,Stelis,Andinia
168306,Pleurothallis tricostata Cogn.,Stelis quadrifida (Lex.) Solano & Soto Arenas,Stelis quadrifida (Lex.) Solano & Soto Arenas,Pleurothallis quadrifida (Lex.) Lindl.,Pleurothallis quadrifida,Stelis multirostris (Rchb.f.) Pridgeon & M.W.Chase,Stelis multirostris,Pleurothallis,Stelis
168499,Plinia asa-grayi (Krug & Urb.) Urb.,Myrciaria floribunda (H.West ex Willd.) O.Berg,Myrciaria floribunda (H.West ex Willd.) O.Berg,Myrciaria floribunda (H.West ex Willd.) O.Berg,Myrciaria floribunda,Plinia asa-grayi (Krug & Urb.) Urb.,Plinia asa-grayi,Myrciaria,Plinia
168522,Plinia formosa Urb.,Myrciaria floribunda (H.West ex Willd.) O.Berg,Myrciaria floribunda (H.West ex Willd.) O.Berg,Myrciaria floribunda (H.West ex Willd.) O.Berg,Myrciaria floribunda,Plinia formosa Urb.,Plinia formosa,Myrciaria,Plinia
168637,Arum foetidum Salisb.,Arum italicum Mill.,Arum italicum Mill.,Arum italicum Mill.,Arum italicum,Typhonium trilobatum (L.) Schott,Typhonium trilobatum,Arum,Typhonium
169808,Arum montanum Roxb.,Alocasia macrorrhizos (L.) G.Don,Alocasia macrorrhizos (L.) G.Don,Alocasia macrorrhizos (L.) G.Don,Alocasia macrorrhizos,"Englerarum montanum (Roxb.) P.C.Boyce, K.Z.Hein & A.Hay",Englerarum montanum,Alocasia,Englerarum
170904,Pouteria balansana (Pierre ex Baill.) Baehni,Beccariella balansana (Pierre ex Baill.) Aubrév.,Beccariella balansana (Pierre ex Baill.) Aubrév.,Beccariella balansana (Pierre ex Baill.) Aubrév.,Beccariella balansana,Pleioluma balansana (Baill.) Swenson & Munzinger,Pleioluma balansana,Beccariella,Pleioluma
170922,Pouteria brachyloba (Domin) Baehni,"Beccariella brownlessiana (F.Muell.) Swenson, Bartish & Munzinger","Beccariella brownlessiana (F.Muell.) Swenson, Bartish & Munzinger","Beccariella brownlessiana (F.Muell.) Swenson, Bartish & Munzinger",Beccariella brownlessiana,Pleioluma brownlessiana (F.Muell.) Swenson & Munzinger,Pleioluma brownlessiana,Beccariella,Pleioluma
170929,Pouteria brownlessiana (F.Muell.) Baehni,"Beccariella brownlessiana (F.Muell.) Swenson, Bartish & Munzinger","Beccariella brownlessiana (F.Muell.) Swenson, Bartish & Munzinger","Beccariella brownlessiana (F.Muell.) Swenson, Bartish & Munzinger",Beccariella brownlessiana,Pleioluma brownlessiana (F.Muell.) Swenson & Munzinger,Pleioluma brownlessiana,Beccariella,Pleioluma
170977,Pouteria crebrifolia (Baill.) Baehni,Beccariella crebrifolia (Baill.) Aubrév.,Beccariella crebrifolia (Baill.) Aubrév.,Beccariella crebrifolia (Baill.) Aubrév.,Beccariella crebrifolia,Pleioluma crebrifolia (Baill.) Swenson & Munzinger,Pleioluma crebrifolia,Beccariella,Pleioluma
171002,Pouteria dolichosperma (H.J.Lam) Baehni,Pouteria macrantha (Merr.) Baehni,Pouteria macrantha (Merr.) Baehni,Pouteria macrantha (Merr.) Baehni,Pouteria macrantha,Planchonella macrantha (Merr.) Swenson,Planchonella macrantha,Pouteria,Planchonella
171020,Pouteria egassia Baehni,Beccariella novocaledonica (Dubard) Aubrév.,Beccariella novocaledonica (Dubard) Aubrév.,Beccariella novocaledonica (Dubard) Aubrév.,Beccariella novocaledonica,Pleioluma novocaledonica (Dubard) Swenson & Munzinger,Pleioluma novocaledonica,Beccariella,Pleioluma
171107,Pouteria lasiantha (Baill.) Baehni,Beccariella lasiantha (Baill.) Aubrév.,Beccariella lasiantha (Baill.) Aubrév.,Beccariella lasiantha (Baill.) Aubrév.,Beccariella lasiantha,Pleioluma lasiantha (Baill.) Swenson & Munzinger,Pleioluma lasiantha,Beccariella,Pleioluma
171112,Pouteria lecardii (Baill.) Baehni,Beccariella balansana (Pierre ex Baill.) Aubrév.,Beccariella balansana (Pierre ex Baill.) Aubrév.,Beccariella balansana (Pierre ex Baill.) Aubrév.,Beccariella balansana,Pleioluma balansana (Baill.) Swenson & Munzinger,Pleioluma balansana,Beccariella,Pleioluma
171135,Pouteria macropoda (H.J.Lam) Baehni,Planchonella macropoda H.J.Lam,Planchonella macropoda H.J.Lam,Planchonella macropoda H.J.Lam,Planchonella macropoda,Pleioluma macropoda (H.J.Lam) Swenson,Pleioluma macropoda,Planchonella,Pleioluma
171171,Pouteria navicularis (H.J.Lam) Baehni,Pouteria maclayana (F.Muell.) Baehni,Pouteria maclayana (F.Muell.) Baehni,Pouteria maclayana (F.Muell.) Baehni,Pouteria maclayana,Planchonella maclayana (F.Muell.) Swenson,Planchonella maclayana,Pouteria,Planchonella
171358,Pouteria xerocarpa (F.Muell. ex Benth.) Baehni,Beccariella xerocarpa (F.Muell. ex Benth.) Aubrév.,Beccariella xerocarpa (F.Muell. ex Benth.) Aubrév.,Beccariella xerocarpa (F.Muell. ex Benth.) Aubrév.,Beccariella xerocarpa,Pleioluma xerocarpa (F.Muell. ex Benth.) Swenson,Pleioluma xerocarpa,Beccariella,Pleioluma
172075,Prescottia pteristyloides Kraenzl.,Altensteinia marginata Rchb.f.,Altensteinia marginata Rchb.f.,Altensteinia marginata Rchb.f.,Altensteinia marginata,Stenoptera montana C.Schweinf.,Stenoptera montana,Altensteinia,Stenoptera
173331,Psidium hians Mart. ex DC.,Campomanesia pubescens (Mart. ex DC.) O.Berg,Campomanesia pubescens (Mart. ex DC.) O.Berg,Campomanesia pubescens (Mart. ex DC.) O.Berg,Campomanesia pubescens,Psidium guineense Sw.,Psidium guineense,Campomanesia,Psidium
174376,Psychotria didymocarpos (A.Rich. ex DC.) Lemée,Psychotria bahiensis DC.,Psychotria bahiensis DC.,Psychotria bahiensis DC.,Psychotria bahiensis,Palicourea didymocarpa (A.Rich. ex DC.) Griseb.,Palicourea didymocarpa,Psychotria,Palicourea
174448,Psychotria edaphothrix Steyerm.,Palicourea virens (Poepp.) Standl.,Palicourea virens (Poepp.) Standl.,Palicourea virens (Poepp.) Standl.,Palicourea virens,Psychotria edaphothrix Steyerm.,Psychotria edaphothrix,Palicourea,Psychotria
175439,Psychotria morindoides (A.Rich. ex DC.) Lemée,Ronabea latifolia Aubl.,Ronabea latifolia Aubl.,Ronabea latifolia Aubl.,Ronabea latifolia,"Appunia morindoides (A.Rich. ex DC.) Delprete, C.M.Taylor & T.McDowell",Appunia morindoides,Ronabea,Appunia
175544,Psychotria novoguineensis Warb. ex Valeton,Psychotria apiculata Müll.Arg.,Psychotria apiculata Müll.Arg.,Palicourea apiculata (Müll.Arg.) C.M.Taylor,Palicourea apiculata,Psychotria warburgiana A.P.Davis,Psychotria warburgiana,Palicourea,Psychotria
176021,Psychotria rhodocarpa Teijsm. & Binn.,Psychotria sangeana (Miq.) Merr.,Psychotria sangeana (Miq.) Merr.,Pavetta sylvatica Blume,Pavetta sylvatica,"Eumachia horsfieldiana (Miq.) Barrabé, C.M.Taylor & Razafim.",Eumachia horsfieldiana,Pavetta,Eumachia
176462,Psychotria tetrandra Blume,Chassalia curviflora (Wall.) Thwaites,Chassalia curviflora (Wall.) Thwaites,Chassalia curviflora (Wall.) Thwaites,Chassalia curviflora,Eumachia rostrata (Blume) I.M.Turner,Eumachia rostrata,Chassalia,Eumachia
177089,Achras brownlessiana F.Muell.,"Beccariella brownlessiana (F.Muell.) Swenson, Bartish & Munzinger","Beccariella brownlessiana (F.Muell.) Swenson, Bartish & Munzinger","Beccariella brownlessiana (F.Muell.) Swenson, Bartish & Munzinger",Beccariella brownlessiana,Pleioluma brownlessiana (F.Muell.) Swenson & Munzinger,Pleioluma brownlessiana,Beccariella,Pleioluma
179532,Achras laurifolia F.Muell. ex Benth.,Pouteria richardii (F.Muell.) Baehni,Pouteria richardii (F.Muell.) Baehni,Pouteria richardii (F.Muell.) Baehni,Pouteria richardii,Pleioluma laurifolia (A.Rich.) Swenson,Pleioluma laurifolia,Pouteria,Pleioluma
182710,Restrepia liebmanniana Kraenzl.,Acianthera strupifolia (Lindl.) Pridgeon & M.W.Chase,Acianthera strupifolia (Lindl.) Pridgeon & M.W.Chase,Acianthera strupifolia (Lindl.) Pridgeon & M.W.Chase,Acianthera strupifolia,Andreettaea marginata (Rich.) A.Doucette,Andreettaea marginata,Acianthera,Andreettaea
183185,Rhapis laosensis Becc.,Rhapis cochinchinensis (Lour.) Mart.,Rhapis cochinchinensis (Lour.) Mart.,Livistona saribus (Lour.) Merr. ex A.Chev.,Livistona saribus,Rhapis laosensis Becc.,Rhapis laosensis,Livistona,Rhapis
183186,Rhapis macrantha Gagnep.,Rhapis cochinchinensis (Lour.) Mart.,Rhapis cochinchinensis (Lour.) Mart.,Livistona saribus (Lour.) Merr. ex A.Chev.,Livistona saribus,Rhapis laosensis subsp. macrantha (Gagnep.) A.J.Hend.,Rhapis laosensis,Livistona,Rhapis
183570,Richardella unmackiana (F.M.Bailey) Baehni,Pouteria unmackiana (F.M.Bailey) Erlee,Pouteria unmackiana (F.M.Bailey) Erlee,Pouteria unmackiana (F.M.Bailey) Erlee,Pouteria unmackiana,Sersalisia unmackiana Domin,Sersalisia unmackiana,Pouteria,Sersalisia
183760,Achras xerocarpa F.Muell. ex Benth.,Beccariella xerocarpa (F.Muell. ex Benth.) Aubrév.,Beccariella xerocarpa (F.Muell. ex Benth.) Aubrév.,Beccariella xerocarpa (F.Muell. ex Benth.) Aubrév.,Beccariella xerocarpa,Pleioluma xerocarpa (F.Muell. ex Benth.) Swenson,Pleioluma xerocarpa,Beccariella,Pleioluma
184218,Ronabea didymocarpos A.Rich. ex DC.,Psychotria bahiensis DC.,Psychotria bahiensis DC.,Psychotria bahiensis DC.,Psychotria bahiensis,Palicourea didymocarpa (A.Rich. ex DC.) Griseb.,Palicourea didymocarpa,Psychotria,Palicourea
184224,Ronabea morindoides A.Rich. ex DC.,Ronabea latifolia Aubl.,Ronabea latifolia Aubl.,Ronabea latifolia Aubl.,Ronabea latifolia,"Appunia morindoides (A.Rich. ex DC.) Delprete, C.M.Taylor & T.McDowell",Appunia morindoides,Ronabea,Appunia
185233,Rudgea chiriquiensis Dwyer,Psychotria nebulosa K.Krause,Psychotria nebulosa K.Krause,Psychotria nebulosa K.Krause,Psychotria nebulosa,Palicourea horquetensis (Dwyer & M.V.Hayden) A.C.Berger & C.M.Taylor,Palicourea horquetensis,Psychotria,Palicourea
189053,Sapium rhombifolium Rusby,Sebastiania brasiliensis Spreng.,Sebastiania brasiliensis Spreng.,Sebastiania brasiliensis Spreng.,Sebastiania brasiliensis,Pleradenophora membranifolia (Müll.Arg.) Esser & A.L.Melo,Pleradenophora membranifolia,Sebastiania,Pleradenophora
189273,Sarcanthus ornithorrhynchus Rchb.f.,Robiquetia rosea (Lindl.) Garay,Robiquetia rosea (Lindl.) Garay,Robiquetia rosea (Lindl.) Garay,Robiquetia rosea,Cleisostoma discolor Lindl.,Cleisostoma discolor,Robiquetia,Cleisostoma
190770,Sauroglossum elatum Lindl.,Sauroglossum nitidum (Vell.) Schltr.,Sauroglossum nitidum (Vell.) Schltr.,Buchtienia nitida (Vell.) Fraga & Meneguzzo,Buchtienia nitida,Sauroglossum elatum Lindl.,Sauroglossum elatum,Buchtienia,Sauroglossum
194421,Sebastiania rhombifolia (Rusby) Jabl.,Sebastiania brasiliensis Spreng.,Sebastiania brasiliensis Spreng.,Sebastiania brasiliensis Spreng.,Sebastiania brasiliensis,Pleradenophora membranifolia (Müll.Arg.) Esser & A.L.Melo,Pleradenophora membranifolia,Sebastiania,Pleradenophora
194446,Sebertia dubia Pierre ex Guillaumin,Beccariella lasiantha (Baill.) Aubrév.,Beccariella lasiantha (Baill.) Aubrév.,Beccariella lasiantha (Baill.) Aubrév.,Beccariella lasiantha,Pichonia dubia (Pierre ex Guillaumin) Swenson & Munzinger,Pichonia dubia,Beccariella,Pichonia
194885,Sersalisia brachyloba Domin,"Beccariella brownlessiana (F.Muell.) Swenson, Bartish & Munzinger","Beccariella brownlessiana (F.Muell.) Swenson, Bartish & Munzinger","Beccariella brownlessiana (F.Muell.) Swenson, Bartish & Munzinger",Beccariella brownlessiana,Pleioluma brownlessiana (F.Muell.) Swenson & Munzinger,Pleioluma brownlessiana,Beccariella,Pleioluma
194893,Sersalisia laurifolia A.Rich.,Pouteria richardii (F.Muell.) Baehni,Pouteria richardii (F.Muell.) Baehni,Pouteria richardii (F.Muell.) Baehni,Pouteria richardii,Pleioluma laurifolia (A.Rich.) Swenson,Pleioluma laurifolia,Pouteria,Pleioluma
195619,Sideroxylon adolfi-friedericii Engl.,Pouteria adolfi-friedericii (Engl.) A.Meeuse,Pouteria adolfi-friedericii (Engl.) A.Meeuse,Pouteria adolfi-friedericii (Engl.) A.Meeuse,Pouteria adolfi-friedericii,Aningeria adolfi-friederici (Engl.) Robyns & Gilbert,Aningeria adolfi-friederici,Pouteria,Aningeria
195767,Sideroxylon lasianthum Baill.,Beccariella lasiantha (Baill.) Aubrév.,Beccariella lasiantha (Baill.) Aubrév.,Beccariella lasiantha (Baill.) Aubrév.,Beccariella lasiantha,Pleioluma lasiantha (Baill.) Swenson & Munzinger,Pleioluma lasiantha,Beccariella,Pleioluma
195770,Sideroxylon lecardii Baill.,Beccariella balansana (Pierre ex Baill.) Aubrév.,Beccariella balansana (Pierre ex Baill.) Aubrév.,Beccariella balansana (Pierre ex Baill.) Aubrév.,Beccariella balansana,Pleioluma balansana (Baill.) Swenson & Munzinger,Pleioluma balansana,Beccariella,Pleioluma
195778,Sideroxylon luzoniense Merr.,Pouteria luzoniensis (Merr.) Baehni,Pouteria luzoniensis (Merr.) Baehni,Pouteria luzoniensis (Merr.) Baehni,Pouteria luzoniensis,Sersalisia luzoniensis (Merr.) Swenson,Sersalisia luzoniensis,Pouteria,Sersalisia
195781,Sideroxylon macranthum Merr.,Pouteria macrantha (Merr.) Baehni,Pouteria macrantha (Merr.) Baehni,Pouteria macrantha (Merr.) Baehni,Pouteria macrantha,Planchonella macrantha (Merr.) Swenson,Planchonella macrantha,Pouteria,Planchonella
195798,Sideroxylon microcarpum Burck,Planchonella firma var. microcarpa (Burck) H.J.Lam,Planchonella firma var. microcarpa (Burck) H.J.Lam,Planchonella firma var. microcarpa (Burck) H.J.Lam,Planchonella firma,Pleioluma firma (Miq.) Swenson,Pleioluma firma,Planchonella,Pleioluma
195859,Sideroxylon richardii F.Muell.,Pouteria richardii (F.Muell.) Baehni,Pouteria richardii (F.Muell.) Baehni,Pouteria richardii (F.Muell.) Baehni,Pouteria richardii,Pleioluma laurifolia (A.Rich.) Swenson,Pleioluma laurifolia,Pouteria,Pleioluma
195888,Sideroxylon stenophyllum Merr.,Pouteria macrantha (Merr.) Baehni,Pouteria macrantha (Merr.) Baehni,Pouteria macrantha (Merr.) Baehni,Pouteria macrantha,Planchonella macrantha (Merr.) Swenson,Planchonella macrantha,Pouteria,Planchonella
195910,Sideroxylon zippelianum Pierre ex Boerl.,Pouteria maclayana (F.Muell.) Baehni,Pouteria maclayana (F.Muell.) Baehni,Pouteria maclayana (F.Muell.) Baehni,Pouteria maclayana,Planchonella maclayana (F.Muell.) Swenson,Planchonella maclayana,Pouteria,Planchonella
196120,Sipanea palustris (A.Rich. ex DC.) J.H.Kirkbr.,Sipanea wilson-brownei Cowan,Sipanea wilson-brownei Cowan,Sipanea wilson-brownei Cowan,Sipanea wilson-brownei,Neobertiera palustris (A.Rich. ex DC.) Delprete,Neobertiera palustris,Sipanea,Neobertiera
196939,Spermacoce affinis Pohl ex DC.,Mitracarpus hirtus (L.) DC.,Mitracarpus hirtus (L.) DC.,Mitracarpus hirtus (L.) DC.,Mitracarpus hirtus,Spermacoce affinis (DC.) R.M.Salas,Spermacoce affinis,Mitracarpus,Spermacoce
197367,Spermacoce spinosa L.,Spermacoce tenuior L.,Spermacoce tenuior L.,Spermacoce tenuior L.,Spermacoce tenuior,Hexasepalum sarmentosum (Sw.) Delprete & J.H.Kirkbr.,Hexasepalum sarmentosum,Spermacoce,Hexasepalum
197373,Spermacoce stricta L.f.,Oldenlandia tenelliflora (Blume) Kuntze,Oldenlandia tenelliflora (Blume) Kuntze,Scleromitrion tenelliflorum (Blume) Korth.,Scleromitrion tenelliflorum,Spermacoce ocymoides Burm.f.,Spermacoce ocymoides,Scleromitrion,Spermacoce
197642,Spiranthes albescens Barb.Rodr.,Hapalorchis lineata (Lindl.) Schltr.,Hapalorchis lineata (Lindl.) Schltr.,Hapalorchis lineata (Lindl.) Schltr.,Hapalorchis lineata,Pteroglossa macrantha (Rchb.f.) Schltr.,Pteroglossa macrantha,Hapalorchis,Pteroglossa
197709,Spiranthes chilensis A.Rich.,Brachystele unilateralis (Poir.) Schltr.,Brachystele unilateralis (Poir.) Schltr.,Brachystele unilateralis (Poir.) Schltr.,Brachystele unilateralis,Odontorrhynchus chilensis (A.Rich.) Garay,Odontorrhynchus chilensis,Brachystele,Odontorrhynchus
197766,Spiranthes excelsa Kraenzl.,Sauroglossum nitidum (Vell.) Schltr.,Sauroglossum nitidum (Vell.) Schltr.,Buchtienia nitida (Vell.) Fraga & Meneguzzo,Buchtienia nitida,Sauroglossum elatum Lindl.,Sauroglossum elatum,Buchtienia,Sauroglossum
197907,Spiranthes pachychila Kraenzl.,Sauroglossum nitidum (Vell.) Schltr.,Sauroglossum nitidum (Vell.) Schltr.,Buchtienia nitida (Vell.) Fraga & Meneguzzo,Buchtienia nitida,Sauroglossum elatum Lindl.,Sauroglossum elatum,Buchtienia,Sauroglossum
197980,Spiranthes sauroglossum G.Nicholson,Sauroglossum nitidum (Vell.) Schltr.,Sauroglossum nitidum (Vell.) Schltr.,Buchtienia nitida (Vell.) Fraga & Meneguzzo,Buchtienia nitida,Sauroglossum elatum Lindl.,Sauroglossum elatum,Buchtienia,Sauroglossum
199061,Ballota africana Colmeiro,Ballota hirsuta Benth.,Ballota hirsuta Benth.,Pseudodictamnus hirsutus (Willd.) Salmaki & Siadati,Pseudodictamnus hirsutus,Aa Rchb.f.,,Pseudodictamnus,Aa
200228,Stelis spiralis (Ruiz & Pav.) Pers.,Stelis purpurea (Ruiz & Pav.) Willd.,Stelis purpurea (Ruiz & Pav.) Willd.,Stelis purpurea (Ruiz & Pav.) Willd.,Stelis purpurea,Andinia spiralis (Ruiz & Pav.) Karremans & Mark Wilson,Andinia spiralis,Stelis,Andinia
200956,Steudnera virosa (Roxb.) Prain,Colocasia esculenta (L.) Schott,Colocasia esculenta (L.) Schott,Colocasia esculenta (L.) Schott,Colocasia esculenta,Steudnera virosa (Roxb.) Prain,Steudnera virosa,Colocasia,Steudnera
202628,Syzygium laevigatum Miq.,Marlierea laevigata (DC.) Kiaersk.,Marlierea laevigata (DC.) Kiaersk.,Myrcia multipunctata Mazine,Myrcia multipunctata,Syzygium pyrifolium (Blume) DC.,Syzygium pyrifolium,Myrcia,Syzygium
202644,Syzygium latifolium Blanco,Eugenia roxburghii DC.,Eugenia roxburghii DC.,Eugenia roxburghii DC.,Eugenia roxburghii,Syzygium simile (Merr.) Merr.,Syzygium simile,Eugenia,Syzygium
204360,Tardavel spinosa Standl.,Spermacoce tenuior L.,Spermacoce tenuior L.,Spermacoce tenuior L.,Spermacoce tenuior,Hexasepalum sarmentosum (Sw.) Delprete & J.H.Kirkbr.,Hexasepalum sarmentosum,Spermacoce,Hexasepalum
204361,Tardavel stricta (L.f.) Hiern,Oldenlandia tenelliflora (Blume) Kuntze,Oldenlandia tenelliflora (Blume) Kuntze,Scleromitrion tenelliflorum (Blume) Korth.,Scleromitrion tenelliflorum,Spermacoce ocymoides Burm.f.,Spermacoce ocymoides,Scleromitrion,Spermacoce
205169,Tetrapora verrucosa Turcz.,Baeckea preissiana (Schauer) Druce,Baeckea preissiana (Schauer) Druce,Tetrapora preissiana S.Schauer,Tetrapora preissiana,Austrobaeckea verrucosa (Turcz.) Rye,Austrobaeckea verrucosa,Tetrapora,Austrobaeckea
205366,Beccariella coriacea Pierre,Beccariella lasiantha (Baill.) Aubrév.,Beccariella lasiantha (Baill.) Aubrév.,Beccariella lasiantha (Baill.) Aubrév.,Beccariella lasiantha,Pleioluma lasiantha (Baill.) Swenson & Munzinger,Pleioluma lasiantha,Beccariella,Pleioluma
205382,Beccariella dubia (Pierre ex Guillaumin) Aubrév.,Beccariella lasiantha (Baill.) Aubrév.,Beccariella lasiantha (Baill.) Aubrév.,Beccariella lasiantha (Baill.) Aubrév.,Beccariella lasiantha,Pichonia dubia (Pierre ex Guillaumin) Swenson & Munzinger,Pichonia dubia,Beccariella,Pichonia
205416,Beccariella laurifolia (A.Rich.) Aubrév.,Pouteria richardii (F.Muell.) Baehni,Pouteria richardii (F.Muell.) Baehni,Pouteria richardii (F.Muell.) Baehni,Pouteria richardii,Pleioluma laurifolia (A.Rich.) Swenson,Pleioluma laurifolia,Pouteria,Pleioluma
205424,Beccariella longipetiolata Aubrév.,Beccariella balansana (Pierre ex Baill.) Aubrév.,Beccariella balansana (Pierre ex Baill.) Aubrév.,Beccariella balansana (Pierre ex Baill.) Aubrév.,Beccariella balansana,Pleioluma longipetiolata (Aubrév.) Swenson & Munzinger,Pleioluma longipetiolata,Beccariella,Pleioluma
206775,Thymbra cephalota (L.) Desv.,Thymbra capitata (L.) Cav.,Thymbra capitata (L.) Cav.,Thymbra capitata (L.) Cav.,Thymbra capitata,Thymus moroderi Pau ex Martínez,Thymus moroderi,Thymbra,Thymus
206978,Thymus cephalotos L.,Thymbra capitata (L.) Cav.,Thymbra capitata (L.) Cav.,Thymbra capitata (L.) Cav.,Thymbra capitata,Thymus moroderi Pau ex Martínez,Thymus moroderi,Thymbra,Thymus
207497,Benthamia flavida Schltr.,Benthamia cinnabarina (Rolfe) H.Perrier,Benthamia cinnabarina (Rolfe) H.Perrier,Cynorkis cinnabarina (Rolfe) Hermans & P.J.Cribb,Cynorkis cinnabarina,Benthamia flavida Schltr.,Benthamia flavida,Cynorkis,Benthamia
207798,Thymus valderius Ronniger,Micromeria marginata (Sm.) Chater,Micromeria marginata (Sm.) Chater,Micromeria marginata (Sm.) Chater,Micromeria marginata,Thymus pannonicus All.,Thymus pannonicus,Micromeria,Thymus
207843,Benthamia perrieri Schltr.,Benthamia cinnabarina (Rolfe) H.Perrier,Benthamia cinnabarina (Rolfe) H.Perrier,Cynorkis cinnabarina (Rolfe) Hermans & P.J.Cribb,Cynorkis cinnabarina,Benthamia flavida Schltr.,Benthamia flavida,Cynorkis,Benthamia
