683886,Piper heteromallum Pers.,Piper secundum Ruiz & Pav.,Piper secundum Ruiz & Pav.,Piper secundum Ruiz & Pav.,Piper secundum,Peperomia secunda Ruiz & Pav.,Peperomia secunda,Piper,Peperomia
685400,Alopecurus paniceus (L.) L.,Setaria verticillata (L.) P.Beauv.,Setaria verticillata (L.) P.Beauv.,Setaria verticillata (L.) P.Beauv.,Setaria verticillata,Polypogon monspeliensis (L.) Desf.,Polypogon monspeliensis,Setaria,Polypogon
685408,Ampelodesmos tenax var. bicolor (Poir.) Fiori,Arundo mediterranea Danin,Arundo mediterranea Danin,Arundo micrantha Lam.,Arundo micrantha,Ampelodesmos mauritanicus (Poir.) T.Durand & Schinz,Ampelodesmos mauritanicus,Arundo,Ampelodesmos
685563,Helictotrichon pubescens (Huds.) Pilg.,Helictotrichon pubescens (Huds.) Schult. & Schult.f.,Helictotrichon pubescens (Huds.) Schult. & Schult.f.,Helictotrichon pubescens (Huds.) Schult. & Schult.f.,Helictotrichon pubescens,Avenula pubescens (Huds.) Dumort.,Avenula pubescens,Helictotrichon,Avenula
685674,Epicampes rigens Benth.,Sporobolus rigens (Trin.) É.Desv.,Sporobolus rigens (Trin.) É.Desv.,Sporobolus rigens (Trin.) É.Desv.,Sporobolus rigens,Muhlenbergia rigens (Benth.) Hitchc.,Muhlenbergia rigens,Sporobolus,Muhlenbergia
686305,Festuca ciliata Gouan,Vulpia ciliata Dumort.,Vulpia ciliata Dumort.,Festuca ambigua Le Gall,Festuca ambigua,Brachypodium distachyon (L.) P.Beauv.,Brachypodium distachyon,Festuca,Brachypodium
686685,Panicum adpressum Forssk.,Digitaria bicornis (Lam.) Roem. & Schult.,Digitaria bicornis (Lam.) Roem. & Schult.,Digitaria bicornis (Lam.) Roem. & Schult.,Digitaria bicornis,Urochloa mutica (Forssk.) T.Q.Nguyen,Urochloa mutica,Digitaria,Urochloa
686751,Poa secunda subsp. secunda ,Pseudosclerochloa rupestris (With.) Tzvelev,Pseudosclerochloa rupestris (With.) Tzvelev,Puccinellia rupestris (With.) Fernald & Weath.,Puccinellia rupestris,Poa secunda subsp. secunda ,Poa secunda,Puccinellia,Poa
687258,Festuca rigida Roth,Catapodium rigidum (L.) C.E.Hubb.,Catapodium rigidum (L.) C.E.Hubb.,Catapodium rigidum (L.) C.E.Hubb.,Catapodium rigidum,Brachypodium distachyon (L.) P.Beauv.,Brachypodium distachyon,Catapodium,Brachypodium
688473,Lachnostoma longifolium Markgr.,Matelea longifolia (Markgr.) Morillo,Matelea longifolia (Markgr.) Morillo,Matelea longifolia (Markgr.) Morillo,Matelea longifolia,Lachnostoma longifolium Markgr.,Lachnostoma longifolium,Matelea,Lachnostoma
688540,Philibertia flava Meyen,Philibertia solanoides Kunth,Philibertia solanoides Kunth,Philibertia solanoides Kunth,Philibertia solanoides,Funastrum flavum (Meyen) Malme,Funastrum flavum,Philibertia,Funastrum
688648,Orbea bisulca Haw.,Stisseria bisulca (Haw.) Kuntze,Stisseria bisulca (Haw.) Kuntze,Stisseria bisulca (Haw.) Kuntze,Stisseria bisulca,Orbea variegata (L.) Haw.,Orbea variegata,Stisseria,Orbea
688649,Orbea curtisii Haw.,Stisseria curtisii (Haw.) Kuntze,Stisseria curtisii (Haw.) Kuntze,Stisseria curtisii (Haw.) Kuntze,Stisseria curtisii,Orbea variegata (L.) Haw.,Orbea variegata,Stisseria,Orbea
688651,Orbea decora (Masson) Steud.,Stisseria decora (Masson) Kuntze,Stisseria decora (Masson) Kuntze,Stisseria decora (Masson) Kuntze,Stisseria decora,Piaranthus geminatus subsp. decorus (Masson) Bruyns,Piaranthus geminatus,Stisseria,Piaranthus
688655,Orbea mixta (Masson) Haw.,Stisseria mixta (Masson) Kuntze,Stisseria mixta (Masson) Kuntze,Stisseria mixta (Masson) Kuntze,Stisseria mixta,Orbea variegata (L.) Haw.,Orbea variegata,Stisseria,Orbea
688657,Orbea orbicularis (Andrews) Haw.,Stisseria orbicularis (Andrews) Kuntze,Stisseria orbicularis (Andrews) Kuntze,Stisseria orbicularis (Andrews) Kuntze,Stisseria orbicularis,Orbea variegata (L.) Haw.,Orbea variegata,Stisseria,Orbea
688658,Orbea retusa Haw.,Stisseria retusa (Haw.) Kuntze,Stisseria retusa (Haw.) Kuntze,Stisseria retusa (Haw.) Kuntze,Stisseria retusa,Orbea variegata (L.) Haw.,Orbea variegata,Stisseria,Orbea
688660,Orbea woodfordiana Haw.,Stisseria woodfordiana (Haw.) Kuntze,Stisseria woodfordiana (Haw.) Kuntze,Stisseria woodfordiana (Haw.) Kuntze,Stisseria woodfordiana,Orbea variegata (L.) Haw.,Orbea variegata,Stisseria,Orbea
688666,Otanema ovata Raf.,Asclepias viridiflora Raf.,Asclepias viridiflora Raf.,Asclepias viridiflora Raf.,Asclepias viridiflora,Vincetoxicum hirundinaria subsp. hirundinaria ,Vincetoxicum hirundinaria,Asclepias,Vincetoxicum
688685,Pentagonium flavum (Meyen) Schauer,Philibertia solanoides Kunth,Philibertia solanoides Kunth,Philibertia solanoides Kunth,Philibertia solanoides,Funastrum flavum (Meyen) Malme,Funastrum flavum,Philibertia,Funastrum
688699,Pherotrichis villosa (Schult.) Meisn.,Matelea balbisii (Decne.) Woodson,Matelea balbisii (Decne.) Woodson,Matelea balbisii (Decne.) Woodson,Matelea balbisii,Pherotrichis villosa (Schult.) Meisn.,Pherotrichis villosa,Matelea,Pherotrichis
688765,Stapelia articulata Aiton,Stisseria articulata (Aiton) Kuntze,Stisseria articulata (Aiton) Kuntze,Stisseria articulata (Aiton) Kuntze,Stisseria articulata,Pectinaria articulata (Aiton) Haw.,Pectinaria articulata,Stisseria,Pectinaria
688766,Stapelia atropurpurea Salm-Dyck,Stisseria atropurpurea (Salm-Dyck) Kuntze,Stisseria atropurpurea (Salm-Dyck) Kuntze,Stisseria atropurpurea (Salm-Dyck) Kuntze,Stisseria atropurpurea,Orbea variegata (L.) Haw.,Orbea variegata,Stisseria,Orbea
688768,Stapelia cactiformis Hook.,Lavrania cactiformis (Hook.) Bruyns,Lavrania cactiformis (Hook.) Bruyns,Lavrania cactiformis (Hook.) Bruyns,Lavrania cactiformis,Larryleachia cactiformis (Hook.) Plowes,Larryleachia cactiformis,Lavrania,Larryleachia
688769,Stapelia caudata Thunb.,Stisseria caudata (Thunb.) Kuntze,Stisseria caudata (Thunb.) Kuntze,Stisseria caudata (Thunb.) Kuntze,Stisseria caudata,Ceropegia spathulata (Lindl.) Bruyns,Ceropegia spathulata,Stisseria,Ceropegia
688775,Stapelia conspurcata Willd.,Stisseria conspurcata (Willd.) Kuntze,Stisseria conspurcata (Willd.) Kuntze,Stisseria conspurcata (Willd.) Kuntze,Stisseria conspurcata,Orbea variegata (L.) Haw.,Orbea variegata,Stisseria,Orbea
688776,Stapelia curtisii (Haw.) Schult.,Stisseria curtisii (Haw.) Kuntze,Stisseria curtisii (Haw.) Kuntze,Stisseria curtisii (Haw.) Kuntze,Stisseria curtisii,Orbea variegata (L.) Haw.,Orbea variegata,Stisseria,Orbea
688777,Stapelia decora Masson,Stisseria decora (Masson) Kuntze,Stisseria decora (Masson) Kuntze,Stisseria decora (Masson) Kuntze,Stisseria decora,Piaranthus geminatus subsp. decorus (Masson) Bruyns,Piaranthus geminatus,Stisseria,Piaranthus
688779,Stapelia elegans Masson,Stisseria elegans (Masson) Kuntze,Stisseria elegans (Masson) Kuntze,Stisseria elegans (Masson) Kuntze,Stisseria elegans,Duvalia elegans (Masson) Haw.,Duvalia elegans,Stisseria,Duvalia
688781,Stapelia fuscata Jacq.,Stisseria fuscata (Jacq.) Kuntze,Stisseria fuscata (Jacq.) Kuntze,Stisseria fuscata (Jacq.) Kuntze,Stisseria fuscata,Tromotriche revoluta (Masson) Haw.,Tromotriche revoluta,Stisseria,Tromotriche
688782,Stapelia geminata Masson,Stisseria geminata (Masson) Kuntze,Stisseria geminata (Masson) Kuntze,Stisseria geminata (Masson) Kuntze,Stisseria geminata,Piaranthus geminatus (Masson) N.E.Br.,Piaranthus geminatus,Stisseria,Piaranthus
688787,Stapelia hamata Jacq.,Stisseria hamata (Jacq.) Kuntze,Stisseria hamata (Jacq.) Kuntze,Stisseria hamata (Jacq.) Kuntze,Stisseria hamata,Stapelia hirsuta var. hirsuta ,Stapelia hirsuta,Stisseria,Stapelia
688788,Stapelia hircosa Jacq.,Stisseria hircosa (Jacq.) Kuntze,Stisseria hircosa (Jacq.) Kuntze,Stisseria hircosa (Jacq.) Kuntze,Stisseria hircosa,Tridentea gemmiflora (Masson) Haw.,Tridentea gemmiflora,Stisseria,Tridentea
688790,Stapelia hispidula Hornem.,Stisseria hispidula (Hornem.) Kuntze,Stisseria hispidula (Hornem.) Kuntze,Stisseria hispidula (Hornem.) Kuntze,Stisseria hispidula,Stapelia glanduliflora Masson,Stapelia glanduliflora,Stisseria,Stapelia
688791,Stapelia inodora (Haw.) Decne.,Stisseria inodora (Decne.) Kuntze,Stisseria inodora (Decne.) Kuntze,Stisseria inodora (Decne.) Kuntze,Stisseria inodora,Orbea variegata (L.) Haw.,Orbea variegata,Stisseria,Orbea
688792,Stapelia jacquiniana Schult.,Stisseria jacquiniana (Schult.) Kuntze,Stisseria jacquiniana (Schult.) Kuntze,Stisseria jacquiniana (Schult.) Kuntze,Stisseria jacquiniana,Duvalia elegans (Masson) Haw.,Duvalia elegans,Stisseria,Duvalia
688793,Stapelia juvencula Jacq.,Stisseria juvencula (Jacq.) Kuntze,Stisseria juvencula (Jacq.) Kuntze,Stisseria juvencula (Jacq.) Kuntze,Stisseria juvencula,Stapelia hirsuta var. vetula (Masson) Bruyns,Stapelia hirsuta,Stisseria,Stapelia
688794,Stapelia laevis Decne.,Stisseria laevis (Decne.) Kuntze,Stisseria laevis (Decne.) Kuntze,Stisseria laevis (Decne.) Kuntze,Stisseria laevis,Tromotriche pedunculata (Masson) Bruyns,Tromotriche pedunculata,Stisseria,Tromotriche
688795,Stapelia lanifera Haw.,Stisseria lanifera (Haw.) Kuntze,Stisseria lanifera (Haw.) Kuntze,Stisseria lanifera (Haw.) Kuntze,Stisseria lanifera,Stapelia hirsuta var. hirsuta ,Stapelia hirsuta,Stisseria,Stapelia
688798,Stapelia marmorata Jacq.,Stisseria marmorata (Jacq.) Kuntze,Stisseria marmorata (Jacq.) Kuntze,Stisseria marmorata (Jacq.) Kuntze,Stisseria marmorata,Orbea variegata (L.) Haw.,Orbea variegata,Stisseria,Orbea
688799,Stapelia mastodes Jacq.,Stisseria mastodes (Jacq.) Kuntze,Stisseria mastodes (Jacq.) Kuntze,Stisseria mastodes (Jacq.) Kuntze,Stisseria mastodes,Duvalia caespitosa var. compacta (Haw.) Meve,Duvalia caespitosa,Stisseria,Duvalia
688800,Stapelia mixta Masson,Stisseria mixta (Masson) Kuntze,Stisseria mixta (Masson) Kuntze,Stisseria mixta (Masson) Kuntze,Stisseria mixta,Orbea variegata (L.) Haw.,Orbea variegata,Stisseria,Orbea
688802,Stapelia normalis Jacq.,Stisseria normalis (Jacq.) Kuntze,Stisseria normalis (Jacq.) Kuntze,Stisseria normalis (Jacq.) Kuntze,Stisseria normalis,Orbea variegata (L.) Haw.,Orbea variegata,Stisseria,Orbea
688803,Stapelia obliqua Willd.,Stisseria obliqua (Willd.) Kuntze,Stisseria obliqua (Willd.) Kuntze,Stisseria obliqua (Willd.) Kuntze,Stisseria obliqua,Orbea variegata (L.) Haw.,Orbea variegata,Stisseria,Orbea
688804,Stapelia orbicularis Andrews,Stisseria orbicularis (Andrews) Kuntze,Stisseria orbicularis (Andrews) Kuntze,Stisseria orbicularis (Andrews) Kuntze,Stisseria orbicularis,Orbea variegata (L.) Haw.,Orbea variegata,Stisseria,Orbea
688807,Stapelia patula Willd.,Stisseria patula (Willd.) Kuntze,Stisseria patula (Willd.) Kuntze,Stisseria patula (Willd.) Kuntze,Stisseria patula,Stapelia hirsuta var. hirsuta ,Stapelia hirsuta,Stisseria,Stapelia
688808,Stapelia planiflora Jacq.,Stisseria planiflora (Jacq.) Kuntze,Stisseria planiflora (Jacq.) Kuntze,Stisseria planiflora (Jacq.) Kuntze,Stisseria planiflora,Orbea variegata (L.) Haw.,Orbea variegata,Stisseria,Orbea
688812,Stapelia quinquenervis (Haw.) Schult.,Stisseria quinquenervis (Schult.) Kuntze,Stisseria quinquenervis (Schult.) Kuntze,Stisseria quinquenervis (Schult.) Kuntze,Stisseria quinquenervis,Orbea variegata (L.) Haw.,Orbea variegata,Stisseria,Orbea
688814,Stapelia reclinata Masson,Stisseria reclinata (Masson) Kuntze,Stisseria reclinata (Masson) Kuntze,Stisseria reclinata (Masson) Kuntze,Stisseria reclinata,Duvalia caespitosa var. caespitosa ,Duvalia caespitosa,Stisseria,Duvalia
688816,Stapelia replicata Jacq.,Stisseria replicata (Jacq.) Kuntze,Stisseria replicata (Jacq.) Kuntze,Stisseria replicata (Jacq.) Kuntze,Stisseria replicata,Duvalia caespitosa var. caespitosa ,Duvalia caespitosa,Stisseria,Duvalia
688818,Stapelia retusa (Haw.) Schult.,Stisseria retusa (Haw.) Kuntze,Stisseria retusa (Haw.) Kuntze,Stisseria retusa (Haw.) Kuntze,Stisseria retusa,Orbea variegata (L.) Haw.,Orbea variegata,Stisseria,Orbea
688819,Stapelia roriflua Jacq.,Stisseria roriflua (Jacq.) Kuntze,Stisseria roriflua (Jacq.) Kuntze,Stisseria roriflua (Jacq.) Kuntze,Stisseria roriflua,Orbea verrucosa (Masson) L.C.Leach,Orbea verrucosa,Stisseria,Orbea
688820,Stapelia rufescens Salm-Dyck,Stisseria rufescens (Salm-Dyck) Kuntze,Stisseria rufescens (Salm-Dyck) Kuntze,Stisseria rufescens (Salm-Dyck) Kuntze,Stisseria rufescens,Stapelia rufa Masson,Stapelia rufa,Stisseria,Stapelia
688821,Stapelia serrulata Jacq.,Stisseria serrulata (Jacq.) Kuntze,Stisseria serrulata (Jacq.) Kuntze,Stisseria serrulata (Jacq.) Kuntze,Stisseria serrulata,Piaranthus geminatus subsp. decorus (Masson) Bruyns,Piaranthus geminatus,Stisseria,Piaranthus
688822,Stapelia spectabilis Haw.,Stisseria spectabilis (Haw.) Kuntze,Stisseria spectabilis (Haw.) Kuntze,Stisseria spectabilis (Haw.) Kuntze,Stisseria spectabilis,Stapelia grandiflora var. grandiflora ,Stapelia grandiflora,Stisseria,Stapelia
688823,Stapelia stricta Sims,Stisseria stricta (Sims) Kuntze,Stisseria stricta (Sims) Kuntze,Stisseria stricta (Sims) Kuntze,Stisseria stricta,Stapelia divaricata Masson,Stapelia divaricata,Stisseria,Stapelia
688824,Stapelia stygia (Haw.) Schult.,Stisseria stygia (Schult.) Kuntze,Stisseria stygia (Schult.) Kuntze,Stisseria stygia (Schult.) Kuntze,Stisseria stygia,Tridentea gemmiflora (Masson) Haw.,Tridentea gemmiflora,Stisseria,Tridentea
688892,Hemidesmus pubescens Wight & Arn.,Finlaysonia wallichii (Wight) Venter,Finlaysonia wallichii (Wight) Venter,Finlaysonia wallichii (Wight) Venter,Finlaysonia wallichii,Hemidesmus indicus (L.) R.Br. ex Schult.,Hemidesmus indicus,Finlaysonia,Hemidesmus
688898,Periploca cordata Poir.,Hemidesmus cordatus (Poir.) Schult.,Hemidesmus cordatus (Poir.) Schult.,Cosmostigma cordatum (Poir.) M.R.Almeida,Cosmostigma cordatum,Pentatropis capensis (L.f.) Bullock,Pentatropis capensis,Cosmostigma,Pentatropis
688956,Schizoglossum pilosum Schltr.,Aspidoglossum woodii (Schltr.) Kupicha,Aspidoglossum woodii (Schltr.) Kupicha,Aspidoglossum woodii (Schltr.) Kupicha,Aspidoglossum woodii,Miraglossum pilosum (Schltr.) Kupicha,Miraglossum pilosum,Aspidoglossum,Miraglossum
688957,Schizoglossum pulchellum Schltr.,Aspidoglossum woodii (Schltr.) Kupicha,Aspidoglossum woodii (Schltr.) Kupicha,Aspidoglossum woodii (Schltr.) Kupicha,Aspidoglossum woodii,Miraglossum pulchellum (Schltr.) Kupicha,Miraglossum pulchellum,Aspidoglossum,Miraglossum
688968,Schizoglossum verticillare Schltr.,Aspidoglossum woodii (Schltr.) Kupicha,Aspidoglossum woodii (Schltr.) Kupicha,Aspidoglossum woodii (Schltr.) Kupicha,Aspidoglossum woodii,Miraglossum verticillare (Schltr.) Kupicha,Miraglossum verticillare,Aspidoglossum,Miraglossum
689043,Vincetoxicum auriculatum (Royle ex Wight) Kuntze,Cynanchum auriculatum Royle ex Wight,Cynanchum auriculatum Royle ex Wight,Cynanchum auriculatum Royle ex Wight,Cynanchum auriculatum,Vincetoxicum auriculatum (Royle ex Wight) Kuntze,Vincetoxicum auriculatum,Cynanchum,Vincetoxicum
689049,Vincetoxicum linearifolium (Hemsl.) Kuntze,Cynanchum stauntonii (Decne.) Schltr. ex H.Lév.,Cynanchum stauntonii (Decne.) Schltr. ex H.Lév.,Cynanchum stauntonii (Decne.) Schltr. ex H.Lév.,Cynanchum stauntonii,Vincetoxicum stauntonii (Decne.) C.Y.Wu & D.Z.Li,Vincetoxicum stauntonii,Cynanchum,Vincetoxicum
689114,Vailia mucronata Rusby,Blepharodon salicinum Decne.,Blepharodon salicinum Decne.,Blepharodon salicinum Decne.,Blepharodon salicinum,Vailia mucronata Rusby,Vailia mucronata,Blepharodon,Vailia
689223,Trichocaulon columnare Nel,Riocreuxia torulosa Decne.,Riocreuxia torulosa Decne.,Riocreuxia torulosa Decne.,Riocreuxia torulosa,Richtersveldia columnaris (Nel) Meve & Liede,Richtersveldia columnaris,Riocreuxia,Richtersveldia
689349,Matelea altatensis (Brandegee) Woodson,Dictyanthus altatensis (Brandegee) W.D.Stevens,Dictyanthus altatensis (Brandegee) W.D.Stevens,Dictyanthus altatensis (Brandegee) W.D.Stevens,Dictyanthus altatensis,Matelea altatensis (Brandegee) Woodson,Matelea altatensis,Dictyanthus,Matelea
689377,Matelea glaberrima Woodson,Gonolobus glaberrimus (Woodson) W.D.Stevens,Gonolobus glaberrimus (Woodson) W.D.Stevens,Gonolobus glaberrimus (Woodson) W.D.Stevens,Gonolobus glaberrimus,Atrostemma glaberrimum (Woodson) Morillo,Atrostemma glaberrimum,Gonolobus,Atrostemma
689428,Matelea macrocarpa (Poepp.) Morillo,Fischeria stellata (Vell.) E.Fourn.,Fischeria stellata (Vell.) E.Fourn.,Fischeria stellata (Vell.) E.Fourn.,Fischeria stellata,Pruskortizia macrocarpa (Poepp.) Morillo,Pruskortizia macrocarpa,Fischeria,Pruskortizia
689643,Piaranthus rorifluus (Jacq.) Decne.,Stisseria roriflua (Jacq.) Kuntze,Stisseria roriflua (Jacq.) Kuntze,Stisseria roriflua (Jacq.) Kuntze,Stisseria roriflua,Orbea verrucosa (Masson) L.C.Leach,Orbea verrucosa,Stisseria,Orbea
689990,Hottonia littoralis Lour.,Catharanthus roseus (L.) G.Don,Catharanthus roseus (L.) G.Don,Catharanthus roseus (L.) G.Don,Catharanthus roseus,Centaurium cochinchinense (Spreng.) Druce,Centaurium cochinchinense,Catharanthus,Centaurium
690517,Leucospermum alpinum subsp. amoenum Rourke,Leucospermum wittebergense Compton,Leucospermum wittebergense Compton,Leucospermum wittebergense Compton,Leucospermum wittebergense,Vexatorella amoena (Rourke) Rourke,Vexatorella amoena,Leucospermum,Vexatorella
690518,Leucospermum obtusatum subsp. albomontanum Rourke,Leucospermum wittebergense Compton,Leucospermum wittebergense Compton,Leucospermum wittebergense Compton,Leucospermum wittebergense,Vexatorella obtusata subsp. albomontana (Rourke) Rourke,Vexatorella obtusata,Leucospermum,Vexatorella
690762,Hymenophyllum alatum Schkuhr,Hymenophyllum tunbrigense (L.) Sm.,Hymenophyllum tunbrigense (L.) Sm.,Hymenophyllum tunbrigense (L.) Sm.,Hymenophyllum tunbrigense,Trichomanes bipunctatum Poir.,Trichomanes bipunctatum,Hymenophyllum,Trichomanes
690777,Alsophila simulans Baker,Cyathea simulans (Baker) Janssen & Rakotondr.,Cyathea simulans (Baker) Janssen & Rakotondr.,Cyathea simulans (Baker) Janssen & Rakotondr.,Cyathea simulans,Alsophila simulans Baker,Alsophila simulans,Cyathea,Alsophila
690794,Gymnosphaera coursii (Tardieu) Tardieu,Cyathea coursii (Tardieu) Rakotondr.,Cyathea coursii (Tardieu) Rakotondr.,Cyathea coursii (Tardieu) Rakotondr.,Cyathea coursii,Alsophila coursii Tardieu,Alsophila coursii,Cyathea,Alsophila
690803,Cheilanthes aspera Kaulf.,Cheilanthes horridula Maxon,Cheilanthes horridula Maxon,Hemionitis horridula (Maxon) Christenh.,Hemionitis horridula,Hypolepis sparsisora (Schrad.) Kuhn,Hypolepis sparsisora,Hemionitis,Hypolepis
690807,Humblotiella odontolabia (Baker) Tardieu,Lindsaea odontolobia Kramer,Lindsaea odontolobia Kramer,Lindsaea odontolobia Kramer,Lindsaea odontolobia,Odontosoria odontolabia (Baker) Diels,Odontosoria odontolabia,Lindsaea,Odontosoria
690808,Davallia odontolabia Baker,Lindsaea odontolobia Kramer,Lindsaea odontolobia Kramer,Lindsaea odontolobia Kramer,Lindsaea odontolobia,Odontosoria odontolabia (Baker) Diels,Odontosoria odontolabia,Lindsaea,Odontosoria
690961,Asplenium induratum Hook.,Diplazium lindbergii (Mett.) Christ,Diplazium lindbergii (Mett.) Christ,Diplazium lindbergii (Mett.) Christ,Diplazium lindbergii,Asplenium normale D.Don,Asplenium normale,Diplazium,Asplenium
690991,Diplazium mohillense Fée,Diplazium dilatatum Blume,Diplazium dilatatum Blume,Diplazium dilatatum Blume,Diplazium dilatatum,Athyrium mohillense (Fée) Tardieu,Athyrium mohillense,Diplazium,Athyrium
691736,Alsophila coursii Tardieu,Cyathea coursii (Tardieu) Rakotondr.,Cyathea coursii (Tardieu) Rakotondr.,Cyathea coursii (Tardieu) Rakotondr.,Cyathea coursii,Alsophila coursii Tardieu,Alsophila coursii,Cyathea,Alsophila
691740,Phegopteris ammifolia Fée,Hypolepis villoso-viscida (Thouars) Tardieu,Hypolepis villoso-viscida (Thouars) Tardieu,Hypolepis rugosula subsp. villosoviscida (Thouars) Schwartsb. & J.Prado,Hypolepis rugosula,Polystichum ammifolium C.Chr.,Polystichum ammifolium,Hypolepis,Polystichum
691798,Polypodium sessilifolium Desv.,Pseudophegopteris cruciata (Willd.) Holttum,Pseudophegopteris cruciata (Willd.) Holttum,Phegopteris cruciata Mett. ex Kuhn,Phegopteris cruciata,Serpocaulon sessilifolium (Desv.) A.R.Sm.,Serpocaulon sessilifolium,Phegopteris,Serpocaulon
691867,Vittaria angustifrons Michx.,Vittaria zosterifolia Willd.,Vittaria zosterifolia Willd.,Haplopteris zosterifolia (Willd.) E.H.Crane,Haplopteris zosterifolia,Vittaria lineata (L.) Sm.,Vittaria lineata,Haplopteris,Vittaria
691870,Heteropteris lanceolata (L.) Fée ex Diels,Heteropterys glabra Hook. & Arn.,Heteropterys glabra Hook. & Arn.,Heteropterys glabra Hook. & Arn.,Heteropterys glabra,Pleopeltis marginata A.R.Sm. & Tejero,Pleopeltis marginata,Heteropterys,Pleopeltis
691918,Polypodium submarginale Langsd. & Fisch.,Ctenitis submarginalis (Langsd. & Fisch.) Ching,Ctenitis submarginalis (Langsd. & Fisch.) Ching,Ctenitis submarginalis (Langsd. & Fisch.) Ching,Ctenitis submarginalis,Polystichum deltodon (Baker) Diels,Polystichum deltodon,Ctenitis,Polystichum
692165,Struthiopteris nodulosa Desv.,Matteuccia struthiopteris (L.) Tod.,Matteuccia struthiopteris (L.) Tod.,Onoclea struthiopteris Roth,Onoclea struthiopteris,Woodwardia areolata (L.) T.Moore,Woodwardia areolata,Onoclea,Woodwardia
692372,Marattia alata Sw.,Eupodium laeve (Sm.) Murdock,Eupodium laeve (Sm.) Murdock,Eupodium laeve (Sm.) Murdock,Eupodium laeve,Marattia alata Sw.,Marattia alata,Eupodium,Marattia
692683,Hemionitis lanceolata L.,Antrophyum lanceolatum (L.) Kaulf.,Antrophyum lanceolatum (L.) Kaulf.,Antrophyum lanceolatum (L.) Kaulf.,Antrophyum lanceolatum,Polytaenium feei (W.Schaffn. ex Fée) Maxon,Polytaenium feei,Antrophyum,Polytaenium
692820,Goniophlebium pyrrholepis Fée,Polypodium pyrrholepis (Fée) Maxon,Polypodium pyrrholepis (Fée) Maxon,Polypodium pyrrholepis (Fée) Maxon,Polypodium pyrrholepis,Pleopeltis pyrrholepis (Fée) A.R.Sm. & Tejero,Pleopeltis pyrrholepis,Polypodium,Pleopeltis
693022,Goniophlebium lepidotrichum Fée,Polypodium lepidotrichum (Fée) Maxon,Polypodium lepidotrichum (Fée) Maxon,Polypodium lepidotrichum (Fée) Maxon,Polypodium lepidotrichum,Pleopeltis lepidotricha (Fée) A.R.Sm. & Tejero,Pleopeltis lepidotricha,Polypodium,Pleopeltis
693295,Cyclosorus arcuatus (Poir.) Alston,Thelypteris patens (Sw.) Small,Thelypteris patens (Sw.) Small,Thelypteris patens (Sw.) Small,Thelypteris patens,Adiantum philippense L.,Adiantum philippense,Thelypteris,Adiantum
693313,Soromanes integrifolium Fée,Polybotrya serratifolia (Fée) Klotzsch,Polybotrya serratifolia (Fée) Klotzsch,Polybotrya serratifolia (Fée) Klotzsch,Polybotrya serratifolia,Cyclodium meniscioides (Willd.) C.Presl,Cyclodium meniscioides,Polybotrya,Cyclodium
694265,Osmundastrum claytonianum (L.) Tagawa,Osmunda claytoniana L.,Osmunda claytoniana L.,Osmunda claytoniana L.,Osmunda claytoniana,Osmundastrum claytonianum (L.) Tagawa,Osmundastrum claytonianum,Osmunda,Osmundastrum
694776,Polypodium guianense Aubl.,Lomagramma guianensis (Aubl.) Ching,Lomagramma guianensis (Aubl.) Ching,Lomagramma guianensis (Aubl.) Ching,Lomagramma guianensis,"Mickelia guianensis (Aubl.) R.C.Moran, Labiak & Sundue",Mickelia guianensis,Lomagramma,Mickelia
695205,Dryopteris abbottiana Maxon,Thelypteris rudis (Kunze) Proctor,Thelypteris rudis (Kunze) Proctor,Thelypteris rudis (Kunze) Proctor,Thelypteris rudis,Dryopteris abbottiana Maxon,Dryopteris abbottiana,Thelypteris,Dryopteris
695225,Polypodium palustre (Raddi) Lowe,Thelypteris serrata (Cav.) Alston,Thelypteris serrata (Cav.) Alston,Thelypteris serrata (Cav.) Alston,Thelypteris serrata,Stenochlaena palustris (Burm.) Bedd.,Stenochlaena palustris,Thelypteris,Stenochlaena
695600,Leptochilus bradeorum Rosenst.,Bolbitis oligarchica (Baker) Hennipman,Bolbitis oligarchica (Baker) Hennipman,Bolbitis oligarchica (Baker) Hennipman,Bolbitis oligarchica,"Mickelia oligarchica (Baker) R.C.Moran, Labiak & Sundue",Mickelia oligarchica,Bolbitis,Mickelia
695677,Polypodium loriceum var. oligomerum Christ,Polypodium loriceum L.,Polypodium loriceum L.,Serpocaulon loriceum (L.) A.R.Sm.,Serpocaulon loriceum,Polypodium colpodes var. oligomerum (Christ) Tejero,Polypodium colpodes,Serpocaulon,Polypodium
695686,Polypodium costaricanum Hieron.,Polypodium myriolepis Christ,Polypodium myriolepis Christ,Polypodium myriolepis Christ,Polypodium myriolepis,Pleopeltis myriolepis (Christ) A.R.Sm. & Tejero,Pleopeltis myriolepis,Polypodium,Pleopeltis
695841,Asplenium resectum f. adiantifrons Hayata,Asplenium adiantifrons (Hayata) Ching,Asplenium adiantifrons (Hayata) Ching,Asplenium adiantifrons (Hayata) Ching,Asplenium adiantifrons,Hymenasplenium adiantifrons (Hayata) Viane & S.Y.Dong,Hymenasplenium adiantifrons,Asplenium,Hymenasplenium
696160,Polypodium feei (Bory) Mett.,Polypodium plesiosorum Kunze,Polypodium plesiosorum Kunze,Polypodium plesiosorum Kunze,Polypodium plesiosorum,Selliguea feei Bory,Selliguea feei,Polypodium,Selliguea
696495,Osmunda zeylanica L.,Tectaria zeylanica (Houtt.) Sledge,Tectaria zeylanica (Houtt.) Sledge,Tectaria zeylanica (Houtt.) Sledge,Tectaria zeylanica,Helminthostachys zeylanica (L.) Hook.,Helminthostachys zeylanica,Tectaria,Helminthostachys
696651,Polypodium axillare Aiton,Cyathea axillaris (Fée) Lellinger,Cyathea axillaris (Fée) Lellinger,Cyathea axillaris (Fée) Lellinger,Cyathea axillaris,Athyrium filix-femina subsp. filix-femina ,Athyrium filix-femina,Cyathea,Athyrium
696849,Aspidium coadunatum Kaulf.,Tectaria gemmifera (Fée) Alston,Tectaria gemmifera (Fée) Alston,Tectaria gemmifera (Fée) Alston,Tectaria gemmifera,Thelypteris lugubris (Mett.) R.M.Tryon & A.F.Tryon,Thelypteris lugubris,Tectaria,Thelypteris
697016,Polypodium serrulatum Sw.,Xiphopteris serrulata (Sw.) Kaulf.,Xiphopteris serrulata (Sw.) Kaulf.,Grammitis serrulata (Sw.) Sw.,Grammitis serrulata,Thelypteris lunaniana (Heward) Proctor,Thelypteris lunaniana,Grammitis,Thelypteris
697484,Phymatodes veitchii (Baker) Ching,Polypodium veitchii Baker,Polypodium veitchii Baker,Polypodium veitchii Baker,Polypodium veitchii,Selliguea veitchii (Baker) H.Ohashi & K.Ohashi,Selliguea veitchii,Polypodium,Selliguea
697563,Polypodium arcuatum Poir.,Thelypteris patens (Sw.) Small,Thelypteris patens (Sw.) Small,Thelypteris patens (Sw.) Small,Thelypteris patens,Adiantum philippense L.,Adiantum philippense,Thelypteris,Adiantum
