423549,Sida betonicifolia Balb. ex DC.,Sida abutifolia Mill.,Sida abutifolia Mill.,Sida abutifolia Mill.,Sida abutifolia,Sida abutilifolia Mill.,Sida abutilifolia,Sida,Sida
423567,Sida affinis J.A.Schmidt,Sida spinosa L.,Sida spinosa L.,Sida spinosa L.,Sida spinosa,Sida alba L.,Sida alba,Sida,Sida
423576,Sida arabica J.F.Gmel.,Sida abutifolia Mill.,Sida abutifolia Mill.,Sida abutifolia Mill.,Sida abutifolia,Sida abutilifolia Mill.,Sida abutilifolia,Sida,Sida
423598,Sida angustifolia Mill.,Sida spinosa L.,Sida spinosa L.,Sida spinosa L.,Sida spinosa,Sida angustifolia Mill.,Sida angustifolia,Sida,Sida
423761,Solenophora toucana D.L.Denham & D.N.Gibson,Solenophora calycosa Donn.Sm.,Solenophora calycosa Donn.Sm.,Solenophora calycosa Donn.Sm.,Solenophora calycosa,Solenophora toucana D.L.Denham & D.N.Gibson,Solenophora toucana,Solenophora,Solenophora
423905,Seemannia major Baill.,Seemannia sylvatica Baill.,Seemannia sylvatica Baill.,Seemannia sylvatica Baill.,Seemannia sylvatica,Seemannia purpurascens Rusby,Seemannia purpurascens,Seemannia,Seemannia
427327,Sida integrifolia Sessé & Moc.,Anoda pentaschista A.Gray,Anoda pentaschista A.Gray,Anoda pentaschista A.Gray,Anoda pentaschista,Wissadula periplocifolia (L.) Thwaites,Wissadula periplocifolia,Anoda,Wissadula
427356,Sida diffusa Kunth,Sida abutifolia Mill.,Sida abutifolia Mill.,Sida abutifolia Mill.,Sida abutifolia,Sida abutilifolia Mill.,Sida abutilifolia,Sida,Sida
427366,Sida filicaulis Torr. & A.Gray,Sida abutifolia Mill.,Sida abutifolia Mill.,Sida abutifolia Mill.,Sida abutifolia,Sida abutilifolia Mill.,Sida abutilifolia,Sida,Sida
427384,Sida fiebrigii Ulbr.,Sida linifolia Cav.,Sida linifolia Cav.,Sida linifolia Cav.,Sida linifolia,Sida hassleri Hochr.,Sida hassleri,Sida,Sida
427431,Sida carpinifolia L.f.,Sida acuta Burm.f.,Sida acuta Burm.f.,Sida acuta Burm.f.,Sida acuta,Sida planicaulis Cav.,Sida planicaulis,Sida,Sida
427448,Sida caespitosa Helwig,Sida abutifolia Mill.,Sida abutifolia Mill.,Sida abutifolia Mill.,Sida abutifolia,Sida abutilifolia Mill.,Sida abutilifolia,Sida,Sida
428818,Statice pigadiensis Rech.f.,Limonium ocymifolium (Poir.) Kuntze,Limonium ocymifolium (Poir.) Kuntze,Limonium ocymifolium (Poir.) Kuntze,Limonium ocymifolium,Limonium pigadiense (Rech.f.) Rech.f.,Limonium pigadiense,Limonium,Limonium
429003,Statice corinthiaca Boiss. & Heldr.,Limonium ocymifolium (Poir.) Kuntze,Limonium ocymifolium (Poir.) Kuntze,Limonium ocymifolium (Poir.) Kuntze,Limonium ocymifolium,Limonium corinthiacum (Boiss. & Heldr.) Kuntze,Limonium corinthiacum,Limonium,Limonium
429093,Statice dodartii Girard,Limonium binervosum (G.E.Sm.) C.E.Salmon,Limonium binervosum (G.E.Sm.) C.E.Salmon,Limonium binervosum (G.E.Sm.) C.E.Salmon,Limonium binervosum,Limonium dodartii (Girard) Kuntze,Limonium dodartii,Limonium,Limonium
429101,Statice gummifera Durieu ex Boiss. & Reut.,Limonium cymuliferum (Boiss.) Sauvage & Vindt,Limonium cymuliferum (Boiss.) Sauvage & Vindt,Limonium cymuliferum (Boiss.) Sauvage & Vindt,Limonium cymuliferum,Limonium gummiferum (Durieu ex Boiss. & Reut.) Kuntze,Limonium gummiferum,Limonium,Limonium
429915,Sphaeroma filicaule Kuntze,Sida abutifolia Mill.,Sida abutifolia Mill.,Sida abutifolia Mill.,Sida abutifolia,Sida abutilifolia Mill.,Sida abutilifolia,Sida,Sida
430138,Sida spodochroma F.Muell.,Sida corrugata Lindl.,Sida corrugata Lindl.,Sida corrugata Lindl.,Sida corrugata,Sida spodochroma F.Muell.,Sida spodochroma,Sida,Sida
430202,Sida supina L'Hér.,Sida abutifolia Mill.,Sida abutifolia Mill.,Sida abutifolia Mill.,Sida abutifolia,Sida abutilifolia Mill.,Sida abutilifolia,Sida,Sida
430221,Sida procumbens Sw.,Sida abutifolia Mill.,Sida abutifolia Mill.,Sida abutifolia Mill.,Sida abutifolia,Sida abutilifolia Mill.,Sida abutilifolia,Sida,Sida
430241,Sida pilosa Cav.,Sida repens Cav.,Sida repens Cav.,Sida repens Cav.,Sida repens,Sida abutilifolia Mill.,Sida abutilifolia,Sida,Sida
430244,Sida pilosa Retz.,Sida cordata (Burm.f.) Borss.Waalk.,Sida cordata (Burm.f.) Borss.Waalk.,Sida cordata (Burm.f.) Borss.Waalk.,Sida cordata,Sida javensis Cav.,Sida javensis,Sida,Sida
430290,Sphaeralcea filicaulis Hemsl.,Sida abutifolia Mill.,Sida abutifolia Mill.,Sida abutifolia Mill.,Sida abutifolia,Sida abutilifolia Mill.,Sida abutilifolia,Sida,Sida
430922,Suttonia angustifolia Mez,Myrsine punctata (H.Lév.) Wilbur,Myrsine punctata (H.Lév.) Wilbur,Myrsine punctata (H.Lév.) Wilbur,Myrsine punctata,Myrsine helleri (O.Deg. & I.Deg.) H.St.John,Myrsine helleri,Myrsine,Myrsine
432509,Phelipanche zosimii (M.J.Y.Foley) M.J.Y.Foley,Orobanche zosimi (M.J.Y.Foley) Domina,Orobanche zosimi (M.J.Y.Foley) Domina,Orobanche zosimi (M.J.Y.Foley) Domina,Orobanche zosimi,Orobanche zosimii (M.J.Y.Foley) Domina,Orobanche zosimii,Orobanche,Orobanche
433118,Asarum mandshuricum f. seoulense (Nakai) M.Kim & S.So,Asarum sieboldii Miq.,Asarum sieboldii Miq.,Asarum sieboldii Miq.,Asarum sieboldii,Asarum heterotropoides F.Schmidt,Asarum heterotropoides,Asarum,Asarum
433498,Cleyera japonica var. taipehensis H.Keng,Cleyera japonica Thunb.,Cleyera japonica Thunb.,Cleyera japonica Thunb.,Cleyera japonica,Cleyera lipingensis var. taipinensis (H.Keng) T.L.Ming,Cleyera lipingensis,Cleyera,Cleyera
434498,Paraboea primuloides Z.R.Xu,Paraboea schefferi (H.O.Forbes) B.L.Burtt,Paraboea schefferi (H.O.Forbes) B.L.Burtt,Paraboea schefferi (H.O.Forbes) B.L.Burtt,Paraboea schefferi,Paraboea primuloides Z.R.Xu,Paraboea primuloides,Paraboea,Paraboea
435286,Abelmoschus ascendens Walp.,Hibiscus physaloides Guill. & Perr.,Hibiscus physaloides Guill. & Perr.,Hibiscus physaloides Guill. & Perr.,Hibiscus physaloides,Hibiscus caesius Garcke,Hibiscus caesius,Hibiscus,Hibiscus
435293,Abelmoschus cancellatus (L.f.) Voigt,Abelmoschus crinitus Wall.,Abelmoschus crinitus Wall.,Abelmoschus crinitus Wall.,Abelmoschus crinitus,Pavonia cancellata Cav.,Pavonia cancellata,Abelmoschus,Pavonia
435302,Abelmoschus cryptocarpus Walp.,Abelmoschus moschatus Medik.,Abelmoschus moschatus Medik.,Abelmoschus moschatus Medik.,Abelmoschus moschatus,Hibiscus clypeatus subsp. cryptocarpos (A.Rich.) O.J.Blanch.,Hibiscus clypeatus,Abelmoschus,Hibiscus
435304,Abelmoschus cubensis Walp.,Abelmoschus moschatus Medik.,Abelmoschus moschatus Medik.,Abelmoschus moschatus Medik.,Abelmoschus moschatus,Hibiscus striatus subsp. lambertianus (Kunth) O.J.Blanch.,Hibiscus striatus,Abelmoschus,Hibiscus
435305,Abelmoschus cucurbitaceus Walp.,Abelmoschus moschatus Medik.,Abelmoschus moschatus Medik.,Abelmoschus moschatus Medik.,Abelmoschus moschatus,Hibiscus cucurbitaceus A.St.-Hil.,Hibiscus cucurbitaceus,Abelmoschus,Hibiscus
435313,Abelmoschus genevii Walp.,Hibiscus liliiflorus Cav.,Hibiscus liliiflorus Cav.,Hibiscus liliiflorus Cav.,Hibiscus liliiflorus,Hibiscus genevii Bojer,Hibiscus genevii,Hibiscus,Hibiscus
435315,Abelmoschus guineensis Walp.,Hibiscus tilliaceus L.,Hibiscus tilliaceus L.,Hibiscus tilliaceus L.,Hibiscus tilliaceus,Hibiscus tiliaceus subsp. tiliaceus ,Hibiscus tiliaceus,Hibiscus,Hibiscus
435345,Abelmoschus officinalis Endl.,Abelmoschus esculentus Moench,Abelmoschus esculentus Moench,Abelmoschus esculentus Moench,Abelmoschus esculentus,Abelmoschus moschatus Medik.,Abelmoschus moschatus,Abelmoschus,Abelmoschus
435347,Abelmoschus palustris Walp.,Abelmoschus moschatus Medik.,Abelmoschus moschatus Medik.,Abelmoschus moschatus Medik.,Abelmoschus moschatus,Hibiscus moscheutos subsp. moscheutos ,Hibiscus moscheutos,Abelmoschus,Hibiscus
435360,Abelmoschus roseus (Thore) Walp.,Abelmoschus moschatus Medik.,Abelmoschus moschatus Medik.,Abelmoschus moschatus Medik.,Abelmoschus moschatus,Hibiscus moscheutos subsp. moscheutos ,Hibiscus moscheutos,Abelmoschus,Hibiscus
435376,Abelmoschus venustus Walp.,Abelmoschus manihot (L.) Medik.,Abelmoschus manihot (L.) Medik.,Abelmoschus manihot (L.) Medik.,Abelmoschus manihot,Hibiscus indicus var. indicus ,Hibiscus indicus,Abelmoschus,Hibiscus
436025,Abutilon albidum Sweet,Abutilon indicum (L.) Sweet,Abutilon indicum (L.) Sweet,Abutilon indicum (L.) Sweet,Abutilon indicum,Abutilon albidum Sweet,Abutilon albidum,Abutilon,Abutilon
436302,Abutilon indicum var. albidum (Willd.) Baker f.,Abutilon indicum (L.) Sweet,Abutilon indicum (L.) Sweet,Abutilon indicum (L.) Sweet,Abutilon indicum,Abutilon albidum Sweet,Abutilon albidum,Abutilon,Abutilon
436503,Abutilon pleniflorum N.E.Br.,Callianthe picta (Gillies ex Hook. & Arn.) Donnell,Callianthe picta (Gillies ex Hook. & Arn.) Donnell,Callianthe picta (Gillies ex Hook. & Arn.) Donnell,Callianthe picta,Callianthe striata (G.F.Dicks. ex Lindl.) Donnell,Callianthe striata,Callianthe,Callianthe
436518,Abutilon pseudostriatum Hochr.,Callianthe picta (Gillies ex Hook. & Arn.) Donnell,Callianthe picta (Gillies ex Hook. & Arn.) Donnell,Callianthe picta (Gillies ex Hook. & Arn.) Donnell,Callianthe picta,Callianthe striata (G.F.Dicks. ex Lindl.) Donnell,Callianthe striata,Callianthe,Callianthe
436600,Abutilon striatum G.F.Dicks. ex Lindl.,Callianthe picta (Gillies ex Hook. & Arn.) Donnell,Callianthe picta (Gillies ex Hook. & Arn.) Donnell,Callianthe picta (Gillies ex Hook. & Arn.) Donnell,Callianthe picta,Callianthe striata (G.F.Dicks. ex Lindl.) Donnell,Callianthe striata,Callianthe,Callianthe
436622,Abutilon thompsonii H.J.Veitch,Callianthe picta (Gillies ex Hook. & Arn.) Donnell,Callianthe picta (Gillies ex Hook. & Arn.) Donnell,Callianthe picta (Gillies ex Hook. & Arn.) Donnell,Callianthe picta,Callianthe striata (G.F.Dicks. ex Lindl.) Donnell,Callianthe striata,Callianthe,Callianthe
436661,Abutilon vexillarium É.Morren,Callianthe megapotamica (A.Spreng.) Dorr,Callianthe megapotamica (A.Spreng.) Dorr,Callianthe megapotamica (A.Spreng.) Dorr,Callianthe megapotamica,Callianthe vexillaria (É.Morren) Donnell,Callianthe vexillaria,Callianthe,Callianthe
437460,Acantholimon cataonicum Bunge,Acantholimon lycaonicum Boiss. & Heldr.,Acantholimon lycaonicum Boiss. & Heldr.,Acantholimon lycaonicum Boiss. & Heldr.,Acantholimon lycaonicum,Acantholimon puberulum Boiss. & Balansa,Acantholimon puberulum,Acantholimon,Acantholimon
439576,Acetosella florida Kuntze,Oxalis florida Salisb.,Oxalis florida Salisb.,Oxalis florida Salisb.,Oxalis florida,Oxalis adspersa Eckl. & Zeyh.,Oxalis adspersa,Oxalis,Oxalis
439585,Acetosella holosericea Kuntze,Oxalis holosericea Phil.,Oxalis holosericea Phil.,Oxalis holosericea Phil.,Oxalis holosericea,Oxalis truncatula Jacq.,Oxalis truncatula,Oxalis,Oxalis
439746,Achimenes knightii Lem.,Kohleria inaequalis (Benth.) Wiehler,Kohleria inaequalis (Benth.) Wiehler,Kohleria inaequalis (Benth.) Wiehler,Kohleria inaequalis,Achimenes candida Lindl.,Achimenes candida,Kohleria,Achimenes
439759,Achimenes maculata Walp.,Diastema maculatum Benth. ex Walp.,Diastema maculatum Benth. ex Walp.,Diastema maculatum Benth. ex Walp.,Diastema maculatum,Achimenes antirrhina (DC.) C.V.Morton,Achimenes antirrhina,Diastema,Achimenes
439787,Achimenes saxicola C.V.Morton,Achimenes candida Lindl.,Achimenes candida Lindl.,Achimenes candida Lindl.,Achimenes candida,Achimenes saxicola C.V.Morton,Achimenes saxicola,Achimenes,Achimenes
439796,Achimenes tyrianthina Lem.,Achimenes longiflora DC.,Achimenes longiflora DC.,Achimenes longiflora DC.,Achimenes longiflora,Achimenes heterophylla DC.,Achimenes heterophylla,Achimenes,Achimenes
439800,Achimenes warszewicziana (Regel ex H.E.Moore) H.E.Moore,Achimenes misera Lindl.,Achimenes misera Lindl.,Achimenes misera Lindl.,Achimenes misera,Achimenes warszewicziana (Regel ex H.E.Moore) H.E.Moore,Achimenes warszewicziana,Achimenes,Achimenes
442009,Acrodiclidium cayennense (Meisn.) Mez,Licaria cannella subsp. cannella ,Licaria cannella subsp. cannella ,Licaria cannella subsp. cannella ,Licaria cannella,Licaria crassifolia (Poir.) P.L.R.Moraes,Licaria crassifolia,Licaria,Licaria
442027,Acrodiclidium guianense Nees,Dicypellium caryophyllaceum (Mart.) Nees & Mart.,Dicypellium caryophyllaceum (Mart.) Nees & Mart.,Dicypellium caryophyllaceum (Mart.) Nees & Mart.,Dicypellium caryophyllaceum,Licaria polyphylla (Nees) Kosterm.,Licaria polyphylla,Dicypellium,Licaria
442029,Acrodiclidium guianense var. oppositifolium Meisn.,Dicypellium caryophyllaceum (Mart.) Nees & Mart.,Dicypellium caryophyllaceum (Mart.) Nees & Mart.,Dicypellium caryophyllaceum (Mart.) Nees & Mart.,Dicypellium caryophyllaceum,Licaria chrysophylla (Meisn.) Kosterm.,Licaria chrysophylla,Dicypellium,Licaria
442030,Acrodiclidium guianense var. reticulatum Meisn.,Dicypellium caryophyllaceum (Mart.) Nees & Mart.,Dicypellium caryophyllaceum (Mart.) Nees & Mart.,Dicypellium caryophyllaceum (Mart.) Nees & Mart.,Dicypellium caryophyllaceum,Licaria polyphylla (Nees) Kosterm.,Licaria polyphylla,Dicypellium,Licaria
442700,Actinidia rufa var. cordifolia (Miq.) Dunn,Actinidia rufa Franch. & Sav.,Actinidia rufa Franch. & Sav.,Actinidia rufa Franch. & Sav.,Actinidia rufa,Actinidia arguta var. arguta wcvp_Actinidiaceae.csv,Actinidia arguta,Actinidia,Actinidia
442702,Actinidia rufa var. dulcissima Koidz.,Actinidia rufa Franch. & Sav.,Actinidia rufa Franch. & Sav.,Actinidia rufa Franch. & Sav.,Actinidia rufa,Actinidia arguta var. arguta wcvp_Actinidiaceae.csv,Actinidia arguta,Actinidia,Actinidia
442704,Actinidia rufa var. typica Dunn,Actinidia arguta Miq.,Actinidia arguta Miq.,Actinidia arguta Miq.,Actinidia arguta,Actinidia rufa Franch. & Sav.,Actinidia rufa,Actinidia,Actinidia
443580,Adenosma bilabiata (Roxb.) Merr.,Adenosma indianum (Lour.) Merr.,Adenosma indianum (Lour.) Merr.,Adenosma indianum (Lour.) Merr.,Adenosma indianum,Adenosma indiana (Lour.) Merr.,Adenosma indiana,Adenosma,Adenosma
443583,Adenosma buchneroides Bonati,Adenosma indianum (Lour.) Merr.,Adenosma indianum (Lour.) Merr.,Adenosma indianum (Lour.) Merr.,Adenosma indianum,Adenosma indiana (Lour.) Merr.,Adenosma indiana,Adenosma,Adenosma
443584,Adenosma caerulea R.Br.,Adenosma glutinosum (L.) Druce,Adenosma glutinosum (L.) Druce,Adenosma glutinosum (L.) Druce,Adenosma glutinosum,Adenosma glutinosa (L.) Druce,Adenosma glutinosa,Adenosma,Adenosma
443595,Adenosma glutinosa var. caerulea (R.Br.) P.C.Tsoong,Adenosma glutinosum (L.) Druce,Adenosma glutinosum (L.) Druce,Adenosma glutinosum (L.) Druce,Adenosma glutinosum,Adenosma glutinosa (L.) Druce,Adenosma glutinosa,Adenosma,Adenosma
445028,Aeschynanthus angustissimus (W.T.Wang) W.T.Wang,Aeschynanthus linearifolius var. angustissimus W.T.Wang,Aeschynanthus linearifolius var. angustissimus W.T.Wang,Aeschynanthus linearifolius var. angustissimus W.T.Wang,Aeschynanthus linearifolius,Aeschynanthus angustissimus (W.T.Wang) W.T.Wang,Aeschynanthus angustissimus,Aeschynanthus,Aeschynanthus
445124,Aeschynanthus hosseusianus Kraenzl.,Aeschynanthus andersonii C.B.Clarke,Aeschynanthus andersonii C.B.Clarke,Aeschynanthus andersonii C.B.Clarke,Aeschynanthus andersonii,Aeschynanthus persimilis Craib,Aeschynanthus persimilis,Aeschynanthus,Aeschynanthus
445199,Aeschynanthus oblongifolius (Roxb.) G.Don,Didymocarpus acuminatus R.Br.,Didymocarpus acuminatus R.Br.,Didymocarpus acuminatus R.Br.,Didymocarpus acuminatus,Henckelia oblongifolia (Roxb.) D.J.Middleton & Mich.Möller,Henckelia oblongifolia,Didymocarpus,Henckelia
445201,Aeschynanthus obovatus C.B.Clarke,Aeschynanthus volubilis Jack,Aeschynanthus volubilis Jack,Aeschynanthus volubilis Jack,Aeschynanthus volubilis,Aeschynanthus obovatus C.B.Clarke,Aeschynanthus obovatus,Aeschynanthus,Aeschynanthus
445221,Aeschynanthus persimilis Craib,Aeschynanthus andersonii C.B.Clarke,Aeschynanthus andersonii C.B.Clarke,Aeschynanthus andersonii C.B.Clarke,Aeschynanthus andersonii,Aeschynanthus persimilis Craib,Aeschynanthus persimilis,Aeschynanthus,Aeschynanthus
445238,Aeschynanthus radicans Wall.,Aeschynanthus griffithii R.Br.,Aeschynanthus griffithii R.Br.,Aeschynanthus longicaulis Wall. ex R.Br.,Aeschynanthus longicaulis,Aeschynanthus wallichii R.Br.,Aeschynanthus wallichii,Aeschynanthus,Aeschynanthus
448051,Sauropus grandifolius var. tonkinensis Beille,Breynia androgyna (L.) Chakrab. & N.P.Balakr.,Breynia androgyna (L.) Chakrab. & N.P.Balakr.,Breynia androgyna (L.) Chakrab. & N.P.Balakr.,Breynia androgyna,Breynia macrantha (Hassk.) Chakrab. & N.P.Balakr.,Breynia macrantha,Breynia,Breynia
448104,Alcea aegyptiaca Boiss.,Alcea setosa Alef.,Alcea setosa Alef.,Alcea setosa Alef.,Alcea setosa,Alcea lavateriflora Boiss.,Alcea lavateriflora,Alcea,Alcea
448123,Alcea denudata Boiss.,Alcea hohenackeri Boiss.,Alcea hohenackeri Boiss.,Alcea hohenackeri Boiss.,Alcea hohenackeri,Alcea denudata Boiss.,Alcea denudata,Alcea,Alcea
448159,Alcea lasiocalycina Boiss.,Alcea apterocarpa Boiss.,Alcea apterocarpa Boiss.,Alcea apterocarpa Boiss.,Alcea apterocarpa,Alcea lasiocalycina Boiss.,Alcea lasiocalycina,Alcea,Alcea
448178,Alcea nudicaulis var. marthae Priszter,Alcea nudicaulis (Lindl.) Boiss.,Alcea nudicaulis (Lindl.) Boiss.,Alcea nudicaulis (Lindl.) Boiss.,Alcea nudicaulis,Alcea nudiflora (Lindl.) Boiss.,Alcea nudiflora,Alcea,Alcea
448202,Alcea schirazana Alef.,Alcea kurdica (Schltdl.) Alef.,Alcea kurdica (Schltdl.) Alef.,Alcea kurdica (Schltdl.) Alef.,Alcea kurdica,Alcea schirazana Alef.,Alcea schirazana,Alcea,Alcea
448214,Alcea tholozani Stapf,Alcea hohenackeri Boiss.,Alcea hohenackeri Boiss.,Alcea hohenackeri Boiss.,Alcea hohenackeri,Alcea tholozani Stapf,Alcea tholozani,Alcea,Alcea
448379,Alectra dentata Kuntze,Alectra arvensis (Benth.) Merr.,Alectra arvensis (Benth.) Merr.,Alectra arvensis (Benth.) Merr.,Alectra arvensis,Alectra avensis (Benth.) Merr.,Alectra avensis,Alectra,Alectra
448394,Alectra indica Benth.,Alectra arvensis (Benth.) Merr.,Alectra arvensis (Benth.) Merr.,Alectra arvensis (Benth.) Merr.,Alectra arvensis,Alectra avensis (Benth.) Merr.,Alectra avensis,Alectra,Alectra
448940,Allanblackia parviflora A.Chev.,Allanblackia floribunda Oliv.,Allanblackia floribunda Oliv.,Allanblackia floribunda Oliv.,Allanblackia floribunda,Allanblackia parviflora A.Chev.,Allanblackia parviflora,Allanblackia,Allanblackia
449810,Alloplectus dielsii (Mansf.) Wiehler,Columnea peruviana Zahlbr.,Columnea peruviana Zahlbr.,Columnea peruviana Zahlbr.,Columnea peruviana,Columnea dielsii Mansf.,Columnea dielsii,Columnea,Columnea
449849,Alloplectus melittifolius Mart. ex Loudon,Chrysothemis pulchella (Sims) Decne.,Chrysothemis pulchella (Sims) Decne.,Chrysothemis pulchella (Sims) Decne.,Chrysothemis pulchella,Chrysothemis melittifolia (L.) M.M.Mora & J.L.Clark,Chrysothemis melittifolia,Chrysothemis,Chrysothemis
449874,Alloplectus rubidus C.V.Morton,Columnea nervosa Klotzsch & Hanst.,Columnea nervosa Klotzsch & Hanst.,Columnea nervosa Klotzsch & Hanst.,Columnea nervosa,Columnea rubida (C.V.Morton) C.V.Morton,Columnea rubida,Columnea,Columnea
449905,Alloplectus vinaceus (C.V.Morton) D.N.Gibson,Columnea nervosa Klotzsch & Hanst.,Columnea nervosa Klotzsch & Hanst.,Columnea nervosa Klotzsch & Hanst.,Columnea nervosa,Columnea vinacea C.V.Morton,Columnea vinacea,Columnea,Columnea
451425,Althaea africana Borbás,Anisodontea capensis (L.) D.M.Bates,Anisodontea capensis (L.) D.M.Bates,Anisodontea capensis (L.) D.M.Bates,Anisodontea capensis,Malva trimestris (L.) Salisb.,Malva trimestris,Anisodontea,Malva
451460,Althaea denudata (Boiss.) Baker f.,Alcea hohenackeri Boiss.,Alcea hohenackeri Boiss.,Alcea hohenackeri Boiss.,Alcea hohenackeri,Alcea denudata Boiss.,Alcea denudata,Alcea,Alcea
451533,Althaea officinalis subsp. micrantha Dostál,Althaea officinalis L.,Althaea officinalis L.,Althaea officinalis L.,Althaea officinalis,Althaea armeniaca Ten.,Althaea armeniaca,Althaea,Althaea
451534,Althaea officinalis var. pseudoarmeniaca Polg.,Althaea officinalis L.,Althaea officinalis L.,Althaea officinalis L.,Althaea officinalis,Althaea armeniaca Ten.,Althaea armeniaca,Althaea,Althaea
451566,Althaea taurinensis DC.,Althaea officinalis L.,Althaea officinalis L.,Althaea officinalis L.,Althaea officinalis,Althaea taurinensis DC.,Althaea taurinensis,Althaea,Althaea
451568,Althaea tholozani Baker f.,Alcea hohenackeri Boiss.,Alcea hohenackeri Boiss.,Alcea hohenackeri Boiss.,Alcea hohenackeri,Alcea tholozani Stapf,Alcea tholozani,Alcea,Alcea
453350,Ammannia teres Raf.,Ammannia latifolia L.,Ammannia latifolia L.,Ammannia latifolia L.,Ammannia latifolia,Ammannia coccinea subsp. coccinea ,Ammannia coccinea,Ammannia,Ammannia
455213,Anagallis alternifolia f. erecta R.Knuth,Lysimachia buxifolia Molina,Lysimachia buxifolia Molina,"Lysimachia amoena (Sol. ex Gaertn.) Hassemer, Funez & R.Trevis.",Lysimachia amoena,"Lysimachia lanceola (Baudo) Hassemer, Funez & R.Trevis.",Lysimachia lanceola,Lysimachia,Lysimachia
455219,Anagallis alternifolia var. parvula A.St.-Hil. & Girard,Lysimachia buxifolia Molina,Lysimachia buxifolia Molina,"Lysimachia amoena (Sol. ex Gaertn.) Hassemer, Funez & R.Trevis.",Lysimachia amoena,"Lysimachia lanceola (Baudo) Hassemer, Funez & R.Trevis.",Lysimachia lanceola,Lysimachia,Lysimachia
455228,Anagallis arvensis f. azurea Hyl.,Lysimachia arvensis (L.) U.Manns & Anderb.,Lysimachia arvensis (L.) U.Manns & Anderb.,Lysimachia arvensis (L.) U.Manns & Anderb.,Lysimachia arvensis,Lysimachia loeflingii F.J.Jiménez & M.Talavera,Lysimachia loeflingii,Lysimachia,Lysimachia
455229,Anagallis arvensis var. caerulea Gouan,Lysimachia arvensis (L.) U.Manns & Anderb.,Lysimachia arvensis (L.) U.Manns & Anderb.,Lysimachia arvensis (L.) U.Manns & Anderb.,Lysimachia arvensis,Lysimachia loeflingii F.J.Jiménez & M.Talavera,Lysimachia loeflingii,Lysimachia,Lysimachia
455230,Anagallis arvensis subsp. caerulea Hartm.,Lysimachia arvensis (L.) U.Manns & Anderb.,Lysimachia arvensis (L.) U.Manns & Anderb.,Lysimachia arvensis (L.) U.Manns & Anderb.,Lysimachia arvensis,Lysimachia foemina (Mill.) U.Manns & Anderb.,Lysimachia foemina,Lysimachia,Lysimachia
455233,Anagallis arvensis var. gentianea Beck,Lysimachia arvensis (L.) U.Manns & Anderb.,Lysimachia arvensis (L.) U.Manns & Anderb.,Lysimachia arvensis (L.) U.Manns & Anderb.,Lysimachia arvensis,Lysimachia foemina (Mill.) U.Manns & Anderb.,Lysimachia foemina,Lysimachia,Lysimachia
455234,Anagallis arvensis var. latifolia (L.) Lange,Lysimachia arvensis (L.) U.Manns & Anderb.,Lysimachia arvensis (L.) U.Manns & Anderb.,Lysimachia arvensis (L.) U.Manns & Anderb.,Lysimachia arvensis,Lysimachia loeflingii F.J.Jiménez & M.Talavera,Lysimachia loeflingii,Lysimachia,Lysimachia
455235,Anagallis arvensis subsp. latifolia (L.) Arcang.,Lysimachia arvensis (L.) U.Manns & Anderb.,Lysimachia arvensis (L.) U.Manns & Anderb.,Lysimachia arvensis (L.) U.Manns & Anderb.,Lysimachia arvensis,Lysimachia loeflingii F.J.Jiménez & M.Talavera,Lysimachia loeflingii,Lysimachia,Lysimachia
455238,Anagallis arvensis var. micrantha Gren. & Godr.,Lysimachia arvensis (L.) U.Manns & Anderb.,Lysimachia arvensis (L.) U.Manns & Anderb.,Lysimachia arvensis (L.) U.Manns & Anderb.,Lysimachia arvensis,Lysimachia talaverae L.Sáez & Aymerich,Lysimachia talaverae,Lysimachia,Lysimachia
455239,Anagallis arvensis subsp. micrantha (Gren. & Godr.) P.Fourn.,Lysimachia arvensis (L.) U.Manns & Anderb.,Lysimachia arvensis (L.) U.Manns & Anderb.,Lysimachia arvensis (L.) U.Manns & Anderb.,Lysimachia arvensis,Lysimachia talaverae L.Sáez & Aymerich,Lysimachia talaverae,Lysimachia,Lysimachia
455242,"Anagallis arvensis var. parviflora (Hoffmanns. & Link) Ces., Pass. & Gibelli",Lysimachia arvensis (L.) U.Manns & Anderb.,Lysimachia arvensis (L.) U.Manns & Anderb.,Lysimachia arvensis (L.) U.Manns & Anderb.,Lysimachia arvensis,Lysimachia talaverae L.Sáez & Aymerich,Lysimachia talaverae,Lysimachia,Lysimachia
455243,Anagallis arvensis subsp. parviflora (Hoffmanns. & Link) Arcang.,Lysimachia arvensis (L.) U.Manns & Anderb.,Lysimachia arvensis (L.) U.Manns & Anderb.,Lysimachia arvensis (L.) U.Manns & Anderb.,Lysimachia arvensis,Lysimachia talaverae L.Sáez & Aymerich,Lysimachia talaverae,Lysimachia,Lysimachia
455250,Anagallis caerulea L.,Aa Rchb.f.,Aa Rchb.f.,Aa Rchb.f.,,Lysimachia loeflingii F.J.Jiménez & M.Talavera,Lysimachia loeflingii,Aa,Lysimachia
455251,Anagallis caerulea Schreb.,Lysimachia arvensis (L.) U.Manns & Anderb.,Lysimachia arvensis (L.) U.Manns & Anderb.,Lysimachia arvensis (L.) U.Manns & Anderb.,Lysimachia arvensis,Lysimachia foemina (Mill.) U.Manns & Anderb.,Lysimachia foemina,Lysimachia,Lysimachia
455252,Anagallis caerulea var. parviflora (Hoffmanns. & Link) Salis,Lysimachia arvensis (L.) U.Manns & Anderb.,Lysimachia arvensis (L.) U.Manns & Anderb.,Lysimachia arvensis (L.) U.Manns & Anderb.,Lysimachia arvensis,Lysimachia talaverae L.Sáez & Aymerich,Lysimachia talaverae,Lysimachia,Lysimachia
455258,Anagallis coerulea Schreb.,Lysimachia arvensis (L.) U.Manns & Anderb.,Lysimachia arvensis (L.) U.Manns & Anderb.,Lysimachia arvensis (L.) U.Manns & Anderb.,Lysimachia arvensis,Lysimachia loeflingii F.J.Jiménez & M.Talavera,Lysimachia loeflingii,Lysimachia,Lysimachia
455259,Anagallis collina Schousb.,Lysimachia monelli (L.) U.Manns & Anderb.,Lysimachia monelli (L.) U.Manns & Anderb.,Lysimachia monelli (L.) U.Manns & Anderb.,Lysimachia monelli,Lysimachia collina (Schousb.) F.J.Jiménez,Lysimachia collina,Lysimachia,Lysimachia
455290,Anagallis latifolia L.,Lysimachia arvensis (L.) U.Manns & Anderb.,Lysimachia arvensis (L.) U.Manns & Anderb.,Lysimachia arvensis (L.) U.Manns & Anderb.,Lysimachia arvensis,Lysimachia loeflingii F.J.Jiménez & M.Talavera,Lysimachia loeflingii,Lysimachia,Lysimachia
455292,Anagallis linifolia var. collina (Schousb.) Ball,Lysimachia monelli (L.) U.Manns & Anderb.,Lysimachia monelli (L.) U.Manns & Anderb.,Lysimachia monelli (L.) U.Manns & Anderb.,Lysimachia monelli,Lysimachia collina (Schousb.) F.J.Jiménez,Lysimachia collina,Lysimachia,Lysimachia
455305,Anagallis monelli subsp. collina (Schousb.) H.Lindb.,Lysimachia monelli (L.) U.Manns & Anderb.,Lysimachia monelli (L.) U.Manns & Anderb.,Lysimachia monelli (L.) U.Manns & Anderb.,Lysimachia monelli,Lysimachia collina (Schousb.) F.J.Jiménez,Lysimachia collina,Lysimachia,Lysimachia
