735771,Cryptorchis aphylla Makino,Taeniophyllum glandulosum Blume,Taeniophyllum glandulosum Blume,Taeniophyllum glandulosum Blume,Taeniophyllum glandulosum,Taeniophyllum aphyllum Makino,Taeniophyllum aphyllum,Taeniophyllum,Taeniophyllum
736292,Chamaedrys quadratula (Schreb.) Raf.,Teucrium marum L.,Teucrium marum L.,Teucrium marum L.,Teucrium marum,Teucrium quadratulum Schreb.,Teucrium quadratulum,Teucrium,Teucrium
736485,Chamaesyce aequata Lunell,Euphorbia serpillifolia subsp. serpillifolia ,Euphorbia serpillifolia subsp. serpillifolia ,Euphorbia serpillifolia subsp. serpillifolia ,Euphorbia serpillifolia,Euphorbia serpyllifolia subsp. serpyllifolia ,Euphorbia serpyllifolia,Euphorbia,Euphorbia
736488,Chamaesyce albicaulis Rydb.,Euphorbia serpillifolia subsp. serpillifolia ,Euphorbia serpillifolia subsp. serpillifolia ,Euphorbia serpillifolia subsp. serpillifolia ,Euphorbia serpillifolia,Euphorbia serpyllifolia subsp. serpyllifolia ,Euphorbia serpyllifolia,Euphorbia,Euphorbia
736578,Chamaesyce consanguinea Millsp.,Euphorbia serpillifolia subsp. serpillifolia ,Euphorbia serpillifolia subsp. serpillifolia ,Euphorbia serpillifolia subsp. serpillifolia ,Euphorbia serpillifolia,Euphorbia serpyllifolia subsp. serpyllifolia ,Euphorbia serpyllifolia,Euphorbia,Euphorbia
736612,Chamaesyce erecta Lunell,Euphorbia serpillifolia subsp. serpillifolia ,Euphorbia serpillifolia subsp. serpillifolia ,Euphorbia serpillifolia subsp. serpillifolia ,Euphorbia serpillifolia,Euphorbia serpyllifolia subsp. serpyllifolia ,Euphorbia serpyllifolia,Euphorbia,Euphorbia
736679,Chamaesyce hirtula Millsp.,Euphorbia serpillifolia subsp. hirtula (Engelm. ex S.Watson) Oudejans,Euphorbia serpillifolia subsp. hirtula (Engelm. ex S.Watson) Oudejans,Euphorbia serpillifolia subsp. hirtula (Engelm. ex S.Watson) Oudejans,Euphorbia serpillifolia,Euphorbia serpyllifolia subsp. hirtula (S.Watson) Oudejans,Euphorbia serpyllifolia,Euphorbia,Euphorbia
736796,Chamaesyce neomexicana Standl.,Euphorbia serpillifolia subsp. serpillifolia ,Euphorbia serpillifolia subsp. serpillifolia ,Euphorbia serpillifolia subsp. serpillifolia ,Euphorbia serpillifolia,Euphorbia serpyllifolia subsp. serpyllifolia ,Euphorbia serpyllifolia,Euphorbia,Euphorbia
736806,Chamaesyce occidentalis Millsp.,Euphorbia serpillifolia subsp. serpillifolia ,Euphorbia serpillifolia subsp. serpillifolia ,Euphorbia serpillifolia subsp. serpillifolia ,Euphorbia serpillifolia,Euphorbia serpyllifolia subsp. serpyllifolia ,Euphorbia serpyllifolia,Euphorbia,Euphorbia
736899,Chamaesyce rugulosa Rydb.,Euphorbia serpillifolia subsp. serpillifolia ,Euphorbia serpillifolia subsp. serpillifolia ,Euphorbia serpillifolia subsp. serpillifolia ,Euphorbia serpillifolia,Euphorbia serpyllifolia subsp. serpyllifolia ,Euphorbia serpyllifolia,Euphorbia,Euphorbia
736921,Chamaesyce serpyllifolia subsp. hirtula (Engelm. ex S.Watson) Koutnik,Euphorbia serpillifolia subsp. hirtula (Engelm. ex S.Watson) Oudejans,Euphorbia serpillifolia subsp. hirtula (Engelm. ex S.Watson) Oudejans,Euphorbia serpillifolia subsp. hirtula (Engelm. ex S.Watson) Oudejans,Euphorbia serpillifolia,Euphorbia serpyllifolia subsp. hirtula (S.Watson) Oudejans,Euphorbia serpyllifolia,Euphorbia,Euphorbia
736970,Chamaesyce vallis-mortuae Millsp.,Euphorbia vallis-mortae (Millsp.) J.T.Howell,Euphorbia vallis-mortae (Millsp.) J.T.Howell,Euphorbia vallis-mortae (Millsp.) J.T.Howell,Euphorbia vallis-mortae,Euphorbia vallis-mortuae (Millsp.) J.T.Howell,Euphorbia vallis-mortuae,Euphorbia,Euphorbia
737482,Acalypha communis var. hispida Müll.Arg.,Acalypha communis Müll.Arg.,Acalypha communis Müll.Arg.,Acalypha communis Müll.Arg.,Acalypha communis,Acalypha variabilis Klotzsch ex Baill.,Acalypha variabilis,Acalypha,Acalypha
738023,Cheirostylis gymnochiloides (Ridl.) Rchb.f.,Cheirostylis nuda (Thouars) Ormerod,Cheirostylis nuda (Thouars) Ormerod,Cheirostylis nuda (Thouars) Ormerod,Cheirostylis nuda,Cheirostylis gymnochiloides (Ridl.) Rchb.f.,Cheirostylis gymnochiloides,Cheirostylis,Cheirostylis
738042,Cheirostylis humblotii Rchb.f.,Cheirostylis nuda (Thouars) Ormerod,Cheirostylis nuda (Thouars) Ormerod,Cheirostylis nuda (Thouars) Ormerod,Cheirostylis nuda,Cheirostylis gymnochiloides (Ridl.) Rchb.f.,Cheirostylis gymnochiloides,Cheirostylis,Cheirostylis
738192,Cheirostylis micrantha Schltr.,Cheirostylis nuda (Thouars) Ormerod,Cheirostylis nuda (Thouars) Ormerod,Cheirostylis nuda (Thouars) Ormerod,Cheirostylis nuda,Cheirostylis gymnochiloides (Ridl.) Rchb.f.,Cheirostylis gymnochiloides,Cheirostylis,Cheirostylis
742392,Acalypha communis var. rotundata Griseb.,Acalypha communis Müll.Arg.,Acalypha communis Müll.Arg.,Acalypha communis Müll.Arg.,Acalypha communis,Acalypha variabilis Klotzsch ex Baill.,Acalypha variabilis,Acalypha,Acalypha
768050,Acalypha cordobensis Müll.Arg.,Acalypha communis Müll.Arg.,Acalypha communis Müll.Arg.,Acalypha communis Müll.Arg.,Acalypha communis,Acalypha variabilis Klotzsch ex Baill.,Acalypha variabilis,Acalypha,Acalypha
770189,Cleisostoma ornithorrhynchum (Rchb.f.) Garay,Robiquetia rosea (Lindl.) Garay,Robiquetia rosea (Lindl.) Garay,Robiquetia rosea (Lindl.) Garay,Robiquetia rosea,Cleisostoma discolor Lindl.,Cleisostoma discolor,Robiquetia,Cleisostoma
775295,Clerodendrum blumeanum Schauer,Clerodendrum buchananii (Roxb.) Walp.,Clerodendrum buchananii (Roxb.) Walp.,Clerodendrum buchananii (Roxb.) Walp.,Clerodendrum buchananii,Clerodendrum speciosissimum Jacob-Makoy,Clerodendrum speciosissimum,Clerodendrum,Clerodendrum
775732,Clerodendrum cardiophyllum F.Muell.,Clerodendrum floribundum var. coriaceum (R.Br.) Moldenke,Clerodendrum floribundum var. coriaceum (R.Br.) Moldenke,Clerodendrum costatum R.Br.,Clerodendrum costatum,Clerodendrum floribundum var. ovatum (R.Br.) Domin,Clerodendrum floribundum,Clerodendrum,Clerodendrum
776300,Clerodendrum cubense var. brachypus (Urb.) Kereszty,Clerodendrum cubense Schauer,Clerodendrum cubense Schauer,Ovieda cubensis (Schauer) I.E.Méndez,Ovieda cubensis,Ovieda brachypus (Urb.) I.E.Méndez,Ovieda brachypus,Ovieda,Ovieda
778131,Clerodendrum illustre N.E.Br.,Clerodendrum japonicum (Thunb.) Sweet,Clerodendrum japonicum (Thunb.) Sweet,Clerodendrum japonicum (Thunb.) Sweet,Clerodendrum japonicum,Clerodendrum intermedium Cham.,Clerodendrum intermedium,Clerodendrum,Clerodendrum
779143,Clerodendrum longituba Valeton,Clerodendrum longiflorum Decne.,Clerodendrum longiflorum Decne.,Clerodendrum longiflorum Decne.,Clerodendrum longiflorum,Clerodendrum costatum R.Br.,Clerodendrum costatum,Clerodendrum,Clerodendrum
781867,Clerodendrum speciosum Teijsm. & Binn. ex Wigman,Clerodendrum japonicum (Thunb.) Sweet,Clerodendrum japonicum (Thunb.) Sweet,Clerodendrum japonicum (Thunb.) Sweet,Clerodendrum japonicum,Clerodendrum speciosissimum Jacob-Makoy,Clerodendrum speciosissimum,Clerodendrum,Clerodendrum
782339,Clerodendrum thonneri Gürke,Clerodendrum silvanum var. silvanum ,Clerodendrum silvanum var. silvanum ,Clerodendrum silvanum var. silvanum ,Clerodendrum silvanum,Clerodendrum tanganyikense Baker,Clerodendrum tanganyikense,Clerodendrum,Clerodendrum
804178,Glochidion fortunei var. longistylum H.Keng,Phyllanthus puberus (L.) Müll.Arg.,Phyllanthus puberus (L.) Müll.Arg.,Glochidion puberum (L.) Hutch.,Glochidion puberum,Glochidion rubrum var. rubrum ,Glochidion rubrum,Glochidion,Glochidion
804209,Phyllanthus roeperianus var. parvifolius (Buch.-Ham. ex D.Don) Müll.Arg.,Phyllanthus niruri subsp. lathyroides (Kunth) G.L.Webster,Phyllanthus niruri subsp. lathyroides (Kunth) G.L.Webster,Phyllanthus niruri subsp. lathyroides (Kunth) G.L.Webster,Phyllanthus niruri,Phyllanthus roeperianus Wall. ex Müll.Arg.,Phyllanthus roeperianus,Phyllanthus,Phyllanthus
804311,Gladiolus hirsutus var. tenuiflorus Ker Gawl.,Watsonia humilis Mill.,Watsonia humilis Mill.,Watsonia humilis Mill.,Watsonia humilis,Gladiolus merianellus (L.) Thunb.,Gladiolus merianellus,Watsonia,Gladiolus
804434,Microtoena urticifolia var. subdentata Hand.-Mazz.,Microtoena urticifolia Hemsl.,Microtoena urticifolia Hemsl.,Microtoena urticifolia Hemsl.,Microtoena urticifolia,Microtoena wardii Stearn,Microtoena wardii,Microtoena,Microtoena
804455,Pogostemon patchouly var. suavis (Ten.) Hook.f.,Pogostemon heyneanus Benth.,Pogostemon heyneanus Benth.,Pogostemon heyneanus Benth.,Pogostemon heyneanus,Pogostemon cablin (Blanco) Benth.,Pogostemon cablin,Pogostemon,Pogostemon
804521,Teucrium polium f. angustifolium Sennen ex Maire,Teucrium lusitanicum Schreb.,Teucrium lusitanicum Schreb.,Teucrium lusitanicum Schreb.,Teucrium lusitanicum,Teucrium doumerguei Sennen,Teucrium doumerguei,Teucrium,Teucrium
805057,Glochidion fortunei var. megacarpum H.Keng,Phyllanthus puberus (L.) Müll.Arg.,Phyllanthus puberus (L.) Müll.Arg.,Glochidion puberum (L.) Hutch.,Glochidion puberum,Glochidion rubrum var. rubrum ,Glochidion rubrum,Glochidion,Glochidion
805058,Glochidion pseudo-obscurum var. glabrum Pamp.,Phyllanthus puberus (L.) Müll.Arg.,Phyllanthus puberus (L.) Müll.Arg.,Glochidion puberum (L.) Hutch.,Glochidion puberum,Glochidion wilsonii Hutch.,Glochidion wilsonii,Glochidion,Glochidion
805059,Glochidion pseudo-obscurum var. lanceolatum Pamp.,Phyllanthus puberus (L.) Müll.Arg.,Phyllanthus puberus (L.) Müll.Arg.,Glochidion puberum (L.) Hutch.,Glochidion puberum,Glochidion wilsonii Hutch.,Glochidion wilsonii,Glochidion,Glochidion
805408,Vitex cauliflora var. longifolia Moldenke,Vitex cauliflora Moldenke,Vitex cauliflora Moldenke,Vitex cauliflora Moldenke,Vitex cauliflora,Vitex humblotiana Callm. & Phillipson,Vitex humblotiana,Vitex,Vitex
805409,Vitex cauliflora var. villosissima Moldenke,Vitex cauliflora Moldenke,Vitex cauliflora Moldenke,Vitex cauliflora Moldenke,Vitex cauliflora,Vitex villosissima (Moldenke) Callm. & Phillipson,Vitex villosissima,Vitex,Vitex
807667,Coleus ascendens Gilli,Plectranthus alpinus (Vatke) Ryding,Plectranthus alpinus (Vatke) Ryding,Coleus alpinus Vatke,Coleus alpinus,Coleus autranii Briq.,Coleus autranii,Coleus,Coleus
808980,Aalius forcipata (Hook.f.) Kuntze,Breynia androgyna (L.) Chakrab. & N.P.Balakr.,Breynia androgyna (L.) Chakrab. & N.P.Balakr.,Breynia androgyna (L.) Chakrab. & N.P.Balakr.,Breynia androgyna,Breynia macrantha (Hassk.) Chakrab. & N.P.Balakr.,Breynia macrantha,Breynia,Breynia
809004,Coleus lyratus (A.Chev.) Roberty,Plectranthus betonicifolius Baker,Plectranthus betonicifolius Baker,Coleus betonicifolius (Baker) A.J.Paton,Coleus betonicifolius,Coleus lyratus (A.Chev.) Roberty,Coleus lyratus,Coleus,Coleus
809191,Clerodendrum longiflorum var. pubescens Moldenke,Clerodendrum longiflorum Decne.,Clerodendrum longiflorum Decne.,Clerodendrum longiflorum Decne.,Clerodendrum longiflorum,Clerodendrum costatum R.Br.,Clerodendrum costatum,Clerodendrum,Clerodendrum
812767,Crocus vernus f. intermedius Vuk. ex Beck,Crocus vernus (L.) Hill,Crocus vernus (L.) Hill,Crocus vernus (L.) Hill,Crocus vernus,Crocus duplex Weston,Crocus duplex,Crocus,Crocus
812769,Crocus vernus f. niveus Derganc,Crocus vernus (L.) Hill,Crocus vernus (L.) Hill,Crocus vernus (L.) Hill,Crocus vernus,Crocus duplex Weston,Crocus duplex,Crocus,Crocus
812770,Crocus albiflorus subsp. neapolitanus (Ker Gawl.) Suess.,Crocus imperati Ten.,Crocus imperati Ten.,Crocus imperati Ten.,Crocus imperati,Crocus neapolitanus (Ker Gawl.) Loisel.,Crocus neapolitanus,Crocus,Crocus
812895,Crocus reticulatus f. confusus Gajic & Oldja,Crocus reticulatus Steven ex Adams,Crocus reticulatus Steven ex Adams,Crocus reticulatus Steven ex Adams,Crocus reticulatus,Crocus variegatus Hoppe & Hornsch.,Crocus variegatus,Crocus,Crocus
812896,Crocus reticulatus f. nadae Gajic,Crocus reticulatus Steven ex Adams,Crocus reticulatus Steven ex Adams,Crocus reticulatus Steven ex Adams,Crocus reticulatus,Crocus variegatus Hoppe & Hornsch.,Crocus variegatus,Crocus,Crocus
813523,Stachys libanotica var. minor Boiss.,Stachys libanotica Benth.,Stachys libanotica Benth.,Stachys libanotica Benth.,Stachys libanotica,Stachys minor (Boiss.) Akçiçek & Dirmenci,Stachys minor,Stachys,Stachys
814298,Watsonia filifolia E.Mey.,Thereianthus spicatus (L.) G.J.Lewis,Thereianthus spicatus (L.) G.J.Lewis,Thereianthus spicatus (L.) G.J.Lewis,Thereianthus spicatus,Thereianthus ixioides G.J.Lewis,Thereianthus ixioides,Thereianthus,Thereianthus
815871,"Platanthera lesbiaca Devillers-Tersch., Devillers, Dedroog, Baeten & Flausch",Platanthera chlorantha (Custer) Rchb.,Platanthera chlorantha (Custer) Rchb.,Platanthera chlorantha (Custer) Rchb.,Platanthera chlorantha,Platanthera holmboei H.Lindb.,Platanthera holmboei,Platanthera,Platanthera
817977,Coriaria sarmentosa G.Forst.,Coriaria ruscifolia L.,Coriaria ruscifolia L.,Coriaria ruscifolia L.,Coriaria ruscifolia,Coriaria sarmentosa G.Forst.,Coriaria sarmentosa,Coriaria,Coriaria
818806,Corymbia byrnesii (D.J.Carr & S.G.M.Carr) K.D.Hill & L.A.S.Johnson,Corymbia greeniana (D.J.Carr & S.G.M.Carr) K.D.Hill & L.A.S.Johnson,Corymbia greeniana (D.J.Carr & S.G.M.Carr) K.D.Hill & L.A.S.Johnson,Corymbia greeniana (D.J.Carr & S.G.M.Carr) K.D.Hill & L.A.S.Johnson,Corymbia greeniana,Corymbia byrnesii (D.J.Carr & S.G.M.Carr) K.D.Hill & L.A.S.Johnson,Corymbia byrnesii,Corymbia,Corymbia
818818,Corymbia capricornia (D.J.Carr & S.G.M.Carr) K.D.Hill & L.A.S.Johnson,Corymbia dichromophloia (F.Muell.) K.D.Hill & L.A.S.Johnson,Corymbia dichromophloia (F.Muell.) K.D.Hill & L.A.S.Johnson,Corymbia dichromophloia (F.Muell.) K.D.Hill & L.A.S.Johnson,Corymbia dichromophloia,Corymbia capricornia (D.J.Carr & S.G.M.Carr) K.D.Hill & L.A.S.Johnson,Corymbia capricornia,Corymbia,Corymbia
818824,Corymbia chlorolampra K.D.Hill & L.A.S.Johnson,Corymbia haematoxylon (Maiden) K.D.Hill & L.A.S.Johnson,Corymbia haematoxylon (Maiden) K.D.Hill & L.A.S.Johnson,Corymbia haematoxylon (Maiden) K.D.Hill & L.A.S.Johnson,Corymbia haematoxylon,Corymbia chlorolampra K.D.Hill & L.A.S.Johnson,Corymbia chlorolampra,Corymbia,Corymbia
818826,Corymbia citriodora subsp. variegata (F.Muell.) A.R.Bean & M.W.McDonald,Corymbia citriodora (Hook.) K.D.Hill & L.A.S.Johnson,Corymbia citriodora (Hook.) K.D.Hill & L.A.S.Johnson,Corymbia citriodora (Hook.) K.D.Hill & L.A.S.Johnson,Corymbia citriodora,Corymbia variegata (F.Muell.) K.D.Hill & L.A.S.Johnson,Corymbia variegata,Corymbia,Corymbia
818832,Aalius macrantha (Hassk.) Kuntze,Breynia androgyna (L.) Chakrab. & N.P.Balakr.,Breynia androgyna (L.) Chakrab. & N.P.Balakr.,Breynia androgyna (L.) Chakrab. & N.P.Balakr.,Breynia androgyna,Breynia macrantha (Hassk.) Chakrab. & N.P.Balakr.,Breynia macrantha,Breynia,Breynia
818842,Corymbia dimorpha (Brooker & A.R.Bean) K.D.Hill & L.A.S.Johnson,Corymbia peltata (Benth.) K.D.Hill & L.A.S.Johnson,Corymbia peltata (Benth.) K.D.Hill & L.A.S.Johnson,Corymbia peltata (Benth.) K.D.Hill & L.A.S.Johnson,Corymbia peltata,Corymbia dimorpha (Brooker & A.R.Bean) K.D.Hill & L.A.S.Johnson,Corymbia dimorpha,Corymbia,Corymbia
818899,Corymbia drysdalensis (D.J.Carr & S.G.M.Carr) K.D.Hill & L.A.S.Johnson,Corymbia dichromophloia (F.Muell.) K.D.Hill & L.A.S.Johnson,Corymbia dichromophloia (F.Muell.) K.D.Hill & L.A.S.Johnson,Corymbia dichromophloia (F.Muell.) K.D.Hill & L.A.S.Johnson,Corymbia dichromophloia,Corymbia drysdalensis (D.J.Carr & S.G.M.Carr) K.D.Hill & L.A.S.Johnson,Corymbia drysdalensis,Corymbia,Corymbia
818996,Corymbia variegata (F.Muell.) K.D.Hill & L.A.S.Johnson,Corymbia citriodora (Hook.) K.D.Hill & L.A.S.Johnson,Corymbia citriodora (Hook.) K.D.Hill & L.A.S.Johnson,Corymbia citriodora (Hook.) K.D.Hill & L.A.S.Johnson,Corymbia citriodora,Corymbia variegata (F.Muell.) K.D.Hill & L.A.S.Johnson,Corymbia variegata,Corymbia,Corymbia
820335,Aalius macrophylla (Hook.f.) Kuntze,Breynia androgyna (L.) Chakrab. & N.P.Balakr.,Breynia androgyna (L.) Chakrab. & N.P.Balakr.,Breynia androgyna (L.) Chakrab. & N.P.Balakr.,Breynia androgyna,Breynia macrantha (Hassk.) Chakrab. & N.P.Balakr.,Breynia macrantha,Breynia,Breynia
820518,Croton acerifolius A.Cunn. ex Hook.,Adriana tomentosa var. tomentosa ,Adriana tomentosa var. tomentosa ,Adriana tomentosa var. tomentosa ,Adriana tomentosa,Adriana urticoides var. urticoides ,Adriana urticoides,Adriana,Adriana
820576,Croton albidus Müll.Arg.,Croton flavens L.,Croton flavens L.,Croton flavens L.,Croton flavens,Croton humilis L.,Croton humilis,Croton,Croton
820727,Croton baldauffii Leandri,Croton stanneus Baill.,Croton stanneus Baill.,Croton stanneus Baill.,Croton stanneus,Croton stanneum Baill.,Croton stanneum,Croton,Croton
820737,Croton barorum var. mangokyensis Leandri,Croton ihosianus Leandri,Croton ihosianus Leandri,Croton ihosianus Leandri,Croton ihosianus,Croton ihosiana Leandri,Croton ihosiana,Croton,Croton
820968,Agyneia bacciformis var. angustifolia Müll.Arg.,Synostemon bacciformis (L.) G.L.Webster,Synostemon bacciformis (L.) G.L.Webster,Synostemon bacciformis (L.) G.L.Webster,Synostemon bacciformis,Phyllanthus racemosus L.f.,Phyllanthus racemosus,Synostemon,Phyllanthus
821134,Agyneia multilocularis Moon,Phyllanthus multilocularis (Roxb. ex Willd.) Müll.Arg.,Phyllanthus multilocularis (Roxb. ex Willd.) Müll.Arg.,Glochidion multiloculare (Roxb. ex Willd.) Voigt,Glochidion multiloculare,Aporosa lanceolata (Tul.) Thwaites,Aporosa lanceolata,Glochidion,Aporosa
821140,Croton dioicus Willd.,Croton dioicus Cav.,Croton dioicus Cav.,Croton dioicus Cav.,Croton dioicus,Croton dioicum Cav.,Croton dioicum,Croton,Croton
821148,Croton distans Wall.,Mallotus philippensis (Lam.) Müll.Arg.,Mallotus philippensis (Lam.) Müll.Arg.,Mallotus philippensis (Lam.) Müll.Arg.,Mallotus philippensis,Mallotus distans Müll.Arg.,Mallotus distans,Mallotus,Mallotus
821195,Croton elaeagnifolius Vahl,Croton dioicus Cav.,Croton dioicus Cav.,Croton dioicus Cav.,Croton dioicus,Croton dioicum Cav.,Croton dioicum,Croton,Croton
821271,Croton flavescens Greenm.,Croton morifolius Willd.,Croton morifolius Willd.,Croton morifolius Willd.,Croton morifolius,Croton flavescens Greenm.,Croton flavescens,Croton,Croton
821272,Croton flavescens var. brandegeeanus Croizat,Croton morifolius Willd.,Croton morifolius Willd.,Croton morifolius Willd.,Croton morifolius,Croton flavescens Greenm.,Croton flavescens,Croton,Croton
821280,Croton floribundus var. piauhyensis Rizzini,Croton floribundus Spreng.,Croton floribundus Spreng.,Croton floribundus Spreng.,Croton floribundus,Croton blanchetianus Baill.,Croton blanchetianus,Croton,Croton
822737,Croton gracilis Kunth,Croton dioicus Cav.,Croton dioicus Cav.,Croton dioicus Cav.,Croton dioicus,Croton dioicum Cav.,Croton dioicum,Croton,Croton
822800,Croton gracilis var. longiradiatus Müll.Arg.,Croton dioicus Cav.,Croton dioicus Cav.,Croton dioicus Cav.,Croton dioicus,Croton dioicum Cav.,Croton dioicum,Croton,Croton
823351,Croton ikopae Leandri,Croton stanneus Baill.,Croton stanneus Baill.,Croton stanneus Baill.,Croton stanneus,Croton stanneum Baill.,Croton stanneum,Croton,Croton
823479,Croton lamarckianus Moldenke,Croton flavens L.,Croton flavens L.,Croton flavens L.,Croton flavens,Croton eluteria (L.) W.Wright,Croton eluteria,Croton,Croton
823519,Croton lawianus Nimmo,Croton chakrabartyi Dhabak & Nandikar,Croton chakrabartyi Dhabak & Nandikar,Croton chakrabartyi Dhabak & Nandikar,Croton chakrabartyi,Croton lawianus Nimmo,Croton lawianus,Croton,Croton
823807,Croton morifolius var. brandegeeanus (Croizat) G.L.Webster,Croton morifolius Willd.,Croton morifolius Willd.,Croton morifolius Willd.,Croton morifolius,Croton flavescens Greenm.,Croton flavescens,Croton,Croton
823850,Croton neomexicanus Müll.Arg.,Croton dioicus Cav.,Croton dioicus Cav.,Croton dioicus Cav.,Croton dioicus,Croton dioicum Cav.,Croton dioicum,Croton,Croton
823964,Croton palustris Vell.,Croton vellozianus Müll.Arg.,Croton vellozianus Müll.Arg.,Croton vellozianus Müll.Arg.,Croton vellozianus,Croton vellozoanus Müll.Arg.,Croton vellozoanus,Croton,Croton
824025,Croton perrieri Leandri,Croton stanneus Baill.,Croton stanneus Baill.,Croton stanneus Baill.,Croton stanneus,Croton stanneum Baill.,Croton stanneum,Croton,Croton
824481,Croton stenophyllus var. brevifolius Müll.Arg.,Croton stenophyllus Griseb.,Croton stenophyllus Griseb.,Croton stenophyllus Griseb.,Croton stenophyllus,Croton flavens L.,Croton flavens,Croton,Croton
824571,Croton tenuiramis Urb.,Croton stenophyllus Griseb.,Croton stenophyllus Griseb.,Croton stenophyllus Griseb.,Croton stenophyllus,Croton flavens L.,Croton flavens,Croton,Croton
824608,Croton tomentosus Link,Croton dioicus Cav.,Croton dioicus Cav.,Croton dioicus Cav.,Croton dioicus,Croton dioicum Cav.,Croton dioicum,Croton,Croton
825602,Cuspidocarpus rupestris Spenn.,Clinopodium thymifolium Kuntze,Clinopodium thymifolium Kuntze,Clinopodium × hostii (Caruel) Bräuchler,Clinopodium hostii,Clinopodium album (Waldst. & Kit.) Bräuchler & Govaerts,Clinopodium album,Clinopodium,Clinopodium
826014,Cyclopogon tuerckheimii (Schltr.) Schltr.,Greenwoodiella micrantha (Lex.) Salazar & R.Jiménez,Greenwoodiella micrantha (Lex.) Salazar & R.Jiménez,Greenwoodiella micrantha (Lex.) Salazar & R.Jiménez,Greenwoodiella micrantha,Schiedeella transversalis (A.Rich. & Galeotti) Schltr.,Schiedeella transversalis,Greenwoodiella,Schiedeella
826185,Aalius retroversa (Wight) Kuntze,Breynia androgyna (L.) Chakrab. & N.P.Balakr.,Breynia androgyna (L.) Chakrab. & N.P.Balakr.,Breynia androgyna (L.) Chakrab. & N.P.Balakr.,Breynia androgyna,Breynia retroversa (Wight) Chakrab. & N.P.Balakr.,Breynia retroversa,Breynia,Breynia
826553,Ajuga nanti Boreau,Ajuga pyramidalis subsp. pyramidalis ,Ajuga pyramidalis subsp. pyramidalis ,Ajuga pyramidalis subsp. pyramidalis ,Ajuga pyramidalis,Ajuga reptans L.,Ajuga reptans,Ajuga,Ajuga
828116,Alajja anomala (Juz.) Ikonn.,Eriophyton rhomboideum (Benth.) Ryding,Eriophyton rhomboideum (Benth.) Ryding,Eriophyton rhomboideum (Benth.) Ryding,Eriophyton rhomboideum,Eriophyton anomalum (Juz.) Lazkov & Sennikov,Eriophyton anomalum,Eriophyton,Eriophyton
829881,Aalius spectabilis (Miq.) Kuntze,Breynia androgyna (L.) Chakrab. & N.P.Balakr.,Breynia androgyna (L.) Chakrab. & N.P.Balakr.,Breynia androgyna (L.) Chakrab. & N.P.Balakr.,Breynia androgyna,Breynia macrantha (Hassk.) Chakrab. & N.P.Balakr.,Breynia macrantha,Breynia,Breynia
833633,Diasperus anabaptizatus (Müll.Arg.) Kuntze,Phyllanthus zeylanicus (Gaertn.) Müll.Arg.,Phyllanthus zeylanicus (Gaertn.) Müll.Arg.,Glochidion zeylanicum (Gaertn.) A.Juss.,Glochidion zeylanicum,Phyllanthus zeylanicus Müll.Arg.,Phyllanthus zeylanicus,Glochidion,Phyllanthus
833769,Diasperus flueggeiformis Kuntze,Flueggea virosa (Roxb. ex Willd.) Royle,Flueggea virosa (Roxb. ex Willd.) Royle,Flueggea virosa (Roxb. ex Willd.) Royle,Flueggea virosa,Phyllanthus glaucus Wall. ex Müll.Arg.,Phyllanthus glaucus,Flueggea,Phyllanthus
833914,Diasperus minutiflorus (F.Muell. ex Müll.Arg.) Kuntze,Phyllanthus simplex Retz.,Phyllanthus simplex Retz.,Phyllanthus virgatus G.Forst.,Phyllanthus virgatus,Phyllanthus minutiflorus F.Muell. ex Müll.Arg.,Phyllanthus minutiflorus,Phyllanthus,Phyllanthus
833917,Diasperus miquelianus (Müll.Arg.) Kuntze,Phyllanthus simplex Retz.,Phyllanthus simplex Retz.,Phyllanthus virgatus G.Forst.,Phyllanthus virgatus,Phyllanthus gardnerianus (Wight) Baill.,Phyllanthus gardnerianus,Phyllanthus,Phyllanthus
833921,Diasperus mocinianus (Baill.) Kuntze,Phyllanthus mocinianus Baill.,Phyllanthus mocinianus Baill.,Phyllanthus mocinianus Baill.,Phyllanthus mocinianus,Phyllanthus mocinoanus Baill.,Phyllanthus mocinoanus,Phyllanthus,Phyllanthus
834041,Diasperus rhytidospermus (F.Muell. ex Müll.Arg.) Kuntze,Synostemon trachyspermus (F.Muell.) I.Telford & Pruesapan,Synostemon trachyspermus (F.Muell.) I.Telford & Pruesapan,Synostemon trachyspermus (F.Muell.) I.Telford & Pruesapan,Synostemon trachyspermus,Synostemon rhytidospermus (Müll.Arg.) I.Telford & Pruesapan,Synostemon rhytidospermus,Synostemon,Synostemon
839259,Eleutherococcus pentaphyllus Nakai,Eleutherococcus sieboldianus (Makino) Koidz.,Eleutherococcus sieboldianus (Makino) Koidz.,Eleutherococcus sieboldianus (Makino) Koidz.,Eleutherococcus sieboldianus,Eleutherococcus japonicus (Franch. & Sav.) Nakai,Eleutherococcus japonicus,Eleutherococcus,Eleutherococcus
843451,Epistylium phyllanthoides Baill.,Phyllanthus pulcher Wall. ex Müll.Arg.,Phyllanthus pulcher Wall. ex Müll.Arg.,Phyllanthus pulcher Wall. ex Müll.Arg.,Phyllanthus pulcher,Phyllanthus heyneanus Müll.Arg.,Phyllanthus heyneanus,Phyllanthus,Phyllanthus
843452,Epistylium polyphyllum (Wight) Thwaites,Phyllanthus zeylanicus (Gaertn.) Müll.Arg.,Phyllanthus zeylanicus (Gaertn.) Müll.Arg.,Glochidion zeylanicum (Gaertn.) A.Juss.,Glochidion zeylanicum,Phyllanthus zeylanicus Müll.Arg.,Phyllanthus zeylanicus,Glochidion,Phyllanthus
843455,Epistylium zeylanicum Baill.,Glochidion zeylanicum (Gaertn.) A.Juss.,Glochidion zeylanicum (Gaertn.) A.Juss.,Glochidion zeylanicum (Gaertn.) A.Juss.,Glochidion zeylanicum,Phyllanthus zeylanicus Müll.Arg.,Phyllanthus zeylanicus,Glochidion,Phyllanthus
843537,Eremocarpus setigerus Benth.,Croton setiger Hook.,Croton setiger Hook.,Croton setiger Hook.,Croton setiger,Croton setigerus Hook.,Croton setigerus,Croton,Croton
843935,Eria dolichocarpa Schltr.,Pinalia fitzalanii (F.Muell.) Kuntze,Pinalia fitzalanii (F.Muell.) Kuntze,Pinalia fitzalanii (F.Muell.) Kuntze,Pinalia fitzalanii,"Pinalia moluccana (Schltr. & J.J.Sm.) Schuit., Y.P.Ng & H.A.Pedersen",Pinalia moluccana,Pinalia,Pinalia
844577,Erianthera anomala Juz.,Eriophyton rhomboideum (Benth.) Ryding,Eriophyton rhomboideum (Benth.) Ryding,Eriophyton rhomboideum (Benth.) Ryding,Eriophyton rhomboideum,Eriophyton anomalum (Juz.) Lazkov & Sennikov,Eriophyton anomalum,Eriophyton,Eriophyton
844737,Erporkis bracteata Kuntze,Platylepis occulta (Thouars) Rchb.f.,Platylepis occulta (Thouars) Rchb.f.,Platylepis occulta (Thouars) Rchb.f.,Platylepis occulta,Goodyera bracteata Thouars,Goodyera bracteata,Platylepis,Goodyera
845287,Eucalyptus aenea K.D.Hill,Eucalyptus viridis R.T.Baker,Eucalyptus viridis R.T.Baker,Eucalyptus viridis R.T.Baker,Eucalyptus viridis,Eucalyptus aenea K.D.Hill,Eucalyptus aenea,Eucalyptus,Eucalyptus
