1015593,Rhodobryum leucothrix (Müll. Hal.) Broth.,Rhodobryum roseum (Hedw.) Limpr.,Rhodobryum roseum (Hedw.) Limpr.,Rhodobryum roseum (Hedw.) Limpr.,Rhodobryum roseum,Rhodobryum ontariense (Kindb.) Paris,Rhodobryum ontariense,Rhodobryum,Rhodobryum
1015595,Rhodobryum liebmannii (Schimp.) Paris,Rosulabryum billarderi (Schwägr.) J.R. Spence,Rosulabryum billarderi (Schwägr.) J.R. Spence,Rosulabryum billarderi (Schwägr.) J.R. Spence,Rosulabryum billarderi,Rosulabryum andicola (Hook.) Ochyra,Rosulabryum andicola,Rosulabryum,Rosulabryum
1015639,Rhodobryum rosulatum (Müll. Hal.) Paris,Rosulabryum billarderi (Schwägr.) J.R. Spence,Rosulabryum billarderi (Schwägr.) J.R. Spence,Rosulabryum billarderi (Schwägr.) J.R. Spence,Rosulabryum billarderi,Rosulabryum andicola (Hook.) Ochyra,Rosulabryum andicola,Rosulabryum,Rosulabryum
1015643,Rhodobryum sartorii (Schimp.) Paris,Rosulabryum billarderi (Schwägr.) J.R. Spence,Rosulabryum billarderi (Schwägr.) J.R. Spence,Rosulabryum billarderi (Schwägr.) J.R. Spence,Rosulabryum billarderi,Rosulabryum andicola (Hook.) Ochyra,Rosulabryum andicola,Rosulabryum,Rosulabryum
1015648,Rhodobryum stenothecium Hampe,Rosulabryum billarderi (Schwägr.) J.R. Spence,Rosulabryum billarderi (Schwägr.) J.R. Spence,Rosulabryum billarderi (Schwägr.) J.R. Spence,Rosulabryum billarderi,Rosulabryum andicola (Hook.) Ochyra,Rosulabryum andicola,Rosulabryum,Rosulabryum
1015649,Rhodobryum streptorhodon (Müll. Hal.) Paris,Rosulabryum billarderi (Schwägr.) J.R. Spence,Rosulabryum billarderi (Schwägr.) J.R. Spence,Rosulabryum billarderi (Schwägr.) J.R. Spence,Rosulabryum billarderi,Rosulabryum andicola (Hook.) Ochyra,Rosulabryum andicola,Rosulabryum,Rosulabryum
1016104,Didymodon warnstorfii (Limpr.) Paris,Hydrogonium orientale (F. Weber) Jan Kučera,Hydrogonium orientale (F. Weber) Jan Kučera,Hydrogonium orientale (F. Weber) Jan Kučera,Hydrogonium orientale,Hyophila involuta (Hook.) A. Jaeger,Hyophila involuta,Hydrogonium,Hyophila
1016882,Dryptodon crispus Brid.,Ditrichum difficile (Duby) M. Fleisch.,Ditrichum difficile (Duby) M. Fleisch.,Ditrichum difficile (Duby) M. Fleisch.,Ditrichum difficile,Ptychomitrium crispatum (Hedw.) A. Jaeger,Ptychomitrium crispatum,Ditrichum,Ptychomitrium
1017163,Ectropothecium meyenianum (Hampe) A. Jaeger,Vesicularia vesicularis (Schwägr.) Broth.,Vesicularia vesicularis (Schwägr.) Broth.,Vesicularia vesicularis (Schwägr.) Broth.,Vesicularia vesicularis,Vesicularia montagnei (Bél.) Broth.,Vesicularia montagnei,Vesicularia,Vesicularia
1017173,Ectropothecium montagnei (Bél.) A. Jaeger,Vesicularia vesicularis (Schwägr.) Broth.,Vesicularia vesicularis (Schwägr.) Broth.,Vesicularia vesicularis (Schwägr.) Broth.,Vesicularia vesicularis,Vesicularia montagnei (Bél.) Broth.,Vesicularia montagnei,Vesicularia,Vesicularia
1018539,Bryum dawsonense R.S. Williams,Ptychostomum intermedium (Brid.) J.R. Spence,Ptychostomum intermedium (Brid.) J.R. Spence,Ptychostomum intermedium (Brid.) J.R. Spence,Ptychostomum intermedium,Ptychostomum nitidulum (Lindb.) J.R. Spence,Ptychostomum nitidulum,Ptychostomum,Ptychostomum
1018563,Bryum devium I. Hagen,Ptychostomum archangelicum (Bruch & Schimp.) J.R. Spence,Ptychostomum archangelicum (Bruch & Schimp.) J.R. Spence,Ptychostomum archangelicum (Bruch & Schimp.) J.R. Spence,Ptychostomum archangelicum,Ptychostomum inclinatum (Sw. ex Brid.) J.R. Spence,Ptychostomum inclinatum,Ptychostomum,Ptychostomum
1018588,Bryum dovrense Schimp.,Ptychostomum archangelicum (Bruch & Schimp.) J.R. Spence,Ptychostomum archangelicum (Bruch & Schimp.) J.R. Spence,Ptychostomum archangelicum (Bruch & Schimp.) J.R. Spence,Ptychostomum archangelicum,Ptychostomum inclinatum (Sw. ex Brid.) J.R. Spence,Ptychostomum inclinatum,Ptychostomum,Ptychostomum
1018604,Bryum edwardsianum Müll. Hal. & Kindb.,Ptychostomum archangelicum (Bruch & Schimp.) J.R. Spence,Ptychostomum archangelicum (Bruch & Schimp.) J.R. Spence,Ptychostomum archangelicum (Bruch & Schimp.) J.R. Spence,Ptychostomum archangelicum,Ptychostomum inclinatum (Sw. ex Brid.) J.R. Spence,Ptychostomum inclinatum,Ptychostomum,Ptychostomum
1018606,Bryum ehrenbergianum Müll. Hal.,Rosulabryum billarderi (Schwägr.) J.R. Spence,Rosulabryum billarderi (Schwägr.) J.R. Spence,Rosulabryum billarderi (Schwägr.) J.R. Spence,Rosulabryum billarderi,Rosulabryum andicola (Hook.) Ochyra,Rosulabryum andicola,Rosulabryum,Rosulabryum
1018627,Bryum epipterygioides Ochi,Rosulabryum capillare (Hedw.) J.R. Spence,Rosulabryum capillare (Hedw.) J.R. Spence,Rosulabryum capillare (Hedw.) J.R. Spence,Rosulabryum capillare,Plagiobryoides cellularis (Hook.) J.R. Spence,Plagiobryoides cellularis,Rosulabryum,Plagiobryoides
1018642,Bryum erythrophylloides Kindb.,Ptychostomum turbinatum (Hedw.) J.R. Spence,Ptychostomum turbinatum (Hedw.) J.R. Spence,Ptychostomum turbinatum (Hedw.) J.R. Spence,Ptychostomum turbinatum,Ptychostomum cryophilum (Mårtensson) J.R. Spence,Ptychostomum cryophilum,Ptychostomum,Ptychostomum
1018645,Bryum erythropus (M. Fleisch.) Broth.,Imbribryum clavatum (Schimp.) J.R. Spence & H.P. Ramsay,Imbribryum clavatum (Schimp.) J.R. Spence & H.P. Ramsay,Imbribryum clavatum (Schimp.) J.R. Spence & H.P. Ramsay,Imbribryum clavatum,Anomobryum apiculatum (Schwägr.) D. Bell & Holyoak,Anomobryum apiculatum,Imbribryum,Anomobryum
1018685,Bryum finmarkicum Kaurin,Ptychostomum rutilans (Brid.) J.R. Spence,Ptychostomum rutilans (Brid.) J.R. Spence,Ptychostomum rutilans (Brid.) J.R. Spence,Ptychostomum rutilans,Ptychostomum pallens (Sw.) J.R. Spence,Ptychostomum pallens,Ptychostomum,Ptychostomum
1018686,Bryum fissum R. Ruthe,Ptychostomum archangelicum (Bruch & Schimp.) J.R. Spence,Ptychostomum archangelicum (Bruch & Schimp.) J.R. Spence,Ptychostomum archangelicum (Bruch & Schimp.) J.R. Spence,Ptychostomum archangelicum,Ptychostomum salinum (I. Hagen ex Limpr.) J.R. Spence,Ptychostomum salinum,Ptychostomum,Ptychostomum
1018698,Bryum flavidum Bom.,Ptychostomum archangelicum (Bruch & Schimp.) J.R. Spence,Ptychostomum archangelicum (Bruch & Schimp.) J.R. Spence,Ptychostomum archangelicum (Bruch & Schimp.) J.R. Spence,Ptychostomum archangelicum,Ptychostomum inclinatum (Sw. ex Brid.) J.R. Spence,Ptychostomum inclinatum,Ptychostomum,Ptychostomum
1018702,Bryum fleischeri Warnst.,Imbribryum alpinum (Huds. ex With.) N. Pedersen,Imbribryum alpinum (Huds. ex With.) N. Pedersen,Imbribryum alpinum (Huds. ex With.) N. Pedersen,Imbribryum alpinum,Bryum gemmiparum De Not.,Bryum gemmiparum,Imbribryum,Bryum
1018718,Bryum foveolatum I. Hagen,Ptychostomum archangelicum (Bruch & Schimp.) J.R. Spence,Ptychostomum archangelicum (Bruch & Schimp.) J.R. Spence,Ptychostomum archangelicum (Bruch & Schimp.) J.R. Spence,Ptychostomum archangelicum,Ptychostomum salinum (I. Hagen ex Limpr.) J.R. Spence,Ptychostomum salinum,Ptychostomum,Ptychostomum
1018725,Bryum froudei Kindb.,Ptychostomum archangelicum (Bruch & Schimp.) J.R. Spence,Ptychostomum archangelicum (Bruch & Schimp.) J.R. Spence,Ptychostomum archangelicum (Bruch & Schimp.) J.R. Spence,Ptychostomum archangelicum,Ptychostomum inclinatum (Sw. ex Brid.) J.R. Spence,Ptychostomum inclinatum,Ptychostomum,Ptychostomum
1018733,Bryum furvum I. Hagen,Ptychostomum archangelicum (Bruch & Schimp.) J.R. Spence,Ptychostomum archangelicum (Bruch & Schimp.) J.R. Spence,Ptychostomum archangelicum (Bruch & Schimp.) J.R. Spence,Ptychostomum archangelicum,Ptychostomum salinum (I. Hagen ex Limpr.) J.R. Spence,Ptychostomum salinum,Ptychostomum,Ptychostomum
1018752,Bryum gemmaceum Bryhn & Ryan,Ptychostomum archangelicum (Bruch & Schimp.) J.R. Spence,Ptychostomum archangelicum (Bruch & Schimp.) J.R. Spence,Ptychostomum archangelicum (Bruch & Schimp.) J.R. Spence,Ptychostomum archangelicum,Ptychostomum inclinatum (Sw. ex Brid.) J.R. Spence,Ptychostomum inclinatum,Ptychostomum,Ptychostomum
1018756,Bryum gemmiparum var. fleischeri (Warnst.) Herzog,Imbribryum alpinum (Huds. ex With.) N. Pedersen,Imbribryum alpinum (Huds. ex With.) N. Pedersen,Imbribryum alpinum (Huds. ex With.) N. Pedersen,Imbribryum alpinum,Bryum gemmiparum De Not.,Bryum gemmiparum,Imbribryum,Bryum
1018766,Bryum gibsonii R. Br. bis,Ptychostomum creberrimum (Taylor) J.R. Spence & H.P. Ramsay,Ptychostomum creberrimum (Taylor) J.R. Spence & H.P. Ramsay,Ptychostomum creberrimum (Taylor) J.R. Spence & H.P. Ramsay,Ptychostomum creberrimum,Gemmabryum sauteri (Bruch & Schimp.) J.R. Spence & H.P. Ramsay,Gemmabryum sauteri,Ptychostomum,Gemmabryum
1018772,Bryum glareosum Bom.,Ptychostomum archangelicum (Bruch & Schimp.) J.R. Spence,Ptychostomum archangelicum (Bruch & Schimp.) J.R. Spence,Ptychostomum archangelicum (Bruch & Schimp.) J.R. Spence,Ptychostomum archangelicum,Ptychostomum inclinatum (Sw. ex Brid.) J.R. Spence,Ptychostomum inclinatum,Ptychostomum,Ptychostomum
1018777,Bryum globicoma Müll. Hal.,Rosulabryum billarderi (Schwägr.) J.R. Spence,Rosulabryum billarderi (Schwägr.) J.R. Spence,Rosulabryum billarderi (Schwägr.) J.R. Spence,Rosulabryum billarderi,Rhodobryum ontariense (Kindb.) Paris,Rhodobryum ontariense,Rosulabryum,Rhodobryum
1018788,Bryum gracilithecium R. Br. bis,Rosulabryum billarderi (Schwägr.) J.R. Spence,Rosulabryum billarderi (Schwägr.) J.R. Spence,Rosulabryum billarderi (Schwägr.) J.R. Spence,Rosulabryum billarderi,Imbribryum clavatum (Schimp.) J.R. Spence & H.P. Ramsay,Imbribryum clavatum,Rosulabryum,Imbribryum
1018792,Bryum graefianum subsp. haematostomum (Jørg.) J.J. Amann,Ptychostomum archangelicum (Bruch & Schimp.) J.R. Spence,Ptychostomum archangelicum (Bruch & Schimp.) J.R. Spence,Ptychostomum archangelicum (Bruch & Schimp.) J.R. Spence,Ptychostomum archangelicum,Ptychostomum salinum (I. Hagen ex Limpr.) J.R. Spence,Ptychostomum salinum,Ptychostomum,Ptychostomum
1018796,Bryum grandiflorum Arnell,Ptychostomum archangelicum (Bruch & Schimp.) J.R. Spence,Ptychostomum archangelicum (Bruch & Schimp.) J.R. Spence,Ptychostomum archangelicum (Bruch & Schimp.) J.R. Spence,Ptychostomum archangelicum,Ptychostomum inclinatum (Sw. ex Brid.) J.R. Spence,Ptychostomum inclinatum,Ptychostomum,Ptychostomum
1018804,Bryum groenlandicum Arnell,Ptychostomum archangelicum (Bruch & Schimp.) J.R. Spence,Ptychostomum archangelicum (Bruch & Schimp.) J.R. Spence,Ptychostomum archangelicum (Bruch & Schimp.) J.R. Spence,Ptychostomum archangelicum,Ptychostomum inclinatum (Sw. ex Brid.) J.R. Spence,Ptychostomum inclinatum,Ptychostomum,Ptychostomum
1018805,Bryum groenlundii Hesselbo,Ptychostomum archangelicum (Bruch & Schimp.) J.R. Spence,Ptychostomum archangelicum (Bruch & Schimp.) J.R. Spence,Ptychostomum archangelicum (Bruch & Schimp.) J.R. Spence,Ptychostomum archangelicum,Ptychostomum inclinatum (Sw. ex Brid.) J.R. Spence,Ptychostomum inclinatum,Ptychostomum,Ptychostomum
1018814,Bryum haematostomum Jørg.,Ptychostomum archangelicum (Bruch & Schimp.) J.R. Spence,Ptychostomum archangelicum (Bruch & Schimp.) J.R. Spence,Ptychostomum archangelicum (Bruch & Schimp.) J.R. Spence,Ptychostomum archangelicum,Ptychostomum salinum (I. Hagen ex Limpr.) J.R. Spence,Ptychostomum salinum,Ptychostomum,Ptychostomum
1018817,Bryum haistii Schimp.,Rosulabryum capillare (Hedw.) J.R. Spence,Rosulabryum capillare (Hedw.) J.R. Spence,Rosulabryum capillare (Hedw.) J.R. Spence,Rosulabryum capillare,Rosulabryum elegans (Nees ex Brid.) Ochyra,Rosulabryum elegans,Rosulabryum,Rosulabryum
1018819,Bryum hamicuspis Kindb.,Ptychostomum pallescens (Schleich. ex Schwägr.) J.R. Spence,Ptychostomum pallescens (Schleich. ex Schwägr.) J.R. Spence,Ptychostomum pallescens (Schleich. ex Schwägr.) J.R. Spence,Ptychostomum pallescens,Ptychostomum creberrimum (Taylor) J.R. Spence & H.P. Ramsay,Ptychostomum creberrimum,Ptychostomum,Ptychostomum
1018853,Bryum homalobolax Müll. Hal. ex Renauld,Rosulabryum erythrocaulon (Schwägr.) J.R. Spence,Rosulabryum erythrocaulon (Schwägr.) J.R. Spence,Rosulabryum erythrocaulon (Schwägr.) J.R. Spence,Rosulabryum erythrocaulon,Rosulabryum huillense (Welw. & Duby) Ochyra,Rosulabryum huillense,Rosulabryum,Rosulabryum
1018879,Bryum imbricatum (Schwägr.) Bruch & Schimp.,Ptychostomum inclinatum (Sw. ex Brid.) J.R. Spence,Ptychostomum inclinatum (Sw. ex Brid.) J.R. Spence,Ptychostomum inclinatum (Sw. ex Brid.) J.R. Spence,Ptychostomum inclinatum,Bryum imbricatum (Schwägr.) Bruch & Schimp.,Bryum imbricatum,Ptychostomum,Bryum
1018882,Bryum imperfectum Cardot,Ptychostomum archangelicum (Bruch & Schimp.) J.R. Spence,Ptychostomum archangelicum (Bruch & Schimp.) J.R. Spence,Ptychostomum archangelicum (Bruch & Schimp.) J.R. Spence,Ptychostomum archangelicum,Ptychostomum inclinatum (Sw. ex Brid.) J.R. Spence,Ptychostomum inclinatum,Ptychostomum,Ptychostomum
1018889,Bryum inclinatum var. islandicum (I. Hagen) Podp.,Pohlia elongata Hedw.,Pohlia elongata Hedw.,Pohlia elongata Hedw.,Pohlia elongata,Ptychostomum inclinatum (Sw. ex Brid.) J.R. Spence,Ptychostomum inclinatum,Pohlia,Ptychostomum
1018892,Bryum inclinatum var. litorum (Bom.) Podp.,Ptychostomum archangelicum (Bruch & Schimp.) J.R. Spence,Ptychostomum archangelicum (Bruch & Schimp.) J.R. Spence,Ptychostomum archangelicum (Bruch & Schimp.) J.R. Spence,Ptychostomum archangelicum,Ptychostomum inclinatum (Sw. ex Brid.) J.R. Spence,Ptychostomum inclinatum,Ptychostomum,Ptychostomum
1018902,Bryum inflexum Müll. Hal.,Pohlia drummondii (Müll. Hal.) A.L. Andrews,Pohlia drummondii (Müll. Hal.) A.L. Andrews,Pohlia drummondii (Müll. Hal.) A.L. Andrews,Pohlia drummondii,Pohlia inflexa (Müll. Hal.) Wijk & Margad.,Pohlia inflexa,Pohlia,Pohlia
1018907,Bryum insularum Bom.,Pohlia elongata Hedw.,Pohlia elongata Hedw.,Pohlia elongata Hedw.,Pohlia elongata,Ptychostomum salinum (I. Hagen ex Limpr.) J.R. Spence,Ptychostomum salinum,Pohlia,Ptychostomum
1018926,Bryum islandicum I. Hagen,Pohlia elongata Hedw.,Pohlia elongata Hedw.,Pohlia elongata Hedw.,Pohlia elongata,Ptychostomum inclinatum (Sw. ex Brid.) J.R. Spence,Ptychostomum inclinatum,Pohlia,Ptychostomum
1018936,Bryum jan-mayense Arnell,Ptychostomum archangelicum (Bruch & Schimp.) J.R. Spence,Ptychostomum archangelicum (Bruch & Schimp.) J.R. Spence,Ptychostomum archangelicum (Bruch & Schimp.) J.R. Spence,Ptychostomum archangelicum,Ptychostomum inclinatum (Sw. ex Brid.) J.R. Spence,Ptychostomum inclinatum,Ptychostomum,Ptychostomum
1018939,Bryum jemtlandicum Perss.,Ptychostomum lonchocaulon (Müll. Hal.) J.R. Spence,Ptychostomum lonchocaulon (Müll. Hal.) J.R. Spence,Ptychostomum lonchocaulon (Müll. Hal.) J.R. Spence,Ptychostomum lonchocaulon,Ptychostomum pallescens (Schleich. ex Schwägr.) J.R. Spence,Ptychostomum pallescens,Ptychostomum,Ptychostomum
1018949,Bryum kaalaasii I. Hagen,Ptychostomum archangelicum (Bruch & Schimp.) J.R. Spence,Ptychostomum archangelicum (Bruch & Schimp.) J.R. Spence,Ptychostomum archangelicum (Bruch & Schimp.) J.R. Spence,Ptychostomum archangelicum,Ptychostomum inclinatum (Sw. ex Brid.) J.R. Spence,Ptychostomum inclinatum,Ptychostomum,Ptychostomum
1018986,Bryum lagerheimii Jørg.,Ptychostomum archangelicum (Bruch & Schimp.) J.R. Spence,Ptychostomum archangelicum (Bruch & Schimp.) J.R. Spence,Ptychostomum archangelicum (Bruch & Schimp.) J.R. Spence,Ptychostomum archangelicum,Ptychostomum inclinatum (Sw. ex Brid.) J.R. Spence,Ptychostomum inclinatum,Ptychostomum,Ptychostomum
1019023,Bryum leonis J.J. Amann,Ptychostomum archangelicum (Bruch & Schimp.) J.R. Spence,Ptychostomum archangelicum (Bruch & Schimp.) J.R. Spence,Ptychostomum archangelicum (Bruch & Schimp.) J.R. Spence,Ptychostomum archangelicum,Ptychostomum inclinatum (Sw. ex Brid.) J.R. Spence,Ptychostomum inclinatum,Ptychostomum,Ptychostomum
1019029,Bryum leptocercis H. Philib.,Ptychostomum archangelicum (Bruch & Schimp.) J.R. Spence,Ptychostomum archangelicum (Bruch & Schimp.) J.R. Spence,Ptychostomum archangelicum (Bruch & Schimp.) J.R. Spence,Ptychostomum archangelicum,Ptychostomum inclinatum (Sw. ex Brid.) J.R. Spence,Ptychostomum inclinatum,Ptychostomum,Ptychostomum
1019058,Bryum leucothrix Müll. Hal.,Rhodobryum roseum (Hedw.) Limpr.,Rhodobryum roseum (Hedw.) Limpr.,Rhodobryum roseum (Hedw.) Limpr.,Rhodobryum roseum,Rhodobryum ontariense (Kindb.) Paris,Rhodobryum ontariense,Rhodobryum,Rhodobryum
1019064,Bryum liebmannii Schimp.,Rosulabryum billarderi (Schwägr.) J.R. Spence,Rosulabryum billarderi (Schwägr.) J.R. Spence,Rosulabryum billarderi (Schwägr.) J.R. Spence,Rosulabryum billarderi,Rosulabryum andicola (Hook.) Ochyra,Rosulabryum andicola,Rosulabryum,Rosulabryum
1019070,Bryum limprichtii Kaurin,Ptychostomum archangelicum (Bruch & Schimp.) J.R. Spence,Ptychostomum archangelicum (Bruch & Schimp.) J.R. Spence,Ptychostomum archangelicum (Bruch & Schimp.) J.R. Spence,Ptychostomum archangelicum,Ptychostomum inclinatum (Sw. ex Brid.) J.R. Spence,Ptychostomum inclinatum,Ptychostomum,Ptychostomum
1019072,Bryum lindgrenii Schimp.,Ptychostomum arcticum (R. Br.) J.R. Spence,Ptychostomum arcticum (R. Br.) J.R. Spence,Ptychostomum arcticum (R. Br.) J.R. Spence,Ptychostomum arcticum,Ptychostomum purpurascens (R. Br.) J.R. Spence,Ptychostomum purpurascens,Ptychostomum,Ptychostomum
1019077,Bryum lingulanum Bom.,Ptychostomum archangelicum (Bruch & Schimp.) J.R. Spence,Ptychostomum archangelicum (Bruch & Schimp.) J.R. Spence,Ptychostomum archangelicum (Bruch & Schimp.) J.R. Spence,Ptychostomum archangelicum,Bryum lingulanum Bom.,Bryum lingulanum,Ptychostomum,Bryum
1019079,Bryum lipsiense I. Hagen,Ptychostomum lonchocaulon (Müll. Hal.) J.R. Spence,Ptychostomum lonchocaulon (Müll. Hal.) J.R. Spence,Ptychostomum lonchocaulon (Müll. Hal.) J.R. Spence,Ptychostomum lonchocaulon,Ptychostomum creberrimum (Taylor) J.R. Spence & H.P. Ramsay,Ptychostomum creberrimum,Ptychostomum,Ptychostomum
1019082,Bryum litorale Ryan & I. Hagen,Pohlia elongata Hedw.,Pohlia elongata Hedw.,Pohlia elongata Hedw.,Pohlia elongata,Ptychostomum inclinatum (Sw. ex Brid.) J.R. Spence,Ptychostomum inclinatum,Pohlia,Ptychostomum
1019084,Bryum litorum Bom.,Ptychostomum archangelicum (Bruch & Schimp.) J.R. Spence,Ptychostomum archangelicum (Bruch & Schimp.) J.R. Spence,Ptychostomum archangelicum (Bruch & Schimp.) J.R. Spence,Ptychostomum archangelicum,Ptychostomum inclinatum (Sw. ex Brid.) J.R. Spence,Ptychostomum inclinatum,Ptychostomum,Ptychostomum
1019107,Bryum lowii Kindb.,Ptychostomum calophyllum (R. Br.) J.R. Spence,Ptychostomum calophyllum (R. Br.) J.R. Spence,Ptychostomum calophyllum (R. Br.) J.R. Spence,Ptychostomum calophyllum,Ptychostomum cryophilum (Mårtensson) J.R. Spence,Ptychostomum cryophilum,Ptychostomum,Ptychostomum
1019146,Bryum malangense Kaurin & Arnell,Ptychostomum archangelicum (Bruch & Schimp.) J.R. Spence,Ptychostomum archangelicum (Bruch & Schimp.) J.R. Spence,Ptychostomum archangelicum (Bruch & Schimp.) J.R. Spence,Ptychostomum archangelicum,Ptychostomum salinum (I. Hagen ex Limpr.) J.R. Spence,Ptychostomum salinum,Ptychostomum,Ptychostomum
1019166,Bryum mayebarae Nog.,Ptychostomum compactum Hornsch.,Ptychostomum compactum Hornsch.,Ptychostomum compactum Hornsch.,Ptychostomum compactum,Gemmabryum radiculosum (Brid.) J.R. Spence & H.P. Ramsay,Gemmabryum radiculosum,Ptychostomum,Gemmabryum
1020672,Leskea delicatula (Hedw.) Sw.,Thuidium delicatulum (Hedw.) Schimp.,Thuidium delicatulum (Hedw.) Schimp.,Thuidium delicatulum (Hedw.) Schimp.,Thuidium delicatulum,Leskea delicatula (Hedw.) Sw.,Leskea delicatula,Thuidium,Leskea
1020808,Bryum stenotrichum var. anomalum (R. Ruthe ex Warnst.) Ochyra & Szmajda,Ptychostomum archangelicum (Bruch & Schimp.) J.R. Spence,Ptychostomum archangelicum (Bruch & Schimp.) J.R. Spence,Ptychostomum archangelicum (Bruch & Schimp.) J.R. Spence,Ptychostomum archangelicum,Ptychostomum inclinatum (Sw. ex Brid.) J.R. Spence,Ptychostomum inclinatum,Ptychostomum,Ptychostomum
1020809,Bryum stenotrichum var. fissum (R. Ruthe) Ochyra & Szmajda,Ptychostomum archangelicum (Bruch & Schimp.) J.R. Spence,Ptychostomum archangelicum (Bruch & Schimp.) J.R. Spence,Ptychostomum archangelicum (Bruch & Schimp.) J.R. Spence,Ptychostomum archangelicum,Ptychostomum salinum (I. Hagen ex Limpr.) J.R. Spence,Ptychostomum salinum,Ptychostomum,Ptychostomum
1022910,Pterobryon humile Mitt.,Pinnatidendron piniforme (Brid.) Enroth,Pinnatidendron piniforme (Brid.) Enroth,Pinnatidendron piniforme (Brid.) Enroth,Pinnatidendron piniforme,Calyptothecium humile (Mitt.) Broth.,Calyptothecium humile,Pinnatidendron,Calyptothecium
1023195,Pterygophyllum montagnei Bél.,Vesicularia vesicularis (Schwägr.) Broth.,Vesicularia vesicularis (Schwägr.) Broth.,Vesicularia vesicularis (Schwägr.) Broth.,Vesicularia vesicularis,Vesicularia montagnei (Bél.) Broth.,Vesicularia montagnei,Vesicularia,Vesicularia
1023641,Racomitrium looseri Thér.,Bucklandiella lamprocarpa (Müll. Hal.) Bedn.-Ochyra & Ochyra,Bucklandiella lamprocarpa (Müll. Hal.) Bedn.-Ochyra & Ochyra,Bucklandiella lamprocarpa (Müll. Hal.) Bedn.-Ochyra & Ochyra,Bucklandiella lamprocarpa,Bucklandiella orthotrichacea (Müll. Hal.) Bedn.-Ochyra & Ochyra,Bucklandiella orthotrichacea,Bucklandiella,Bucklandiella
1027300,Macromitrium podocarpi Müll. Hal.,Macromitrium pseudofimbriatum Hampe,Macromitrium pseudofimbriatum Hampe,Macromitrium pseudofimbriatum Hampe,Macromitrium pseudofimbriatum,"Pseudomacromitrium podocarpi (Müll. Hal.) D.V. Valente, P.E.A.S. Câmara & D.F. Peralta",Pseudomacromitrium podocarpi,Macromitrium,Pseudomacromitrium
1027992,Bryum minus Arnell,Ptychostomum archangelicum (Bruch & Schimp.) J.R. Spence,Ptychostomum archangelicum (Bruch & Schimp.) J.R. Spence,Ptychostomum archangelicum (Bruch & Schimp.) J.R. Spence,Ptychostomum archangelicum,Ptychostomum inclinatum (Sw. ex Brid.) J.R. Spence,Ptychostomum inclinatum,Ptychostomum,Ptychostomum
1028001,Bryum misandrum I. Hagen,Ptychostomum lonchocaulon (Müll. Hal.) J.R. Spence,Ptychostomum lonchocaulon (Müll. Hal.) J.R. Spence,Ptychostomum lonchocaulon (Müll. Hal.) J.R. Spence,Ptychostomum lonchocaulon,Ptychostomum pallescens (Schleich. ex Schwägr.) J.R. Spence,Ptychostomum pallescens,Ptychostomum,Ptychostomum
1028007,Bryum moenkemeyeri I. Hagen,Ptychostomum lonchocaulon (Müll. Hal.) J.R. Spence,Ptychostomum lonchocaulon (Müll. Hal.) J.R. Spence,Ptychostomum lonchocaulon (Müll. Hal.) J.R. Spence,Ptychostomum lonchocaulon,Ptychostomum creberrimum (Taylor) J.R. Spence & H.P. Ramsay,Ptychostomum creberrimum,Ptychostomum,Ptychostomum
1028041,Bryum myliusii Hesselbo,Ptychostomum calophyllum (R. Br.) J.R. Spence,Ptychostomum calophyllum (R. Br.) J.R. Spence,Ptychostomum calophyllum (R. Br.) J.R. Spence,Ptychostomum calophyllum,Ptychostomum axel-blyttii (H. Philib.) J.R. Spence,Ptychostomum axel-blyttii,Ptychostomum,Ptychostomum
1028062,Bryum neodamense var. cyclophylloides Mikut.,Ptychostomum pseudotriquetrum (Hedw.) J.R. Spence & H.P. Ramsay ex Holyoak & N. Pedersen,Ptychostomum pseudotriquetrum (Hedw.) J.R. Spence & H.P. Ramsay ex Holyoak & N. Pedersen,Ptychostomum pseudotriquetrum (Hedw.) J.R. Spence & H.P. Ramsay ex Holyoak & N. Pedersen,Ptychostomum pseudotriquetrum,Ptychostomum neodamense (Itzigs.) J.R. Spence,Ptychostomum neodamense,Ptychostomum,Ptychostomum
1028063,Bryum neodamense var. elongatum Mikut.,Ptychostomum pseudotriquetrum (Hedw.) J.R. Spence & H.P. Ramsay ex Holyoak & N. Pedersen,Ptychostomum pseudotriquetrum (Hedw.) J.R. Spence & H.P. Ramsay ex Holyoak & N. Pedersen,Ptychostomum pseudotriquetrum (Hedw.) J.R. Spence & H.P. Ramsay ex Holyoak & N. Pedersen,Ptychostomum pseudotriquetrum,Ptychostomum neodamense (Itzigs.) J.R. Spence,Ptychostomum neodamense,Ptychostomum,Ptychostomum
1028064,Bryum neodamense var. immarginatum J.J. Amann,Ptychostomum pseudotriquetrum (Hedw.) J.R. Spence & H.P. Ramsay ex Holyoak & N. Pedersen,Ptychostomum pseudotriquetrum (Hedw.) J.R. Spence & H.P. Ramsay ex Holyoak & N. Pedersen,Ptychostomum pseudotriquetrum (Hedw.) J.R. Spence & H.P. Ramsay ex Holyoak & N. Pedersen,Ptychostomum pseudotriquetrum,Ptychostomum neodamense (Itzigs.) J.R. Spence,Ptychostomum neodamense,Ptychostomum,Ptychostomum
1028065,Bryum neodamense var. nervicaudatum J.J. Amann,Ptychostomum pseudotriquetrum (Hedw.) J.R. Spence & H.P. Ramsay ex Holyoak & N. Pedersen,Ptychostomum pseudotriquetrum (Hedw.) J.R. Spence & H.P. Ramsay ex Holyoak & N. Pedersen,Ptychostomum pseudotriquetrum (Hedw.) J.R. Spence & H.P. Ramsay ex Holyoak & N. Pedersen,Ptychostomum pseudotriquetrum,Ptychostomum neodamense (Itzigs.) J.R. Spence,Ptychostomum neodamense,Ptychostomum,Ptychostomum
1028067,Bryum neomexicanum Cardot,Ptychostomum intermedium (Brid.) J.R. Spence,Ptychostomum intermedium (Brid.) J.R. Spence,Ptychostomum intermedium (Brid.) J.R. Spence,Ptychostomum intermedium,Ptychostomum creberrimum (Taylor) J.R. Spence & H.P. Ramsay,Ptychostomum creberrimum,Ptychostomum,Ptychostomum
1028079,Bryum nitidonigrum Müll. Hal. ex Renauld,Rosulabryum andicola (Hook.) Ochyra,Rosulabryum andicola (Hook.) Ochyra,Rosulabryum andicola (Hook.) Ochyra,Rosulabryum andicola,Rosulabryum erythrocaulon (Schwägr.) J.R. Spence,Rosulabryum erythrocaulon,Rosulabryum,Rosulabryum
1028099,Bryum obesothecium R. Br. bis,Ptychostomum mucronatum (Mitt.) Ochyra & Bedn.-Ochyra,Ptychostomum mucronatum (Mitt.) Ochyra & Bedn.-Ochyra,Ptychostomum mucronatum (Mitt.) Ochyra & Bedn.-Ochyra,Ptychostomum mucronatum,Ptychostomum pseudotriquetrum (Hedw.) J.R. Spence & H.P. Ramsay ex Holyoak & N. Pedersen,Ptychostomum pseudotriquetrum,Ptychostomum,Ptychostomum
1028107,Bryum obtusatum (Wahlenb.) Lindb.,Ptychostomum pseudotriquetrum (Hedw.) J.R. Spence & H.P. Ramsay ex Holyoak & N. Pedersen,Ptychostomum pseudotriquetrum (Hedw.) J.R. Spence & H.P. Ramsay ex Holyoak & N. Pedersen,Ptychostomum pseudotriquetrum (Hedw.) J.R. Spence & H.P. Ramsay ex Holyoak & N. Pedersen,Ptychostomum pseudotriquetrum,Ptychostomum neodamense (Itzigs.) J.R. Spence,Ptychostomum neodamense,Ptychostomum,Ptychostomum
1028118,Bryum aeneum var. subelimabatum Bryhn & Ryan,Ptychostomum rutilans (Brid.) J.R. Spence,Ptychostomum rutilans (Brid.) J.R. Spence,Ptychostomum rutilans (Brid.) J.R. Spence,Ptychostomum rutilans,Ptychostomum pallens (Sw.) J.R. Spence,Ptychostomum pallens,Ptychostomum,Ptychostomum
