719179,Pterocarpus cultratus Vell.,Pterocarpus rohrii Vahl,Pterocarpus rohrii Vahl,Pterocarpus rohrii Vahl,Pterocarpus rohrii,Lonchocarpus cultratus (Vell.) A.M.G.Azevedo & H.C.Lima,Lonchocarpus cultratus,Pterocarpus,Lonchocarpus
719402,Strombocarpa odorata (Torr. & Frém.) A.Gray,Prosopis pubescens Benth.,Prosopis pubescens Benth.,Strombocarpa pubescens (Benth.) A.Gray,Strombocarpa pubescens,Neltuma odorata (Torr. & Frém.) C.E.Hughes & G.P.Lewis,Neltuma odorata,Strombocarpa,Neltuma
719405,Prosopis odorata Torr. & Frém.,Prosopis pubescens Benth.,Prosopis pubescens Benth.,Strombocarpa pubescens (Benth.) A.Gray,Strombocarpa pubescens,Neltuma odorata (Torr. & Frém.) C.E.Hughes & G.P.Lewis,Neltuma odorata,Strombocarpa,Neltuma
721402,Paullinia mexiae Steyerm.,Paullinia pterocarpa Triana & Planch.,Paullinia pterocarpa Triana & Planch.,Paullinia pterocarpa Triana & Planch.,Paullinia pterocarpa,Serjania caracasana (Jacq.) Willd.,Serjania caracasana,Paullinia,Serjania
732618,Quassia officinalis Rich.,Simarouba amara Aubl.,Simarouba amara Aubl.,Simarouba amara Aubl.,Simarouba amara,Quassia amara L.,Quassia amara,Simarouba,Quassia
735289,Dircaea picta (Hook.) Lem.,Sinningia douglasii (Lindl.) Chautems,Sinningia douglasii (Lindl.) Chautems,Sinningia douglasii (Lindl.) Chautems,Sinningia douglasii,Kohleria tubiflora (Cav.) Hanst.,Kohleria tubiflora,Sinningia,Kohleria
736007,Acacia virchowiana Vatke & Hildebrandt,Senegalia senegal (L.) Britton,Senegalia senegal (L.) Britton,Senegalia senegal (L.) Britton,Senegalia senegal,Vachellia oerfota var. oerfota,Vachellia oerfota,Senegalia,Vachellia
736820,Trochocephalus superbus (Grüning) Á.Löve & D.Löve,Scabiosa comosa Fisch. ex Roem. & Schult.,Scabiosa comosa Fisch. ex Roem. & Schult.,"Lomelosia comosa (Fisch. ex Roem. & Schult.) J.H.Xue, Chepinoga & K.P.Ma",Lomelosia comosa,Scabiosa tschiliensis Grüning,Scabiosa tschiliensis,Lomelosia,Scabiosa
736822,Scabiosa superba Grüning,Scabiosa comosa Fisch. ex Roem. & Schult.,Scabiosa comosa Fisch. ex Roem. & Schult.,"Lomelosia comosa (Fisch. ex Roem. & Schult.) J.H.Xue, Chepinoga & K.P.Ma",Lomelosia comosa,Scabiosa tschiliensis Grüning,Scabiosa tschiliensis,Lomelosia,Scabiosa
736824,Scabiosa tschiliensis f. albiflora S.H.Li & S.Z.Liu,Scabiosa comosa Fisch. ex Roem. & Schult.,Scabiosa comosa Fisch. ex Roem. & Schult.,"Lomelosia comosa (Fisch. ex Roem. & Schult.) J.H.Xue, Chepinoga & K.P.Ma",Lomelosia comosa,Scabiosa tschiliensis Grüning,Scabiosa tschiliensis,Lomelosia,Scabiosa
736825,Scabiosa tschiliensis Grüning,Scabiosa comosa Fisch. ex Roem. & Schult.,Scabiosa comosa Fisch. ex Roem. & Schult.,"Lomelosia comosa (Fisch. ex Roem. & Schult.) J.H.Xue, Chepinoga & K.P.Ma",Lomelosia comosa,Scabiosa tschiliensis Grüning,Scabiosa tschiliensis,Lomelosia,Scabiosa
736826,Scabiosa tschiliensis var. superba (Grüning) S.Y.He,Scabiosa comosa Fisch. ex Roem. & Schult.,Scabiosa comosa Fisch. ex Roem. & Schult.,"Lomelosia comosa (Fisch. ex Roem. & Schult.) J.H.Xue, Chepinoga & K.P.Ma",Lomelosia comosa,Scabiosa tschiliensis Grüning,Scabiosa tschiliensis,Lomelosia,Scabiosa
736925,Asterocephalus tomentosus Spreng.,Succisa pratensis Moench,Succisa pratensis Moench,Succisa pratensis Moench,Succisa pratensis,Scabiosa turolensis subsp. turolensis,Scabiosa turolensis,Succisa,Scabiosa
744805,Adenandra ovata (Thunb.) Link,Adenandra villosa subsp. sonderi (Dümmer) Strid,Adenandra villosa subsp. sonderi (Dümmer) Strid,Adenandra villosa subsp. sonderi (Dümmer) Strid,Adenandra villosa,Agathosma ovata (Thunb.) F.Dietr.,Agathosma ovata,Adenandra,Agathosma
747089,Mimosa terminalis Vell.,Albizia polycephala (Benth.) Killip,Albizia polycephala (Benth.) Killip,Pseudalbizzia polycephala (Benth.) E.J.M.Koenen & Duno,Pseudalbizzia polycephala,"Hydrochorea pedicellaris (DC.) M.V.B.Soares, Iganci & M.P.Morim",Hydrochorea pedicellaris,Pseudalbizzia,Hydrochorea
748219,Alyssum arenarium C.Presl,Alyssum montanum subsp. gmelinii (Jord.) Em.Schmid,Alyssum montanum subsp. gmelinii (Jord.) Em.Schmid,Alyssum gmelinii Jord.,Alyssum gmelinii,Lobularia maritima subsp. maritima,Lobularia maritima,Alyssum,Lobularia
748221,Alyssum alpinum Scop.,Alyssum montanum subsp. gmelinii (Jord.) Em.Schmid,Alyssum montanum subsp. gmelinii (Jord.) Em.Schmid,Alyssum gmelinii Jord.,Alyssum gmelinii,Kernera saxatilis (L.) Sweet,Kernera saxatilis,Alyssum,Kernera
748725,Ruschia promontorii L.Bolus,Amphibolia laevis (Aiton) H.E.K.Hartmann,Amphibolia laevis (Aiton) H.E.K.Hartmann,Amphibolia laevis (Aiton) H.E.K.Hartmann,Amphibolia laevis,Ruschia promontorii L.Bolus,Ruschia promontorii,Amphibolia,Ruschia
748729,Mesembryanthemum pansifolium N.E.Br.,Amphibolia laevis (Aiton) H.E.K.Hartmann,Amphibolia laevis (Aiton) H.E.K.Hartmann,Amphibolia laevis (Aiton) H.E.K.Hartmann,Amphibolia laevis,Ruschia promontorii L.Bolus,Ruschia promontorii,Amphibolia,Ruschia
750215,Aniba ovalifolia Mez,Aniba hypoglauca Sandwith,Aniba hypoglauca Sandwith,Aniba hypoglauca Sandwith,Aniba hypoglauca,Ocotea cujumary Mart.,Ocotea cujumary,Aniba,Ocotea
759945,Columnea divaricata (Poepp.) Walp.,Bellonia aspera L.,Bellonia aspera L.,Bellonia aspera L.,Bellonia aspera,Besleria divaricata Poepp.,Besleria divaricata,Bellonia,Besleria
762380,Derris robusta var. assamica Thoth.,Brachypterum robustum (Roxb. ex DC.) Dalzell & A.Gibson,Brachypterum robustum (Roxb. ex DC.) Dalzell & A.Gibson,Brachypterum robustum (Roxb. ex DC.) Dalzell & A.Gibson,Brachypterum robustum,Robinia pseudoacacia L.,Robinia pseudoacacia,Brachypterum,Robinia
763511,Mangifera silvestris Roxb.,Buchanania cochinchinensis (Lour.) M.R.Almeida,Buchanania cochinchinensis (Lour.) M.R.Almeida,Glycosmis cochinchinensis (Lour.) Pierre ex Engl.,Glycosmis cochinchinensis,Buchanania lanzan Spreng.,Buchanania lanzan,Glycosmis,Buchanania
763512,Buchanania lanzan Spreng.,Buchanania cochinchinensis (Lour.) M.R.Almeida,Buchanania cochinchinensis (Lour.) M.R.Almeida,Glycosmis cochinchinensis (Lour.) Pierre ex Engl.,Glycosmis cochinchinensis,Buchanania lanzan Spreng.,Buchanania lanzan,Glycosmis,Buchanania
763513,Spondias elliptica Rottb. ex Hook.f.,Buchanania cochinchinensis (Lour.) M.R.Almeida,Buchanania cochinchinensis (Lour.) M.R.Almeida,Glycosmis cochinchinensis (Lour.) Pierre ex Engl.,Glycosmis cochinchinensis,Buchanania lanzan Spreng.,Buchanania lanzan,Glycosmis,Buchanania
763514,Buchanania latifolia Roxb.,Buchanania cochinchinensis (Lour.) M.R.Almeida,Buchanania cochinchinensis (Lour.) M.R.Almeida,Glycosmis cochinchinensis (Lour.) Pierre ex Engl.,Glycosmis cochinchinensis,Buchanania lanzan Spreng.,Buchanania lanzan,Glycosmis,Buchanania
763515,Lanzana solitaria Stokes,Buchanania cochinchinensis (Lour.) M.R.Almeida,Buchanania cochinchinensis (Lour.) M.R.Almeida,Glycosmis cochinchinensis (Lour.) Pierre ex Engl.,Glycosmis cochinchinensis,Buchanania lanzan Spreng.,Buchanania lanzan,Glycosmis,Buchanania
763516,Lundia mangiferoides Puerari ex DC.,Buchanania cochinchinensis (Lour.) M.R.Almeida,Buchanania cochinchinensis (Lour.) M.R.Almeida,Glycosmis cochinchinensis (Lour.) Pierre ex Engl.,Glycosmis cochinchinensis,Buchanania lanzan Spreng.,Buchanania lanzan,Glycosmis,Buchanania
768736,Celtis ituriensis De Wild.,Celtis adolfi-friderici Engl.,Celtis adolfi-friderici Engl.,Celtis adolfi-friderici Engl.,Celtis adolfi-friderici,Trema orientale (L.) Blume,Trema orientale,Celtis,Trema
768737,Celtis fragifera A.Chev.,Celtis adolfi-friderici Engl.,Celtis adolfi-friderici Engl.,Celtis adolfi-friderici Engl.,Celtis adolfi-friderici,Sparrea gomphophylla (Baker) X.G.Fu & T.S.Yi,Sparrea gomphophylla,Celtis,Sparrea
771956,Cicendia quitensis (Kunth) Griseb.,Cicendia quadrangularis (Lam.) Griseb.,Cicendia quadrangularis (Lam.) Griseb.,Cicendia quadrangularis (Lam.) Griseb.,Cicendia quadrangularis,Zeltnera quitensis (Kunth) G.Mans.,Zeltnera quitensis,Cicendia,Zeltnera
775510,Ceanothus leschenaultii DC.,Colubrina asiatica (L.) Brongn.,Colubrina asiatica (L.) Brongn.,Colubrina asiatica (L.) Brongn.,Colubrina asiatica,Trema orientale (L.) Blume,Trema orientale,Colubrina,Trema
779531,Oreocarya affinis var. euaffinis Brand,Cryptantha affinis (A.Gray) Greene,Cryptantha affinis (A.Gray) Greene,Cryptantha affinis (A.Gray) Greene,Cryptantha affinis,Oreocarya glomerata (Fraser ex Pursh) Greene,Oreocarya glomerata,Cryptantha,Oreocarya
783971,Desmodium parviflorum f. yunnanense Pamp.,Desmodiastrum racemosum (Benth.) A.Pramanik & Thoth.,Desmodiastrum racemosum (Benth.) A.Pramanik & Thoth.,Desmodiastrum racemosum (Benth.) A.Pramanik & Thoth.,Desmodiastrum racemosum,Leptodesmia microphylla var. microphylla,Leptodesmia microphylla,Desmodiastrum,Leptodesmia
790243,Ocotea endlicheriopsis Mez,Endlicheria canescens Chanderbali,Endlicheria canescens Chanderbali,Endlicheria canescens Chanderbali,Endlicheria canescens,Ocotea endlicheriopsis Mez,Ocotea endlicheriopsis,Endlicheria,Ocotea
790245,Endlicheria endlicheriopsis (Mez) Kosterm.,Endlicheria canescens Chanderbali,Endlicheria canescens Chanderbali,Endlicheria canescens Chanderbali,Endlicheria canescens,Ocotea endlicheriopsis Mez,Ocotea endlicheriopsis,Endlicheria,Ocotea
793234,Eruca stenocarpa Boiss. & Reut.,Eruca vesicaria (L.) Cav.,Eruca vesicaria (L.) Cav.,Eruca vesicaria (L.) Cav.,Eruca vesicaria,Erucastrum nasturtiifolium subsp. nasturtiifolium,Erucastrum nasturtiifolium,Eruca,Erucastrum
795327,Sycopsis griffithiana Oliv.,Eustigma lenticellatum C.Y.Wu,Eustigma lenticellatum C.Y.Wu,Eustigma lenticellatum C.Y.Wu,Eustigma lenticellatum,Sycopsis griffithiana Oliv.,Sycopsis griffithiana,Eustigma,Sycopsis
795579,Polygonum tristachyum Baker,Fagopyrum cymosum (Trevir.) Meisn.,Fagopyrum cymosum (Trevir.) Meisn.,Fagopyrum cymosum (Trevir.) Meisn.,Fagopyrum cymosum,Oxygonum tristachyum (Baker) H.Perrier,Oxygonum tristachyum,Fagopyrum,Oxygonum
795580,Oxygonum tristachyum (Baker) H.Perrier,Fagopyrum cymosum (Trevir.) Meisn.,Fagopyrum cymosum (Trevir.) Meisn.,Fagopyrum cymosum (Trevir.) Meisn.,Fagopyrum cymosum,Oxygonum tristachyum (Baker) H.Perrier,Oxygonum tristachyum,Fagopyrum,Oxygonum
795663,Acacia aegyptiaca Baill.,Faidherbia albida (Delile) A.Chev.,Faidherbia albida (Delile) A.Chev.,Faidherbia albida (Delile) A.Chev.,Faidherbia albida,Vachellia nilotica subsp. nilotica,Vachellia nilotica,Faidherbia,Vachellia
800436,Gentiana amarella subsp. chlorifolia (Nees) Arcang.,Gentianella germanica (Willd.) Börner,Gentianella germanica (Willd.) Börner,Gentianella germanica (Willd.) Börner,Gentianella germanica,Gentiana × chlorifolia Nees,Gentiana × chlorifolia,Gentianella,Gentiana
802236,Aillya umbellata var. procumbens (de Vriese) de Vriese,Goodenia filiformis R.Br.,Goodenia filiformis R.Br.,Goodenia filiformis R.Br.,Goodenia filiformis,Scaevola pulchella Carolin,Scaevola pulchella,Goodenia,Scaevola
802237,Aillya umbellata var. spathulata (de Vriese) de Vriese,Goodenia filiformis R.Br.,Goodenia filiformis R.Br.,Goodenia filiformis R.Br.,Goodenia filiformis,Scaevola pulchella Carolin,Scaevola pulchella,Goodenia,Scaevola
803591,Quassia tricarpa Blanco,Guioa pleuropteris (Blume) Radlk.,Guioa pleuropteris (Blume) Radlk.,Guioa pleuropteris (Blume) Radlk.,Guioa pleuropteris,Sapindus tricarpus (Blanco) A.R.Franck,Sapindus tricarpus,Guioa,Sapindus
804872,Haplanthus neilgherryensis Wight,Haplanthodes Kuntze,Haplanthodes Kuntze,Haplanthodes Kuntze,,Haplanthodes neilgherryensis (Wight) R.B.Majumdar,Haplanthodes neilgherryensis,,Haplanthodes
805058,Cereus serruliflorus Haw.,Harrisia divaricata (Lam.) Backeb.,Harrisia divaricata (Lam.) Backeb.,Harrisia divaricata (Lam.) Backeb.,Harrisia divaricata,Serrulatocereus serruliflorus (Haw.) Guiggi,Serrulatocereus serruliflorus,Harrisia,Serrulatocereus
805136,Hariota clavata var. deliculata (Loefgr.) A.Cast.,Hatiora salicornoides (Haw.) Britton & Rose,Hatiora salicornoides (Haw.) Britton & Rose,Hatiora salicornoides (Haw.) Britton & Rose,Hatiora salicornoides,Rhipsalis clavata F.A.C.Weber,Rhipsalis clavata,Hatiora,Rhipsalis
805138,Hariota bambusoides var. delicatula (Loefgr.) A.Cast.,Hatiora salicornoides (Haw.) Britton & Rose,Hatiora salicornoides (Haw.) Britton & Rose,Hatiora salicornoides (Haw.) Britton & Rose,Hatiora salicornoides,Rhipsalis clavata F.A.C.Weber,Rhipsalis clavata,Hatiora,Rhipsalis
805755,Helianthemum alyssoides subsp. cheiranthoides (Lam.) Nyman,Helianthemum syriacum (Jacq.) Dum.Cours.,Helianthemum syriacum (Jacq.) Dum.Cours.,Helianthemum syriacum (Jacq.) Dum.Cours.,Helianthemum syriacum,Cistus × cheiranthoides Lam.,Cistus × cheiranthoides,Helianthemum,Cistus
807294,Heteropterys angustifolia f. lanceolata Nied.,Heteropterys glabra Hook. & Arn.,Heteropterys glabra Hook. & Arn.,Heteropterys glabra Hook. & Arn.,Heteropterys glabra,Banisteriopsis laevifolia (A.Juss.) B.Gates,Banisteriopsis laevifolia,Heteropterys,Banisteriopsis
809272,Pleurospermum lecomtianum H.Wolff,Hymenidium wilsonii (H.Boissieu) Pimenov & Kljuykov,Hymenidium wilsonii (H.Boissieu) Pimenov & Kljuykov,Hymenidium wilsonii (H.Boissieu) Pimenov & Kljuykov,Hymenidium wilsonii,Pleurospermum lecomtianum H.Wolff,Pleurospermum lecomtianum,Hymenidium,Pleurospermum
809597,Ilex heterophylla G.Don,Ilex aquifolium L.,Ilex aquifolium L.,Ilex aquifolium L.,Ilex aquifolium,Osmanthus heterophyllus (G.Don) P.S.Green,Osmanthus heterophyllus,Ilex,Osmanthus
811748,Robinsonia melianthifolia Willd.,Quiina guianensis Aubl.,Quiina guianensis Aubl.,Quiina guianensis Aubl.,Quiina guianensis,Touroulia guianensis Aubl.,Touroulia guianensis,Quiina,Touroulia
816710,Connarus decumbens Thunb.,Leobordea polycephala (E.Mey.) B.-E.van Wyk & Boatwr.,Leobordea polycephala (E.Mey.) B.-E.van Wyk & Boatwr.,Leobordea polycephala (E.Mey.) B.-E.van Wyk & Boatwr.,Leobordea polycephala,Lotononis triphylla (L.) Dorr,Lotononis triphylla,Leobordea,Lotononis
816732,Hermannia triphylla L.,Leobordea polycephala (E.Mey.) B.-E.van Wyk & Boatwr.,Leobordea polycephala (E.Mey.) B.-E.van Wyk & Boatwr.,Leobordea polycephala (E.Mey.) B.-E.van Wyk & Boatwr.,Leobordea polycephala,Lotononis triphylla (L.) Dorr,Lotononis triphylla,Leobordea,Lotononis
817688,Acrodiclidium guianense var. oppositifolium Meisn.,Dicypellium caryophyllaceum (Mart.) Nees & Mart.,Dicypellium caryophyllaceum (Mart.) Nees & Mart.,Dicypellium caryophyllaceum (Mart.) Nees & Mart.,Dicypellium caryophyllaceum,Licaria chrysophylla (Meisn.) Kosterm.,Licaria chrysophylla,Dicypellium,Licaria
817692,Acrodiclidium guianense var. reticulatum Meisn.,Dicypellium caryophyllaceum (Mart.) Nees & Mart.,Dicypellium caryophyllaceum (Mart.) Nees & Mart.,Dicypellium caryophyllaceum (Mart.) Nees & Mart.,Dicypellium caryophyllaceum,Licaria polyphylla (Nees) Kosterm.,Licaria polyphylla,Dicypellium,Licaria
817693,Acrodiclidium guianense Nees,Dicypellium caryophyllaceum (Mart.) Nees & Mart.,Dicypellium caryophyllaceum (Mart.) Nees & Mart.,Dicypellium caryophyllaceum (Mart.) Nees & Mart.,Dicypellium caryophyllaceum,Licaria polyphylla (Nees) Kosterm.,Licaria polyphylla,Dicypellium,Licaria
817695,Nectandra caudata Nees & Mart. ex Meisn.,Dicypellium caryophyllaceum (Mart.) Nees & Mart.,Dicypellium caryophyllaceum (Mart.) Nees & Mart.,Dicypellium caryophyllaceum (Mart.) Nees & Mart.,Dicypellium caryophyllaceum,Licaria polyphylla (Nees) Kosterm.,Licaria polyphylla,Dicypellium,Licaria
818638,Chenopodium acutifolium Kit. ex Schult.,"Lipandra polysperma (L.) S.Fuentes, Uotila & Borsch","Lipandra polysperma (L.) S.Fuentes, Uotila & Borsch","Lipandra polysperma (L.) S.Fuentes, Uotila & Borsch",Lipandra polysperma,Chenopodium standleyanum Aellen,Chenopodium standleyanum,Lipandra,Chenopodium
818642,Chenopodium polyspermum var. spicatum Klett & Richt.,"Lipandra polysperma (L.) S.Fuentes, Uotila & Borsch","Lipandra polysperma (L.) S.Fuentes, Uotila & Borsch","Lipandra polysperma (L.) S.Fuentes, Uotila & Borsch",Lipandra polysperma,Chenopodium standleyanum Aellen,Chenopodium standleyanum,Lipandra,Chenopodium
818676,Echinopsis dobeana (Dölz) J.G.Lamb.,Leucostele deserticola (Werderm.) Schlumpb.,Leucostele deserticola (Werderm.) Schlumpb.,Leucostele deserticola (Werderm.) Schlumpb.,Leucostele deserticola,Echinopsis aurea subsp. aurea,Echinopsis aurea,Leucostele,Echinopsis
818835,Tournefortia earlei Britton,Myriopus stenophyllus (Urb.) Feuillet,Myriopus stenophyllus (Urb.) Feuillet,Myriopus stenophyllus (Urb.) Feuillet,Myriopus stenophyllus,"Heliotropium earlei (Britton) Greuter, P.A.González & R.Rankin",Heliotropium earlei,Myriopus,Heliotropium
824398,Pyrus densiflora (Spach) Steud.,Aronia arbutifolia (L.) Pers.,Aronia arbutifolia (L.) Pers.,Aronia arbutifolia (L.) Pers.,Aronia arbutifolia,Aria edulis (Willd.) M.Roem.,Aria edulis,Aronia,Aria
824401,Aronia densiflora Spach,Aronia arbutifolia (L.) Pers.,Aronia arbutifolia (L.) Pers.,Aronia arbutifolia (L.) Pers.,Aronia arbutifolia,Aria edulis (Willd.) M.Roem.,Aria edulis,Aronia,Aria
824412,Sorbus densiflora (Spach) Heynh.,Aronia arbutifolia (L.) Pers.,Aronia arbutifolia (L.) Pers.,Aronia arbutifolia (L.) Pers.,Aronia arbutifolia,Aria edulis (Willd.) M.Roem.,Aria edulis,Aronia,Aria
834883,Bredemeyera altissima var. mollis (Triana & Planch.) A.W.Benn.,Bredemeyera divaricata (DC.) J.F.B.Pastore,Bredemeyera divaricata (DC.) J.F.B.Pastore,Bredemeyera divaricata (DC.) J.F.B.Pastore,Bredemeyera divaricata,Securidaca coriacea Bonpl.,Securidaca coriacea,Bredemeyera,Securidaca
840838,Sorbus hybrida var. neuillyensis (Dippel) Cockerell,Hedlundia hybrida (L.) Sennikov & Kurtto,Hedlundia hybrida (L.) Sennikov & Kurtto,Hedlundia hybrida (L.) Sennikov & Kurtto,Hedlundia hybrida,× Arsorbus thuringiaca (Nyman) Z.H.Feng & Su Liu,× Arsorbus thuringiaca,Hedlundia,× Arsorbus
841036,Peucedanum praeruptorum subsp. hirsutiusculum Ma,Kitagawia praeruptora (Dunn) Pimenov,Kitagawia praeruptora (Dunn) Pimenov,Kitagawia praeruptora (Dunn) Pimenov,Kitagawia praeruptora,Peucedanum harry-smithii var. harry-smithii,Peucedanum harry-smithii,Kitagawia,Peucedanum
841038,Peucedanum hirsutiusculum (Ma) V.M.Vinogr.,Kitagawia praeruptora (Dunn) Pimenov,Kitagawia praeruptora (Dunn) Pimenov,Kitagawia praeruptora (Dunn) Pimenov,Kitagawia praeruptora,Peucedanum harry-smithii var. harry-smithii,Peucedanum harry-smithii,Kitagawia,Peucedanum
841105,Richella discostigma (Diels) R.E.Fr.,Monanthotaxis montana (Engl. & Diels) P.H.Hoekstra,Monanthotaxis montana (Engl. & Diels) P.H.Hoekstra,Monanthotaxis montana (Engl. & Diels) P.H.Hoekstra,Monanthotaxis montana,Afroguatteria discostigma (Diels) X.Guo & R.M.K.Saunders,Afroguatteria discostigma,Monanthotaxis,Afroguatteria
841106,Oxymitra discostigma (Diels) Ghesq. ex Pellegr.,Monanthotaxis montana (Engl. & Diels) P.H.Hoekstra,Monanthotaxis montana (Engl. & Diels) P.H.Hoekstra,Monanthotaxis montana (Engl. & Diels) P.H.Hoekstra,Monanthotaxis montana,Afroguatteria discostigma (Diels) X.Guo & R.M.K.Saunders,Afroguatteria discostigma,Monanthotaxis,Afroguatteria
841107,Friesodielsia discostigma (Diels) Steenis,Monanthotaxis montana (Engl. & Diels) P.H.Hoekstra,Monanthotaxis montana (Engl. & Diels) P.H.Hoekstra,Monanthotaxis montana (Engl. & Diels) P.H.Hoekstra,Monanthotaxis montana,Afroguatteria discostigma (Diels) X.Guo & R.M.K.Saunders,Afroguatteria discostigma,Monanthotaxis,Afroguatteria
841108,Cleistopholis discostigma Diels,Monanthotaxis montana (Engl. & Diels) P.H.Hoekstra,Monanthotaxis montana (Engl. & Diels) P.H.Hoekstra,Monanthotaxis montana (Engl. & Diels) P.H.Hoekstra,Monanthotaxis montana,Afroguatteria discostigma (Diels) X.Guo & R.M.K.Saunders,Afroguatteria discostigma,Monanthotaxis,Afroguatteria
841109,Afroguatteria discostigma (Diels) X.Guo & R.M.K.Saunders,Monanthotaxis montana (Engl. & Diels) P.H.Hoekstra,Monanthotaxis montana (Engl. & Diels) P.H.Hoekstra,Monanthotaxis montana (Engl. & Diels) P.H.Hoekstra,Monanthotaxis montana,Afroguatteria discostigma (Diels) X.Guo & R.M.K.Saunders,Afroguatteria discostigma,Monanthotaxis,Afroguatteria
849662,Cousinia horridula Juz.,"Arctium horrescens (Juz.) S.López, Romasch., Susanna & N.Garcia","Arctium horrescens (Juz.) S.López, Romasch., Susanna & N.Garcia","Arctium horrescens (Juz.) S.López, Romasch., Susanna & N.Garcia",Arctium horrescens,Cousinia horridula Juz.,Cousinia horridula,Arctium,Cousinia
850850,Centaurea carthamoides Chevall.,Centaurea albonitens Turrill,Centaurea albonitens Turrill,Centaurea albonitens Turrill,Centaurea albonitens,Phonus lanatus (L.) Hill,Phonus lanatus,Centaurea,Phonus
852501,Vernonia floribunda Kunth,Vernonanthura patens (Kunth) H.Rob.,Vernonanthura patens (Kunth) H.Rob.,Vernonanthura patens (Kunth) H.Rob.,Vernonanthura patens,Critoniopsis floribunda (Kunth) H.Rob.,Critoniopsis floribunda,Vernonanthura,Critoniopsis
853029,Oliganthes jelskii Hieron.,Critoniopsis jelskii (Hieron.) H.Rob.,Critoniopsis jelskii (Hieron.) H.Rob.,Critoniopsis jelskii (Hieron.) H.Rob.,Critoniopsis jelskii,Grosvenoria jelskii (Hieron.) R.M.King & H.Rob.,Grosvenoria jelskii,Critoniopsis,Grosvenoria
853032,Grosvenoria jelskii (Hieron.) R.M.King & H.Rob.,Critoniopsis jelskii (Hieron.) H.Rob.,Critoniopsis jelskii (Hieron.) H.Rob.,Critoniopsis jelskii (Hieron.) H.Rob.,Critoniopsis jelskii,Grosvenoria jelskii (Hieron.) R.M.King & H.Rob.,Grosvenoria jelskii,Critoniopsis,Grosvenoria
860701,Xeranthemum ciliatum L.,Cullumia decurrens Less.,Cullumia decurrens Less.,Cullumia decurrens Less.,Cullumia decurrens,Polyarrhena reflexa subsp. reflexa,Polyarrhena reflexa,Cullumia,Polyarrhena
861428,Sonchus strictus Pau,Rainiera stricta (Greene) Greene,Rainiera stricta (Greene) Greene,Rainiera stricta (Greene) Greene,Rainiera stricta,Sonchus leptocephalus Cass.,Sonchus leptocephalus,Rainiera,Sonchus
862820,Doronicum japonicum Lam.,Gynura japonica (Thunb.) Juel,Gynura japonica (Thunb.) Juel,Gynura japonica (Thunb.) Juel,Gynura japonica,Ligularia japonica var. japonica,Ligularia japonica,Gynura,Ligularia
863168,Senecio depilis Phil.,Dendrophorbium americanum (L.f.) C.Jeffrey,Dendrophorbium americanum (L.f.) C.Jeffrey,Dendrophorbium americanum (L.f.) C.Jeffrey,Dendrophorbium americanum,Acrisione denticulata var. denticulata,Acrisione denticulata,Dendrophorbium,Acrisione
863318,Cacalia cinerarioides Kunth,Aetheolaena senecioides (Kunth) B.Nord.,Aetheolaena senecioides (Kunth) B.Nord.,Aetheolaena senecioides (Kunth) B.Nord.,Aetheolaena senecioides,Senecio bonplandianus DC.,Senecio bonplandianus,Aetheolaena,Senecio
865360,Gnaphalium javanicum Reinw. ex Blume,Pseudognaphalium affine (D.Don) Anderb.,Pseudognaphalium affine (D.Don) Anderb.,Pseudognaphalium affine (D.Don) Anderb.,Pseudognaphalium affine,Anaphalis javanica (Reinw. ex Blume) Martelli,Anaphalis javanica,Pseudognaphalium,Anaphalis
865579,Gnaphalium dealbatum var. luteofuscum (Webb) Lobin,Vellereophyton dealbatum (Thunb.) Hilliard & B.L.Burtt,Vellereophyton dealbatum (Thunb.) Hilliard & B.L.Burtt,Vellereophyton dealbatum (Thunb.) Hilliard & B.L.Burtt,Vellereophyton dealbatum,Pseudognaphalium luteoalbum (L.) Hilliard & B.L.Burtt,Pseudognaphalium luteoalbum,Vellereophyton,Pseudognaphalium
865580,Gnaphalium luteofuscum Webb,Vellereophyton dealbatum (Thunb.) Hilliard & B.L.Burtt,Vellereophyton dealbatum (Thunb.) Hilliard & B.L.Burtt,Vellereophyton dealbatum (Thunb.) Hilliard & B.L.Burtt,Vellereophyton dealbatum,Pseudognaphalium luteoalbum (L.) Hilliard & B.L.Burtt,Pseudognaphalium luteoalbum,Vellereophyton,Pseudognaphalium
865709,Gnaphalium lanatum G.Forst.,Euchiton involucratus (G.Forst.) Holub,Euchiton involucratus (G.Forst.) Holub,Euchiton involucratus (G.Forst.) Holub,Euchiton involucratus,"Pseudognaphalium lanatum (G.Forst.) Smissen, Breitw. & de Lange",Pseudognaphalium lanatum,Euchiton,Pseudognaphalium
867432,Aster praecox Mill.,Aster pyrenaeus Desf. ex DC.,Aster pyrenaeus Desf. ex DC.,Eurybia sibirica (L.) G.L.Nesom,Eurybia sibirica,Aster praecox Mill.,Aster praecox,Eurybia,Aster
867464,Leysera pilosella Thunb.,Afroaster hispidus (Thunb.) J.C.Manning & Goldblatt,Afroaster hispidus (Thunb.) J.C.Manning & Goldblatt,Afroaster hispidus (Thunb.) J.C.Manning & Goldblatt,Afroaster hispidus,Zyrphelis pilosella (Thunb.) Kuntze,Zyrphelis pilosella,Afroaster,Zyrphelis
871890,Leucanthemum vulgare subsp. discoideum Arcang.,Leucanthemum virgatum (Desr.) Clos,Leucanthemum virgatum (Desr.) Clos,Leucanthemum virgatum (Desr.) Clos,Leucanthemum virgatum,Plagius grandis (L.) Alavi & Heywood,Plagius grandis,Leucanthemum,Plagius
871955,Leucanthemum fontanesii Boiss. & Reut.,Plagius maghrebinus Vogt & Greuter,Plagius maghrebinus Vogt & Greuter,Plagius maghrebinus Vogt & Greuter,Plagius maghrebinus,Leucanthemum virgatum (Desr.) Clos,Leucanthemum virgatum,Plagius,Leucanthemum
879029,Eupatorium decipiens Hook. & Arn.,Ophryosporus triangularis Meyen,Ophryosporus triangularis Meyen,Ophryosporus triangularis Meyen,Ophryosporus triangularis,Heterocondylus decipiens (Hook. & Arn.) R.M.King & H.Rob.,Heterocondylus decipiens,Ophryosporus,Heterocondylus
883456,Vittaria lunulata Roxb.,Nesolindsaea caudata (Hook.) Lehtonen & Christenh.,Nesolindsaea caudata (Hook.) Lehtonen & Christenh.,Nesolindsaea caudata (Hook.) Lehtonen & Christenh.,Nesolindsaea caudata,Lindsaea parasitica (Roxb.) Wall. ex Hieron.,Lindsaea parasitica,Nesolindsaea,Lindsaea
883458,Lindsaea scandens Hook.,Nesolindsaea caudata (Hook.) Lehtonen & Christenh.,Nesolindsaea caudata (Hook.) Lehtonen & Christenh.,Nesolindsaea caudata (Hook.) Lehtonen & Christenh.,Nesolindsaea caudata,Lindsaea scandens Hook.,Lindsaea scandens,Nesolindsaea,Lindsaea
883459,Vittaria parasitica Roxb.,Nesolindsaea caudata (Hook.) Lehtonen & Christenh.,Nesolindsaea caudata (Hook.) Lehtonen & Christenh.,Nesolindsaea caudata (Hook.) Lehtonen & Christenh.,Nesolindsaea caudata,Lindsaea parasitica (Roxb.) Wall. ex Hieron.,Lindsaea parasitica,Nesolindsaea,Lindsaea
883460,Lindsaea bipinnata Roxb.,Nesolindsaea caudata (Hook.) Lehtonen & Christenh.,Nesolindsaea caudata (Hook.) Lehtonen & Christenh.,Nesolindsaea caudata (Hook.) Lehtonen & Christenh.,Nesolindsaea caudata,Lindsaea parasitica (Roxb.) Wall. ex Hieron.,Lindsaea parasitica,Nesolindsaea,Lindsaea
