884295,Lindsaea alexandri var. bipinnata Hillebr.,Asplenium dielerectum Viane,Asplenium dielerectum Viane,Asplenium dielerectum Viane,Asplenium dielerectum,Lindsaea knudsenii Hillebr.,Lindsaea knudsenii,Asplenium,Lindsaea
884501,Trichomanes obtusum (Copel.) C.V.Morton,Hymenophyllum obtusum Hook. & Arn.,Hymenophyllum obtusum Hook. & Arn.,Hymenophyllum obtusum Hook. & Arn.,Hymenophyllum obtusum,Trichomanes maximum Blume,Trichomanes maximum,Hymenophyllum,Trichomanes
888722,Dryopteris strigosa (Willd.) C.Chr.,Ctenitis crinita (Poir.) Ching,Ctenitis crinita (Poir.) Ching,Ctenitis crinita (Poir.) Ching,Ctenitis crinita,Thelypteris strigosa (Willd.) Tardieu,Thelypteris strigosa,Ctenitis,Thelypteris
890183,Stenochlaena leptocarpa (Fée) Underw.,Lomariopsis spectabilis Mett.,Lomariopsis spectabilis Mett.,Lomariopsis spectabilis Mett.,Lomariopsis spectabilis,Teratophyllum leptocarpum (Fée) Holttum,Teratophyllum leptocarpum,Lomariopsis,Teratophyllum
891780,Goniophlebium elatum Fée,Serpocaulon dissimile (L.) A.R.Sm.,Serpocaulon dissimile (L.) A.R.Sm.,Serpocaulon dissimile (L.) A.R.Sm.,Serpocaulon dissimile,Pecluma dulcis (Poir.) F.C.Assis & Salino,Pecluma dulcis,Serpocaulon,Pecluma
891965,Polypodium mollendense Maxon,Pleopeltis masafuerae (Phil.) de la Sota,Pleopeltis masafuerae (Phil.) de la Sota,Pleopeltis masafuerae (Phil.) de la Sota,Pleopeltis masafuerae,Polypodium mollendense Maxon,Polypodium mollendense,Pleopeltis,Polypodium
892641,Alsophila gazellae Kuhn,Sphaeropteris lunulata (G.Forst.) R.M.Tryon,Sphaeropteris lunulata (G.Forst.) R.M.Tryon,Sphaeropteris lunulata (G.Forst.) R.M.Tryon,Sphaeropteris lunulata,Pleocnemia cumingiana C.Presl,Pleocnemia cumingiana,Sphaeropteris,Pleocnemia
892792,Cyathea remotifolia Bonap.,Alsophila simulans Baker,Alsophila simulans Baker,Alsophila simulans Baker,Alsophila simulans,Cyathea remotifolia Bonap.,Cyathea remotifolia,Alsophila,Cyathea
898869,Cyathea nigrescens (Hook.) J.Sm.,Thelypteris woodlarkensis (Copel.) Christenh.,Thelypteris woodlarkensis (Copel.) Christenh.,Thelypteris woodlarkensis (Copel.) Christenh.,Thelypteris woodlarkensis,Alsophila woodwardioides (Kaulf.) D.S.Conant,Alsophila woodwardioides,Thelypteris,Alsophila
900535,Anemone soyensis H.Boissieu,Anemonastrum flaccidum (Fr.Schmidt) Mosyakin,Anemonastrum flaccidum (Fr.Schmidt) Mosyakin,Anemonastrum flaccidum (Fr.Schmidt) Mosyakin,Anemonastrum flaccidum,Anemone soyensis H.Boissieu,Anemone soyensis,Anemonastrum,Anemone
902756,Seriphium corymbiferum L.,Myrovernix gnaphaloides (L.) Koek.,Myrovernix gnaphaloides (L.) Koek.,Myrovernix gnaphaloides (L.) Koek.,Myrovernix gnaphaloides,Stoebe gomphrenoides P.J.Bergius,Stoebe gomphrenoides,Myrovernix,Stoebe
908020,Cytisus lotoides Pourr.,Chamaecytisus supinus subsp. supinus,Chamaecytisus supinus subsp. supinus,Chamaecytisus supinus subsp. supinus,Chamaecytisus supinus,Cytisus lotoides Pourr.,Cytisus lotoides,Chamaecytisus,Cytisus
908027,Chamaecytisus supinus var. gallicus (A.Kern. ex Willk. & Lange) C.Vicioso,Chamaecytisus supinus subsp. supinus,Chamaecytisus supinus subsp. supinus,Chamaecytisus supinus subsp. supinus,Chamaecytisus supinus,Cytisus lotoides Pourr.,Cytisus lotoides,Chamaecytisus,Cytisus
908034,Cytisus supinus var. gallicus (A.Kern. ex Willk. & Lange) Briq.,Chamaecytisus supinus subsp. supinus,Chamaecytisus supinus subsp. supinus,Chamaecytisus supinus subsp. supinus,Chamaecytisus supinus,Cytisus lotoides Pourr.,Cytisus lotoides,Chamaecytisus,Cytisus
908229,Cytisus benehoavensis (Bolle) Svent.,Cytisus scoparius subsp. scoparius,Cytisus scoparius subsp. scoparius,Cytisus scoparius subsp. scoparius,Cytisus scoparius,Genista benehoavensis (Bolle) del Arco,Genista benehoavensis,Cytisus,Genista
910003,Nanophyton acutum (L.) Druce,Nanophyton erinaceum subsp. erinaceum,Nanophyton erinaceum subsp. erinaceum,Nanophyton erinaceum subsp. erinaceum,Nanophyton erinaceum,Polycnemum majus A.Braun ex Bogenh.,Polycnemum majus,Nanophyton,Polycnemum
910013,Camphorosma acuta L.,Nanophyton erinaceum subsp. erinaceum,Nanophyton erinaceum subsp. erinaceum,Nanophyton erinaceum subsp. erinaceum,Nanophyton erinaceum,Polycnemum majus A.Braun ex Bogenh.,Polycnemum majus,Nanophyton,Polycnemum
911119,Sedum griffithii C.B.Clarke,Rosularia adenotricha subsp. adenotricha,Rosularia adenotricha subsp. adenotricha,Rosularia adenotricha subsp. adenotricha,Rosularia adenotricha,Sedum griffithii C.B.Clarke,Sedum griffithii,Rosularia,Sedum
913539,Cardamine laevigata (Willd.) Bubani,Sisymbrella aspera subsp. aspera,Sisymbrella aspera subsp. aspera,Sisymbrella aspera subsp. aspera,Sisymbrella aspera,Diplotaxis tenuifolia (L.) DC.,Diplotaxis tenuifolia,Sisymbrella,Diplotaxis
913543,Nasturtium asperum var. laevigatum (Willd.) E.Fourn.,Sisymbrella aspera subsp. aspera,Sisymbrella aspera subsp. aspera,Sisymbrella aspera subsp. aspera,Sisymbrella aspera,Diplotaxis tenuifolia (L.) DC.,Diplotaxis tenuifolia,Sisymbrella,Diplotaxis
913545,Nasturtium asperum subsp. laevigatum (Willd.) Virot,Sisymbrella aspera subsp. aspera,Sisymbrella aspera subsp. aspera,Sisymbrella aspera subsp. aspera,Sisymbrella aspera,Diplotaxis tenuifolia (L.) DC.,Diplotaxis tenuifolia,Sisymbrella,Diplotaxis
913547,Sisymbrium laevigatum Willd.,Sisymbrella aspera subsp. aspera,Sisymbrella aspera subsp. aspera,Sisymbrella aspera subsp. aspera,Sisymbrella aspera,Diplotaxis tenuifolia (L.) DC.,Diplotaxis tenuifolia,Sisymbrella,Diplotaxis
915087,Olmedia grandifolia Trécul,Maquira guianensis subsp. guianensis,Maquira guianensis subsp. guianensis,Maquira guianensis subsp. guianensis,Maquira guianensis,Perebea guianensis subsp. guianensis,Perebea guianensis,Maquira,Perebea
920300,Abelmoschus palustris (L.) Walp.,Abelmoschus moschatus subsp. moschatus,Abelmoschus moschatus subsp. moschatus,Abelmoschus moschatus subsp. moschatus,Abelmoschus moschatus,Hibiscus moscheutos subsp. moscheutos,Hibiscus moscheutos,Abelmoschus,Hibiscus
921725,Erysimum wettsteinianum Kuntze,Arabis alpina subsp. alpina,Arabis alpina subsp. alpina,Arabis alpina subsp. alpina,Arabis alpina,Erysimum sylvestre subsp. sylvestre,Erysimum sylvestre,Arabis,Erysimum
923528,Cardamine nasturtiifolia Steud.,Cardamine pratensis subsp. pratensis,Cardamine pratensis subsp. pratensis,Cardamine pratensis subsp. pratensis,Cardamine pratensis,Rorippa bonariensis var. bonariensis,Rorippa bonariensis,Cardamine,Rorippa
929695,Ilex ligustrina var. minutiflora (A.Rich.) Loes.,Ilex vomitoria subsp. vomitoria,Ilex vomitoria subsp. vomitoria,Ilex vomitoria subsp. vomitoria,Ilex vomitoria,Banara minutiflora (A.Rich.) Sleumer,Banara minutiflora,Ilex,Banara
929746,Ilex cuneifolia Hook.,Jodina rhombifolia subsp. rhombifolia,Jodina rhombifolia subsp. rhombifolia,Jodina rhombifolia subsp. rhombifolia,Jodina rhombifolia,Ilex obcordata var. obcordata,Ilex obcordata,Jodina,Ilex
930399,Carduus cynaroides Lam.,Cynara cardunculus subsp. cardunculus,Cynara cardunculus subsp. cardunculus,Cynara cardunculus subsp. cardunculus,Cynara cardunculus,Lamyropsis cynaroides (Lam.) Dittrich,Lamyropsis cynaroides,Cynara,Lamyropsis
930402,Chamaepeuce cynaroides (Lam.) DC.,Cynara cardunculus subsp. cardunculus,Cynara cardunculus subsp. cardunculus,Cynara cardunculus subsp. cardunculus,Cynara cardunculus,Lamyropsis cynaroides (Lam.) Dittrich,Lamyropsis cynaroides,Cynara,Lamyropsis
930405,Carduus cynara E.H.L.Krause,Cynara cardunculus subsp. cardunculus,Cynara cardunculus subsp. cardunculus,Cynara cardunculus subsp. cardunculus,Cynara cardunculus,Lamyropsis cynaroides (Lam.) Dittrich,Lamyropsis cynaroides,Cynara,Lamyropsis
931191,Carduus horridus Adams,Centaurea benedicta var. benedicta,Centaurea benedicta var. benedicta,Centaurea benedicta var. benedicta,Centaurea benedicta,Cirsium pugnax Sommier & Levier,Cirsium pugnax,Centaurea,Cirsium
931238,Vernonia apocynifolia Baker,Cyanthillium cinereum var. cinereum,Cyanthillium cinereum var. cinereum,Cyanthillium cinereum var. cinereum,Cyanthillium cinereum,"Humbertacalia apocynifolia (Baker) Rabarim., Callm. & J.Calvo",Humbertacalia apocynifolia,Cyanthillium,Humbertacalia
934156,Tutuca fistulosa Molina,Senecio fistulosus var. fistulosus,Senecio fistulosus var. fistulosus,Senecio fistulosus var. fistulosus,Senecio fistulosus,Chusquea culeou É.Desv.,Chusquea culeou,Senecio,Chusquea
935646,Asplenium bidentatum Willd.,Asplenium erosum var. erosum,Asplenium erosum var. erosum,Asplenium erosum var. erosum,Asplenium erosum,Hymenasplenium laetum (Sw.) L.Regalado & Prada,Hymenasplenium laetum,Asplenium,Hymenasplenium
938291,Galactia formosa (Griseb.) Stuck. ex Seckt,Nanogalactia heterophylla (Gillies ex Hook.) L.P.Queiroz,Nanogalactia heterophylla (Gillies ex Hook.) L.P.Queiroz,Nanogalactia heterophylla (Gillies ex Hook.) L.P.Queiroz,Nanogalactia heterophylla,Collaea argentina Griseb.,Collaea argentina,Nanogalactia,Collaea
938292,Collaea argentina Griseb.,Nanogalactia heterophylla (Gillies ex Hook.) L.P.Queiroz,Nanogalactia heterophylla (Gillies ex Hook.) L.P.Queiroz,Nanogalactia heterophylla (Gillies ex Hook.) L.P.Queiroz,Nanogalactia heterophylla,Collaea argentina Griseb.,Collaea argentina,Nanogalactia,Collaea
938294,Collaea formosa Griseb.,Nanogalactia heterophylla (Gillies ex Hook.) L.P.Queiroz,Nanogalactia heterophylla (Gillies ex Hook.) L.P.Queiroz,Nanogalactia heterophylla (Gillies ex Hook.) L.P.Queiroz,Nanogalactia heterophylla,Collaea argentina Griseb.,Collaea argentina,Nanogalactia,Collaea
938859,Opuntia colubrina A.Cast.,Salmonopuntia schickendantzii (F.A.C.Weber) Font & M.Köhler,Salmonopuntia schickendantzii (F.A.C.Weber) Font & M.Köhler,Salmonopuntia schickendantzii (F.A.C.Weber) Font & M.Köhler,Salmonopuntia schickendantzii,Opuntia colubrina A.Cast.,Opuntia colubrina,Salmonopuntia,Opuntia
1112669,Cynorkis micrantha (Frapp. ex Cordem.) Schltr.,Cynorkis falcata (Frapp. ex Cordem.) Schltr.,Cynorkis falcata (Frapp. ex Cordem.) Schltr.,Cynorkis falcata (Frapp. ex Cordem.) Schltr.,Cynorkis falcata,Benthamia gracilis J.M.H.Shaw,Benthamia gracilis,Cynorkis,Benthamia
1115732,Luisia birchea Blume,Luisia tenuifolia Blume,Luisia tenuifolia Blume,Cleisostoma tenuifolium (L.) Garay,Cleisostoma tenuifolium,Luisia birchea Blume,Luisia birchea,Cleisostoma,Luisia
1115733,Luisia laurifolia M.R.Almeida,Luisia tenuifolia Blume,Luisia tenuifolia Blume,Cleisostoma tenuifolium (L.) Garay,Cleisostoma tenuifolium,Luisia birchea Blume,Luisia birchea,Cleisostoma,Luisia
1117157,Listrostachys pescatoriana (Lindl.) S.Moore,Oeoniella polystachys (Thouars) Schltr.,Oeoniella polystachys (Thouars) Schltr.,Oeoniella polystachys (Thouars) Schltr.,Oeoniella polystachys,Listrostachys pertusa (Lindl.) Rchb.f.,Listrostachys pertusa,Oeoniella,Listrostachys
1122875,Canistrum lindenii (Regel) Mez,Hohenbergia augusta (Vell.) É.Morren,Hohenbergia augusta (Vell.) É.Morren,Hohenbergia augusta (Vell.) É.Morren,Hohenbergia augusta,Edmundoa lindenii (Regel) Leme,Edmundoa lindenii,Hohenbergia,Edmundoa
1126079,Chytroma praeclara (Sandwith) R.Knuth,Lecythis holcogyne (Sandwith) S.A.Mori,Lecythis holcogyne (Sandwith) S.A.Mori,Chytroma holcogyne (Sandwith) R.Knuth,Chytroma holcogyne,Lecythis praeclara (Sandwith) S.A.Mori ex Molino & Sabatier,Lecythis praeclara,Chytroma,Lecythis
1141108,Ligusticum apiifolium (Nutt.) A.Gray,Lomatium dissectum (Nutt.) Mathias & Constance,Lomatium dissectum (Nutt.) Mathias & Constance,Lomatium dissectum (Nutt.) Mathias & Constance,Lomatium dissectum,Ligusticum apiifolium (Nutt.) A.Gray,Ligusticum apiifolium,Lomatium,Ligusticum
1148006,Malveopsis spicata var. normalis Kuntze,Malvastrum americanum (L.) Torr.,Malvastrum americanum (L.) Torr.,Malvastrum americanum (L.) Torr.,Malvastrum americanum,Melochia spicata (L.) Fryxell,Melochia spicata,Malvastrum,Melochia
1148008,Melochia spicata (L.) Fryxell,Malvastrum americanum (L.) Torr.,Malvastrum americanum (L.) Torr.,Malvastrum americanum (L.) Torr.,Malvastrum americanum,Melochia spicata (L.) Fryxell,Melochia spicata,Malvastrum,Melochia
1148009,Visenia spicata (L.) Colla,Malvastrum americanum (L.) Torr.,Malvastrum americanum (L.) Torr.,Malvastrum americanum (L.) Torr.,Malvastrum americanum,Melochia spicata (L.) Fryxell,Melochia spicata,Malvastrum,Melochia
1148012,Malveopsis spicata (L.) Kuntze,Malvastrum americanum (L.) Torr.,Malvastrum americanum (L.) Torr.,Malvastrum americanum (L.) Torr.,Malvastrum americanum,Melochia spicata (L.) Fryxell,Melochia spicata,Malvastrum,Melochia
1148013,Malvastrum spicatum (L.) A.Gray,Malvastrum americanum (L.) Torr.,Malvastrum americanum (L.) Torr.,Malvastrum americanum (L.) Torr.,Malvastrum americanum,Melochia spicata (L.) Fryxell,Melochia spicata,Malvastrum,Melochia
1149274,Vigna stipulacea (Lam.) Kuntze,Pueraria montana var. lobata (Willd.) Maesen & S.M.Almeida ex Sanjappa & Predeep,Pueraria montana var. lobata (Willd.) Maesen & S.M.Almeida ex Sanjappa & Predeep,Pueraria montana var. lobata (Willd.) Maesen & S.M.Almeida ex Sanjappa & Predeep,Pueraria montana,Vigna stipulacea (Lam.) Kuntze,Vigna stipulacea,Pueraria,Vigna
1153050,Mesembryanthemum deflectum N.E.Br.,Antimima defecta (L.Bolus) H.E.K.Hartmann,Antimima defecta (L.Bolus) H.E.K.Hartmann,Antimima defecta (L.Bolus) H.E.K.Hartmann,Antimima defecta,Ruschia decumbens L.Bolus,Ruschia decumbens,Antimima,Ruschia
1159092,Cumulopuntia berteroi (Colla) F.Ritter,Eriosyce subgibbosa (Haw.) Katt.,Eriosyce subgibbosa (Haw.) Katt.,Eriosyce subgibbosa (Haw.) Katt.,Eriosyce subgibbosa,Cumulopuntia berteroi (Colla) F.Ritter,Cumulopuntia berteroi,Eriosyce,Cumulopuntia
1159100,Opuntia berteroi (Colla) A.E.Hoffm.,Eriosyce subgibbosa (Haw.) Katt.,Eriosyce subgibbosa (Haw.) Katt.,Eriosyce subgibbosa (Haw.) Katt.,Eriosyce subgibbosa,Cumulopuntia berteroi (Colla) F.Ritter,Cumulopuntia berteroi,Eriosyce,Cumulopuntia
1159101,Echinocactus berteroi (Colla) Gay,Eriosyce subgibbosa (Haw.) Katt.,Eriosyce subgibbosa (Haw.) Katt.,Eriosyce subgibbosa (Haw.) Katt.,Eriosyce subgibbosa,Cumulopuntia berteroi (Colla) F.Ritter,Cumulopuntia berteroi,Eriosyce,Cumulopuntia
1167120,Caesalpinia pyramidata (Mill.) Martyn,Cenostigma gaumeri (Greenm.) Gagnon & G.P.Lewis,Cenostigma gaumeri (Greenm.) Gagnon & G.P.Lewis,Cenostigma gaumeri (Greenm.) Gagnon & G.P.Lewis,Cenostigma gaumeri,Erythrostemon yucatanensis var. yucatanensis,Erythrostemon yucatanensis,Cenostigma,Erythrostemon
1167650,Arenaria arctica var. hondoensis (Ohwi) H.Hara,Cherleria arctica (Steven ex Ser.) A.J.Moore & Dillenb.,Cherleria arctica (Steven ex Ser.) A.J.Moore & Dillenb.,Cherleria arctica (Steven ex Ser.) A.J.Moore & Dillenb.,Cherleria arctica,Minuartia hondoensis (Ohwi) Ohwi,Minuartia hondoensis,Cherleria,Minuartia
1168358,Arctium majus subsp. intermedium (Lange) Nyman,Cousinia chlorocephala C.A.Mey. ex DC.,Cousinia chlorocephala C.A.Mey. ex DC.,Cousinia chlorocephala C.A.Mey. ex DC.,Cousinia chlorocephala,Arctium nemorosum Lej.,Arctium nemorosum,Cousinia,Arctium
1168359,Lappa intermedium (Lange) Lange,Cousinia chlorocephala C.A.Mey. ex DC.,Cousinia chlorocephala C.A.Mey. ex DC.,Cousinia chlorocephala C.A.Mey. ex DC.,Cousinia chlorocephala,Arctium nemorosum Lej.,Arctium nemorosum,Cousinia,Arctium
1170662,Shawia arguta (Benth.) Britten,Camptacra gracilis (Benth.) Lander,Camptacra gracilis (Benth.) Lander,Camptacra gracilis (Benth.) Lander,Camptacra gracilis,Shawia arguta (Benth.) Britten,Shawia arguta,Camptacra,Shawia
1172840,Parahemionitis arifolia (Burm.f.) Panigrahi,Acrostichum aureum L.,Acrostichum aureum L.,Acrostichum aureum L.,Acrostichum aureum,Hemionitis arifolia (Burm.f.) T.Moore,Hemionitis arifolia,Acrostichum,Hemionitis
1172841,Gymnogramma arifolia (Burm.f.) Kuhn,Acrostichum aureum L.,Acrostichum aureum L.,Acrostichum aureum L.,Acrostichum aureum,Hemionitis arifolia (Burm.f.) T.Moore,Hemionitis arifolia,Acrostichum,Hemionitis
1172842,Hemionitis arifolia (Burm.f.) T.Moore,Acrostichum aureum L.,Acrostichum aureum L.,Acrostichum aureum L.,Acrostichum aureum,Hemionitis arifolia (Burm.f.) T.Moore,Hemionitis arifolia,Acrostichum,Hemionitis
1176496,Lotus alamosanus (Rose) Gentry,Acmispon watsonii (Vasey & Rose) Brouillet,Acmispon watsonii (Vasey & Rose) Brouillet,Acmispon watsonii (Vasey & Rose) Brouillet,Acmispon watsonii,Hosackia alamosana Rose,Hosackia alamosana,Acmispon,Hosackia
1177237,Oreocharis leveilleana Fedde,Oreocharis auricula var. auricula,Oreocharis auricula var. auricula,Oreocharis auricula var. auricula,Oreocharis auricula,Petrocodon leveilleanus (Fedde) X.X.Bai & F.Wen,Petrocodon leveilleanus,Oreocharis,Petrocodon
1179658,Matricaria valentina (L.) L.,Porophyllum ruderale var. ruderale,Porophyllum ruderale var. ruderale,Porophyllum ruderale var. ruderale,Porophyllum ruderale,Anacyclus radiatus Loisel.,Anacyclus radiatus,Porophyllum,Anacyclus
1185296,Coprosma dentata (Elmer) Heads,Nertera granadensis var. granadensis,Nertera granadensis var. granadensis,Nertera granadensis var. granadensis,Nertera granadensis,Hemiphragma heterophyllum var. dentatum (Elmer) T.Yamaz.,Hemiphragma heterophyllum,Nertera,Hemiphragma
1187797,Anoectochilus lowii T.Br.,Dossinia marmorata C.Morren,Dossinia marmorata C.Morren,Dossinia marmorata C.Morren,Dossinia marmorata,Anoectochilus brevilabris Lindl.,Anoectochilus brevilabris,Dossinia,Anoectochilus
1188397,Octomeria stellata (Lindl.) Spreng.,Eria javanica (Sw.) Blume,Eria javanica (Sw.) Blume,Bulbophyllum gibbosum (Blume) Lindl.,Bulbophyllum gibbosum,Eria stellata Lindl.,Eria stellata,Bulbophyllum,Eria
1188399,Tainia stellata (Lindl.) Pfitzer,Eria javanica (Sw.) Blume,Eria javanica (Sw.) Blume,Bulbophyllum gibbosum (Blume) Lindl.,Bulbophyllum gibbosum,Eria stellata Lindl.,Eria stellata,Bulbophyllum,Eria
1188400,Eria rugosa (Blume) Lindl.,Eria javanica (Sw.) Blume,Eria javanica (Sw.) Blume,Bulbophyllum gibbosum (Blume) Lindl.,Bulbophyllum gibbosum,Eria stellata Lindl.,Eria stellata,Bulbophyllum,Eria
1188401,Pinalia fragrans (Rchb.f.) Kuntze,Eria javanica (Sw.) Blume,Eria javanica (Sw.) Blume,Bulbophyllum gibbosum (Blume) Lindl.,Bulbophyllum gibbosum,Eria stellata Lindl.,Eria stellata,Bulbophyllum,Eria
1188402,Pinalia stellata (Lindl.) Kuntze,Eria javanica (Sw.) Blume,Eria javanica (Sw.) Blume,Bulbophyllum gibbosum (Blume) Lindl.,Bulbophyllum gibbosum,Eria stellata Lindl.,Eria stellata,Bulbophyllum,Eria
1188403,Pinalia rugosa (Blume) Kuntze,Eria javanica (Sw.) Blume,Eria javanica (Sw.) Blume,Bulbophyllum gibbosum (Blume) Lindl.,Bulbophyllum gibbosum,Eria stellata Lindl.,Eria stellata,Bulbophyllum,Eria
1188404,Pinalia striolata (Rchb.f.) Kuntze,Eria javanica (Sw.) Blume,Eria javanica (Sw.) Blume,Bulbophyllum gibbosum (Blume) Lindl.,Bulbophyllum gibbosum,Eria stellata Lindl.,Eria stellata,Bulbophyllum,Eria
1197365,Uragoga nitidula (Cham. & Schltdl.) Kuntze,Psychotria leiocarpa Cham. & Schltdl.,Psychotria leiocarpa Cham. & Schltdl.,Palicourea leiocarpa (Cham. & Schltdl.) Delprete,Palicourea leiocarpa,Psychotria nitidula Cham. & Schltdl.,Psychotria nitidula,Palicourea,Psychotria
1200010,Xylobium corrugatum var. wageneri (Rchb.f.) Schltr.,Teuscheria wageneri (Rchb.f.) Garay,Teuscheria wageneri (Rchb.f.) Garay,Bifrenaria wageneri Rchb.f.,Bifrenaria wageneri,Xylobium corrugatum (Lindl.) Rolfe,Xylobium corrugatum,Bifrenaria,Xylobium
1200012,Xylobium wageneri (Rchb.f.) Schltr.,Teuscheria wageneri (Rchb.f.) Garay,Teuscheria wageneri (Rchb.f.) Garay,Bifrenaria wageneri Rchb.f.,Bifrenaria wageneri,Xylobium corrugatum (Lindl.) Rolfe,Xylobium corrugatum,Bifrenaria,Xylobium
1205206,Dupatya vaginata (Körn.) Kuntze,Syngonanthus fischerianus (Bong.) Ruhland,Syngonanthus fischerianus (Bong.) Ruhland,Syngonanthus fischerianus (Bong.) Ruhland,Syngonanthus fischerianus,Paepalanthus vaginatus Körn.,Paepalanthus vaginatus,Syngonanthus,Paepalanthus
1213337,Callitropsis funebris (Endl.) de Laub. & Husby,Cupressus pendula Thunb.,Cupressus pendula Thunb.,Platycladus orientalis (L.) Franco,Platycladus orientalis,Cupressus funebris Endl.,Cupressus funebris,Platycladus,Cupressus
1213342,Chamaecyparis funebris (Endl.) Franco,Cupressus pendula Thunb.,Cupressus pendula Thunb.,Platycladus orientalis (L.) Franco,Platycladus orientalis,Cupressus funebris Endl.,Cupressus funebris,Platycladus,Cupressus
1213344,Platycyparis funebris (Endl.) A.V.Bobrov & Melikyan,Cupressus pendula Thunb.,Cupressus pendula Thunb.,Platycladus orientalis (L.) Franco,Platycladus orientalis,Cupressus funebris Endl.,Cupressus funebris,Platycladus,Cupressus
1213711,Vilfa frondosa C.Presl,Agrostis castellana Boiss. & Reut.,Agrostis castellana Boiss. & Reut.,Agrostis castellana Boiss. & Reut.,Agrostis castellana,Polypogon viridis (Gouan) Breistr.,Polypogon viridis,Agrostis,Polypogon
1221701,Microlaena avenacea var. carsei (Cheeseman) Zotov,Ehrharta diplax var. diplax,Ehrharta diplax var. diplax,Ehrharta diplax var. diplax,Ehrharta diplax,Microlaena carsei Cheeseman,Microlaena carsei,Ehrharta,Microlaena
1229830,Agrosinapis arvensis (L.) Fourr.,Moricandia arvensis (L.) DC.,Moricandia arvensis (L.) DC.,Moricandia arvensis (L.) DC.,Moricandia arvensis,Mutarda arvensis (L.) D.A.German,Mutarda arvensis,Moricandia,Mutarda
1245194,Scabiosa japonica subsp. tschiliensis (Grüning) Hurus.,Scabiosa comosa Fisch. ex Roem. & Schult.,Scabiosa comosa Fisch. ex Roem. & Schult.,"Lomelosia comosa (Fisch. ex Roem. & Schult.) J.H.Xue, Chepinoga & K.P.Ma",Lomelosia comosa,Scabiosa tschiliensis Grüning,Scabiosa tschiliensis,Lomelosia,Scabiosa
1245195,Trochocephalus tschiliensis (Grüning) Á.Löve & D.Löve,Scabiosa comosa Fisch. ex Roem. & Schult.,Scabiosa comosa Fisch. ex Roem. & Schult.,"Lomelosia comosa (Fisch. ex Roem. & Schult.) J.H.Xue, Chepinoga & K.P.Ma",Lomelosia comosa,Scabiosa tschiliensis Grüning,Scabiosa tschiliensis,Lomelosia,Scabiosa
1245203,Scabiosa japonica var. tschiliensis (Grüning) Hurus.,Scabiosa comosa Fisch. ex Roem. & Schult.,Scabiosa comosa Fisch. ex Roem. & Schult.,"Lomelosia comosa (Fisch. ex Roem. & Schult.) J.H.Xue, Chepinoga & K.P.Ma",Lomelosia comosa,Scabiosa tschiliensis Grüning,Scabiosa tschiliensis,Lomelosia,Scabiosa
1247958,Feuilleea terminalis Kuntze,Albizia polycephala (Benth.) Killip,Albizia polycephala (Benth.) Killip,Pseudalbizzia polycephala (Benth.) E.J.M.Koenen & Duno,Pseudalbizzia polycephala,"Hydrochorea pedicellaris (DC.) M.V.B.Soares, Iganci & M.P.Morim",Hydrochorea pedicellaris,Pseudalbizzia,Hydrochorea
1257790,Chrysoxylon vinhatico Casar.,Dimorphandra exaltata Schott,Dimorphandra exaltata Schott,Dimorphandra exaltata Schott,Dimorphandra exaltata,Plathymenia reticulata Benth.,Plathymenia reticulata,Dimorphandra,Plathymenia
1259436,Eruca vesicaria var. stenocarpa (Boiss. & Reut.) Thell.,Eruca vesicaria (L.) Cav.,Eruca vesicaria (L.) Cav.,Eruca vesicaria (L.) Cav.,Eruca vesicaria,Erucastrum nasturtiifolium subsp. nasturtiifolium,Erucastrum nasturtiifolium,Eruca,Erucastrum
1259440,Eruca sativa var. stenocarpa (Boiss. & Reut.) Coss.,Eruca vesicaria (L.) Cav.,Eruca vesicaria (L.) Cav.,Eruca vesicaria (L.) Cav.,Eruca vesicaria,Erucastrum nasturtiifolium subsp. nasturtiifolium,Erucastrum nasturtiifolium,Eruca,Erucastrum
1259447,Eruca sativa subsp. stenocarpa (Boiss. & Reut.) Maire,Eruca vesicaria (L.) Cav.,Eruca vesicaria (L.) Cav.,Eruca vesicaria (L.) Cav.,Eruca vesicaria,Erucastrum nasturtiifolium subsp. nasturtiifolium,Erucastrum nasturtiifolium,Eruca,Erucastrum
1262082,Haplanthus tentaculatus var. neilgherryensis (Wight) C.B.Clarke,Haplanthodes Kuntze,Haplanthodes Kuntze,Haplanthodes Kuntze,,Haplanthodes neilgherryensis (Wight) R.B.Majumdar,Haplanthodes neilgherryensis,,Haplanthodes
1262084,Bremekampia neilgherryensis (Wight) Sreem.,Haplanthodes Kuntze,Haplanthodes Kuntze,Haplanthodes Kuntze,,Haplanthodes neilgherryensis (Wight) R.B.Majumdar,Haplanthodes neilgherryensis,,Haplanthodes
1262121,Harrisia serruliflora (Haw.) Lourteig,Harrisia divaricata (Lam.) Backeb.,Harrisia divaricata (Lam.) Backeb.,Harrisia divaricata (Lam.) Backeb.,Harrisia divaricata,Serrulatocereus serruliflorus (Haw.) Guiggi,Serrulatocereus serruliflorus,Harrisia,Serrulatocereus
1262123,Serrulatocereus serruliflorus (Haw.) Guiggi,Harrisia divaricata (Lam.) Backeb.,Harrisia divaricata (Lam.) Backeb.,Harrisia divaricata (Lam.) Backeb.,Harrisia divaricata,Serrulatocereus serruliflorus (Haw.) Guiggi,Serrulatocereus serruliflorus,Harrisia,Serrulatocereus
1263493,Robinsonia guianensis (Aubl.) J.F.Gmel.,Quiina guianensis Aubl.,Quiina guianensis Aubl.,Quiina guianensis Aubl.,Quiina guianensis,Touroulia guianensis Aubl.,Touroulia guianensis,Quiina,Touroulia
1271086,× Rowleyara hildmannii (Hildm.) P.V.Heath,Disocactus crenatus subsp. kimnachii (Bavo) M.Á.Cruz & S.Arias,Disocactus crenatus subsp. kimnachii (Bavo) M.Á.Cruz & S.Arias,Disocactus crenatus subsp. kimnachii (Bavo) M.Á.Cruz & S.Arias,Disocactus crenatus,× Disoselenicereus hildmannii (Hildm.) M.H.J.van der Meer,× Disoselenicereus hildmannii,Disocactus,× Disoselenicereus
1275115,Senecio bonplandianus DC.,Aetheolaena senecioides (Kunth) B.Nord.,Aetheolaena senecioides (Kunth) B.Nord.,Aetheolaena senecioides (Kunth) B.Nord.,Aetheolaena senecioides,Senecio bonplandianus DC.,Senecio bonplandianus,Aetheolaena,Senecio
1282516,Anemonoides soyensis (H.Boissieu) Holub,Anemonastrum flaccidum (Fr.Schmidt) Mosyakin,Anemonastrum flaccidum (Fr.Schmidt) Mosyakin,Anemonastrum flaccidum (Fr.Schmidt) Mosyakin,Anemonastrum flaccidum,Anemone soyensis H.Boissieu,Anemone soyensis,Anemonastrum,Anemone
1285044,Maquira grandifolia (Trécul) Baill. ex Benth. & Hook.f.,Maquira guianensis subsp. guianensis,Maquira guianensis subsp. guianensis,Maquira guianensis subsp. guianensis,Maquira guianensis,Perebea guianensis subsp. guianensis,Perebea guianensis,Maquira,Perebea
1286946,Cirsium horridum (Adams) Petr.,Centaurea benedicta var. benedicta,Centaurea benedicta var. benedicta,Centaurea benedicta var. benedicta,Centaurea benedicta,Cirsium pugnax Sommier & Levier,Cirsium pugnax,Centaurea,Cirsium
1287392,Placus membranaceus (DC.) Kuntze,Pluchea paniculata var. paniculata,Pluchea paniculata var. paniculata,Pluchea paniculata var. paniculata,Pluchea paniculata,Blumea membranacea DC.,Blumea membranacea,Pluchea,Blumea
