87626,Perezia nitens M.E.Jones,Acourtia glomeriflora (A.Gray) Reveal & R.M.King,Acourtia glomeriflora (A.Gray) Reveal & R.M.King,Acourtia glomeriflora (A.Gray) Reveal & R.M.King,Acourtia glomeriflora,Gochnatia arborescens Brandegee,Gochnatia arborescens,Acourtia,Gochnatia
87637,Lactuca persica Boiss.,Cicerbita persica Beauverd,Cicerbita persica Beauverd,Cicerbita persica Beauverd,Cicerbita persica,Lactuca persica Boiss.,Lactuca persica,Cicerbita,Lactuca
87646,Artemisia lobulifolia Boiss.,Seriphidium santolinum (Schrenk) Poljakov,Seriphidium santolinum (Schrenk) Poljakov,Seriphidium santolinum (Schrenk) Poljakov,Seriphidium santolinum,Artemisia lobulifolia Boiss.,Artemisia lobulifolia,Seriphidium,Artemisia
87652,Cacalia arguta Kuntze,Cyanthillium cinereum var. viale (DC.) Isawumi,Cyanthillium cinereum var. viale (DC.) Isawumi,Cyanthillium cinereum var. viale (DC.) Isawumi,Cyanthillium cinereum,Vernonia arguta Baker,Vernonia arguta,Cyanthillium,Vernonia
87683,Gnaphalium rhodarum S.F.Blake,Pseudognaphalium rhodarum (S.F.Blake) Anderb.,Pseudognaphalium rhodarum (S.F.Blake) Anderb.,Pseudognaphalium rhodarum (S.F.Blake) Anderb.,Pseudognaphalium rhodarum,Gnaphalium rhodarum S.F.Blake,Gnaphalium rhodarum,Pseudognaphalium,Gnaphalium
87684,Inula somalensis Vatke,Pulicaria sericea E.Gamal-Eldin,Pulicaria sericea E.Gamal-Eldin,Pulicaria sericea E.Gamal-Eldin,Pulicaria sericea,Inula somalensis Vatke,Inula somalensis,Pulicaria,Inula
87698,Parasenecio subglaber (C.C.Chang) Y.L.Chen,Ligularia stenocephala (Maxim.) Matsum. & Koidz.,Ligularia stenocephala (Maxim.) Matsum. & Koidz.,Pojarkovia pojarkovae (Schischk.) Greuter,Pojarkovia pojarkovae,Parasenecio subglaber (C.C.Chang) Y.L.Chen,Parasenecio subglaber,Pojarkovia,Parasenecio
87777,Cacalia canescens Willd.,Caputia tomentosa (Haw.) B.Nord. & Pelser,Caputia tomentosa (Haw.) B.Nord. & Pelser,Caputia tomentosa (Haw.) B.Nord. & Pelser,Caputia tomentosa,Senecio haworthii Sch.Bip.,Senecio haworthii,Caputia,Senecio
87778,Anaphalis cutchica C.B.Clarke,Helichrysum cutchicum (C.B.Clarke) R.S.Rao & Deshp.,Helichrysum cutchicum (C.B.Clarke) R.S.Rao & Deshp.,Helichrysum cutchicum (C.B.Clarke) R.S.Rao & Deshp.,Helichrysum cutchicum,Anaphalis cutchica C.B.Clarke,Anaphalis cutchica,Helichrysum,Anaphalis
87808,Conyza uliginosa (Benth.) Cuatrec.,Erigeron uliginosus Benth.,Erigeron uliginosus Benth.,Erigeron uliginosus Benth.,Erigeron uliginosus,Conyza uliginosa (Benth.) Cuatrec.,Conyza uliginosa,Erigeron,Conyza
87890,Cacalia amygdalina Kuntze,Gymnanthemum amygdalinum (Delile) Sch.Bip.,Gymnanthemum amygdalinum (Delile) Sch.Bip.,Gymnanthemum amygdalinum (Del.) Sch.Bip.ex Walp.,Gymnanthemum amygdalinum,Vernonia amygdalina Delile,Vernonia amygdalina,Gymnanthemum,Vernonia
87903,Senecio sarcoides C.Jeffrey,Curio corymbifer (DC.) Eggli,Curio corymbifer (DC.) Eggli,Curio corymbifer (DC.) Eggli,Curio corymbifer,Senecio sarcoides C.Jeffrey,Senecio sarcoides,Curio,Senecio
87923,Helichrysum glomeratum var. glomeratum ,Ozothamnus glomeratus Hook.f.,Ozothamnus glomeratus Hook.f.,Ozothamnus glomeratus Hook.f.,Ozothamnus glomeratus,Helichrysum lanceolatum Kirk,Helichrysum lanceolatum,Ozothamnus,Helichrysum
87937,Hieracium huteri Hausm. ex Bamb.,Hieracium picroides subsp. picroides ,Hieracium picroides subsp. picroides ,Hieracium picroides subsp. picroides ,Hieracium picroides,Schlagintweitia huteri (Hausm. ex Bamb.) Gottschl. & Greuter,Schlagintweitia huteri,Hieracium,Schlagintweitia
87966,Centipeda orbicularis C.B.Clarke,Sphaeromorphaea australis (Less.) Kitam.,Sphaeromorphaea australis (Less.) Kitam.,Epaltes australis Less.,Epaltes australis,Centipeda orbicularis C.B.Clarke,Centipeda orbicularis,Epaltes,Centipeda
87976,Carlina scabra Burm.f.,Osteospermum amplectens (Harv.) Norl.,Osteospermum amplectens (Harv.) Norl.,Norlindhia amplectens (Harv.) B.Nord.,Norlindhia amplectens,Osteospermum grandiflorum DC.,Osteospermum grandiflorum,Norlindhia,Osteospermum
87986,Hieracium cymigerum Rchb.,Pilosella cymosa subsp. vaillantii (Tausch) S.Bräut. & Greuter,Pilosella cymosa subsp. vaillantii (Tausch) S.Bräut. & Greuter,Pilosella cymosa subsp. vaillantii (Tausch) S.Bräut. & Greuter,Pilosella cymosa,Hieracium cymigerum Rchb.,Hieracium cymigerum,Pilosella,Hieracium
88011,Senecio hainanensis C.C.Chang & Y.C.Tseng,Hainanecio hainanensis (C.C.Chang & Y.C.Tseng) Ying Liu & Q.E.Yang,Hainanecio hainanensis (C.C.Chang & Y.C.Tseng) Ying Liu & Q.E.Yang,Hainanecio hainanensis (C.C.Chang & Y.C.Tseng) Ying Liu & Q.E.Yang,Hainanecio hainanensis,Sinosenecio hainanensis (C.C.Chang & Y.C.Tseng) C.Jeffrey & Y.L.Chen,Sinosenecio hainanensis,Hainanecio,Sinosenecio
88035,Chrysocoma camphorata Robill. & Castagne,Chiliadenus glutinosus Fourr.,Chiliadenus glutinosus Fourr.,Chiliadenus glutinosus Fourr.,Chiliadenus glutinosus,Dittrichia viscosa (L.) Greuter,Dittrichia viscosa,Chiliadenus,Dittrichia
88066,Tanacetum semenovii Herder,Richteria semenovii (Herder) Sonboli & Oberpr.,Richteria semenovii (Herder) Sonboli & Oberpr.,Richteria semenovii (Herder) Sonboli & Oberpr.,Richteria semenovii,Tanacetum semenovii Herder,Tanacetum semenovii,Richteria,Tanacetum
88096,Hieracium anthurum Fr.,Pilosella abscissa F.W.Schultz & Sch.Bip.,Pilosella abscissa F.W.Schultz & Sch.Bip.,Pilosella abscissa F.W.Schultz & Sch.Bip.,Pilosella abscissa,Hieracium abscissum Less.,Hieracium abscissum,Pilosella,Hieracium
88114,Senecio millelobatus Rydb.,Packera millelobata (Rydb.) W.A.Weber & Á.Löve,Packera millelobata (Rydb.) W.A.Weber & Á.Löve,Packera millelobata (Rydb.) W.A.Weber & Á.Löve,Packera millelobata,Senecio millelobatus Rydb.,Senecio millelobatus,Packera,Senecio
88117,Conyza leucantha (D.Don) Ludlow & P.H.Raven,Eschenbachia leucantha (D.Don) Brouillet,Eschenbachia leucantha (D.Don) Brouillet,Eschenbachia leucantha (D.Don) Brouillet,Eschenbachia leucantha,Conyza leucantha (D.Don) Ludlow & P.H.Raven,Conyza leucantha,Eschenbachia,Conyza
88139,Gynoxys ilicifolia (L.f.) Wedd.,Scrobicaria ilicifolia (L.f.) B.Nord.,Scrobicaria ilicifolia (L.f.) B.Nord.,Scrobicaria ilicifolia (L.f.) B.Nord.,Scrobicaria ilicifolia,Gynoxys ilicifolia (L.f.) Wedd.,Gynoxys ilicifolia,Scrobicaria,Gynoxys
88215,Vernonia bracteata Wall. ex Hook.f.,Acilepis silhetensis (DC.) H.Rob.,Acilepis silhetensis (DC.) H.Rob.,Acilepis silhetensis (DC.) H.Rob.,Acilepis silhetensis,Vernonia bracteata Wall. ex Hook.f.,Vernonia bracteata,Acilepis,Vernonia
88219,Piptothrix sinaloae S.F.Blake,Ageratina palmeri (A.Gray) B.L.Turner,Ageratina palmeri (A.Gray) B.L.Turner,Ageratina palmeri (A.Gray) B.L.Turner,Ageratina palmeri,Piptothrix sinaloae S.F.Blake,Piptothrix sinaloae,Ageratina,Piptothrix
88245,Eclipta procumbens Michx.,Eclipta prostrata Lour.,Eclipta prostrata Lour.,Blainvillea acmella (L.) Philipson,Blainvillea acmella,Eclipta prostrata (L.) L.,Eclipta prostrata,Blainvillea,Eclipta
88292,Eupatorium paniculatum Lindl. ex DC.,Brenandendron donianum (DC.) H.Rob.,Brenandendron donianum (DC.) H.Rob.,Brenandendron donianum (DC.) H.Rob.,Brenandendron donianum,Vernonia paniculata DC.,Vernonia paniculata,Brenandendron,Vernonia
88295,Haplopappus rubiginosus Torr. & A.Gray,Rayjacksonia phyllocephala DC.,Rayjacksonia phyllocephala DC.,Rayjacksonia phyllocephala DC.,Rayjacksonia phyllocephala,Haplopappus rubiginosus Torr. & A.Gray,Haplopappus rubiginosus,Rayjacksonia,Haplopappus
88306,Filago minor Bubani,Logfia minima Dumort.,Logfia minima Dumort.,Logfia minima Dumort.,Logfia minima,Filago minima (Sm.) Pers.,Filago minima,Logfia,Filago
88341,Vernonia denudata Hutch. & B.L.Burtt,Vernonella denudata (Hutch. & B.L.Burtt) H.Rob. & Skvarla,Vernonella denudata (Hutch. & B.L.Burtt) H.Rob. & Skvarla,Vernonella denudata (Hutch. & B.L.Burtt) H.Rob. & Skvarla,Vernonella denudata,Vernonia denudata Hutch. & B.L.Burtt,Vernonia denudata,Vernonella,Vernonia
88345,Actinea lanigera Daniels,Eriophyllum lanatum (Pursh) J.Forbes,Eriophyllum lanatum (Pursh) J.Forbes,Eriophyllum lanatum (Pursh) J.Forbes,Eriophyllum lanatum,Tetraneuris acaulis var. caespitosa A.Nelson,Tetraneuris acaulis,Eriophyllum,Tetraneuris
88355,Artemisia valida Krasch. ex Poljakov,Seriphidium validum (Kraschen. ex Poljakov) Poljakov,Seriphidium validum (Kraschen. ex Poljakov) Poljakov,Seriphidium validum (Kraschen. ex Poljakov) Poljakov,Seriphidium validum,Artemisia valida Krasch. ex Poljakov,Artemisia valida,Seriphidium,Artemisia
88388,Aster menthodorus (Benth.) Govaerts,Neobrachyactis anomala (DC.) Brouillet,Neobrachyactis anomala (DC.) Brouillet,Neobrachyactis anomala (DC.) Brouillet,Neobrachyactis anomala,Aster menthodorus (Benth.) Govaerts,Aster menthodorus,Neobrachyactis,Aster
88446,Eupatorium obtusifolium Willd.,Lepidaploa glabra (Willd.) H.Rob.,Lepidaploa glabra (Willd.) H.Rob.,Lepidaploa glabra (Willd.) H.Rob.,Lepidaploa glabra,Vernonia albicaulis Vahl ex Pers.,Vernonia albicaulis,Lepidaploa,Vernonia
88490,Chlorocrepis albiflora (Hook.) W.A.Weber,Pilosella albiflora F.W.Schultz & Sch.Bip.,Pilosella albiflora F.W.Schultz & Sch.Bip.,Pilosella albiflora F.W.Schultz & Sch.Bip.,Pilosella albiflora,Hieracium albiflorum Hook.,Hieracium albiflorum,Pilosella,Hieracium
88507,Cephalorrhynchus macrorhizus (Royle) Tuisl,Melanoseris macrorhiza (Royle) N.Kilian,Melanoseris macrorhiza (Royle) N.Kilian,Melanoseris macrorhiza (Royle) N.Kilian,Melanoseris macrorhiza,Lactuca macrorhiza Hook.f.,Lactuca macrorhiza,Melanoseris,Lactuca
88511,Cacalia palmata Makino,Syneilesis palmata Maxim.,Syneilesis palmata Maxim.,Syneilesis palmata Maxim.,Syneilesis palmata,Parasenecio yatabei (Matsum. & Koidz.) H.Koyama,Parasenecio yatabei,Syneilesis,Parasenecio
88531,Hieracium euryanthelum Dahlst.,Pilosella cymosa subsp. vaillantii (Tausch) S.Bräut. & Greuter,Pilosella cymosa subsp. vaillantii (Tausch) S.Bräut. & Greuter,Pilosella cymosa subsp. vaillantii (Tausch) S.Bräut. & Greuter,Pilosella cymosa,Hieracium euryanthelum Dahlst.,Hieracium euryanthelum,Pilosella,Hieracium
88538,Calyptocarpus blepharolepis B.L.Rob.,Sanvitalia ocymoides DC.,Sanvitalia ocymoides DC.,Sanvitalia ocymoides DC.,Sanvitalia ocymoides,Calyptocarpus vialis Less.,Calyptocarpus vialis,Sanvitalia,Calyptocarpus
88541,Anthemis pseudoatrata Schur,Achillea tenuifolia Lam.,Achillea tenuifolia Lam.,Achillea tenuifolia Lam.,Achillea tenuifolia,Anthemis cretica subsp. tenuifolia ,Anthemis cretica,Achillea,Anthemis
88585,Sonchus acanthoides Steud.,Cicerbita plumieri Kirschl.,Cicerbita plumieri Kirschl.,Cicerbita plumieri Kirschl.,Cicerbita plumieri,Lactuca plumieri Gren. & Godr.,Lactuca plumieri,Cicerbita,Lactuca
88716,Bidens marginata Perr ex DC.,Chrysanthellum indicum subsp. indicum ,Chrysanthellum indicum subsp. indicum ,Chrysanthellum indicum subsp. indicum ,Chrysanthellum indicum,Chrysanthemum indicum L.,Chrysanthemum indicum,Chrysanthellum,Chrysanthemum
88827,Eupatorium javanicum Blume,Strobocalyx arborea (Buch.-Ham.) Sch.Bip.,Strobocalyx arborea (Buch.-Ham.) Sch.Bip.,Strobocalyx arborea (Buch.-Ham.) Sch.Bip.,Strobocalyx arborea,Vernonia arborea Buch.-Ham.,Vernonia arborea,Strobocalyx,Vernonia
88856,Senecio sukaczevii Schischk.,Tephroseris sukaczevii (Siskin) Holub,Tephroseris sukaczevii (Siskin) Holub,Tephroseris sukaczevii (Siskin) Holub,Tephroseris sukaczevii,Senecio sukaczevii Schischk.,Senecio sukaczevii,Tephroseris,Senecio
88858,Tanacetum simplex A.Nelson,"Artemisia simplex (A.Nelson) Sòn.Garcia, Garnatje, McArthur, Pellicer, S.C.Sand. & Vallès-Xirau","Artemisia simplex (A.Nelson) Sòn.Garcia, Garnatje, McArthur, Pellicer, S.C.Sand. & Vallès-Xirau","Artemisia simplex (A.Nelson) Sòn.Garcia, Garnatje, McArthur, Pellicer, S.C.Sand. & Vallès-Xirau",Artemisia simplex,Sphaeromeria simplex A.Heller,Sphaeromeria simplex,Artemisia,Sphaeromeria
88879,Gochnatia pulchra Cabrera,Moquiniastrum pulchrum (Cabrera) G.Sancho,Moquiniastrum pulchrum (Cabrera) G.Sancho,Moquiniastrum pulchrum (Cabrera) G.Sancho,Moquiniastrum pulchrum,Gochnatia pulchra Cabrera,Gochnatia pulchra,Moquiniastrum,Gochnatia
88951,Eupatorium laeve Griseb.,Koanophyllon simillimum (B.L.Rob.) R.M.King & H.Rob.,Koanophyllon simillimum (B.L.Rob.) R.M.King & H.Rob.,Koanophyllon simillimum (B.L.Rob.) R.M.King & H.Rob.,Koanophyllon simillimum,Ophryosporus lorentzii Hieron.,Ophryosporus lorentzii,Koanophyllon,Ophryosporus
88959,Senecio haworthii Sch.Bip.,Caputia tomentosa (Haw.) B.Nord. & Pelser,Caputia tomentosa (Haw.) B.Nord. & Pelser,Caputia tomentosa (Haw.) B.Nord. & Pelser,Caputia tomentosa,Senecio haworthii Sch.Bip.,Senecio haworthii,Caputia,Senecio
88994,Achillea birjuczensis Klokov,Achillea micrantha Willd.,Achillea micrantha Willd.,Achillea micrantha Willd.,Achillea micrantha,Aspilia foliacea Baker,Aspilia foliacea,Achillea,Aspilia
89009,Conyza cardaminifolia Kunth,Erigeron cardaminifolius Wedd.,Erigeron cardaminifolius Wedd.,Erigeron cardaminifolius Wedd.,Erigeron cardaminifolius,Conyza cardaminifolia Kunth,Conyza cardaminifolia,Erigeron,Conyza
89026,Psacaliopsis paneroi (B.L.Turner) C.Jeffrey,Psacaliopsis pinetorum (Hemsl.) Funston & Villaseñor,Psacaliopsis pinetorum (Hemsl.) Funston & Villaseñor,Roldana pinetorum (Hemsl.) H.Rob. & Brettell,Roldana pinetorum,Psacaliopsis paneroi (B.L.Turner) C.Jeffrey,Psacaliopsis paneroi,Roldana,Psacaliopsis
89028,Heteropappus rupicola (Vaniot & H.Lév.) Kitam.,Aster hispidus Thunb.,Aster hispidus Thunb.,Aster hispidus Thunb.,Aster hispidus,Heteropappus rupicola (Vaniot & H.Lév.) Kitam.,Heteropappus rupicola,Aster,Heteropappus
89047,Chrysanthemum alpinum M.Bieb.,Anthemis marschalliana subsp. pectinata (Boiss.) Grierson,Anthemis marschalliana subsp. pectinata (Boiss.) Grierson,Anthemis marschalliana subsp. pectinata (Boiss.) Grierson,Anthemis marschalliana,Tanacetum caucasicum Sch.Bip.,Tanacetum caucasicum,Anthemis,Tanacetum
89086,Erigeron umbrosus Boiss.,Neobrachyactis roylei (DC.) Brouillet,Neobrachyactis roylei (DC.) Brouillet,Neobrachyactis roylei (DC.) Brouillet,Neobrachyactis roylei,Erigeron umbrosus Boiss.,Erigeron umbrosus,Neobrachyactis,Erigeron
89112,Antennaria monoica Wedd.,Pseudognaphalium antennarioides (DC.) Anderb.,Pseudognaphalium antennarioides (DC.) Anderb.,Pseudognaphalium antennarioides (DC.) Anderb.,Pseudognaphalium antennarioides,Antennaria monoica Wedd.,Antennaria monoica,Pseudognaphalium,Antennaria
89191,Prenanthes raphanifolia DC.,Melanoseris brunoniana (Wall. ex DC.) N.Kilian & Ze H.Wang,Melanoseris brunoniana (Wall. ex DC.) N.Kilian & Ze H.Wang,Melanoseris brunoniana (Wall. ex DC.) N.Kilian & Ze H.Wang,Melanoseris brunoniana,Lactuca brunoniana C.B.Clarke,Lactuca brunoniana,Melanoseris,Lactuca
89250,Vernonia vialis DC.,Cyanthillium cinereum (L.) H.Rob.,Cyanthillium cinereum (L.) H.Rob.,Cyanthillium cinereum (L.) H.Rob.,Cyanthillium cinereum,Vernonia vialis DC.,Vernonia vialis,Cyanthillium,Vernonia
89276,Anthemis sachokiana Sosn. ex Grossh.,Achillea ptarmicifolia (Willd.) Rupr. ex Heimerl,Achillea ptarmicifolia (Willd.) Rupr. ex Heimerl,Achillea ptarmicifolia (Willd.) Rupr. ex Heimerl,Achillea ptarmicifolia,Cota triumfetti (All.) J.Gay,Cota triumfetti,Achillea,Cota
89369,Vernonia densiflora Gardner,Vernonanthura densiflora (Gardner) A.J.Vega & Dematt.,Vernonanthura densiflora (Gardner) A.J.Vega & Dematt.,Vernonanthura densiflora (Gardner) A.J.Vega & Dematt.,Vernonanthura densiflora,Vernonia densiflora Gardner,Vernonia densiflora,Vernonanthura,Vernonia
89374,Erlangea angolensis S.Moore,Bothriocline angolensis (Hiern) Wild & G.V.Pope,Bothriocline angolensis (Hiern) Wild & G.V.Pope,Bothriocline angolensis (Hiern) Wild & G.V.Pope,Bothriocline angolensis,Erlangea angolensis S.Moore,Erlangea angolensis,Bothriocline,Erlangea
89406,Wedelia spilanthoides F.Muell.,Apowollastonia spilanthoides (F.Muell.) Orchard,Apowollastonia spilanthoides (F.Muell.) Orchard,Apowollastonia spilanthoides (F.Muell.) Orchard,Apowollastonia spilanthoides,Wedelia spilanthoides F.Muell.,Wedelia spilanthoides,Apowollastonia,Wedelia
89423,Othonna alata (Thunb.) Sch.Bip.,Hertia alata (Thunb.) Kuntze,Hertia alata (Thunb.) Kuntze,Hertia alata (Thunb.) Kuntze,Hertia alata,Othonna alata (Thunb.) Sch.Bip.,Othonna alata,Hertia,Othonna
89433,Vernonia saligna DC.,Acilepis saligna (DC.) H.Rob.,Acilepis saligna (DC.) H.Rob.,Acilepis saligna (DC.) H.Rob.,Acilepis saligna,Vernonia saligna DC.,Vernonia saligna,Acilepis,Vernonia
89444,Othonna carnosa Less.,Crassothonna cacalioides (L.f.) B.Nord.,Crassothonna cacalioides (L.f.) B.Nord.,Crassothonna cacalioides (L.f.) B.Nord.,Crassothonna cacalioides,Othonna carnosa Less.,Othonna carnosa,Crassothonna,Othonna
89493,Senecio thyrsophorus K.Koch,Jacobaea racemosa subsp. racemosa ,Jacobaea racemosa subsp. racemosa ,Jacobaea racemosa subsp. racemosa ,Jacobaea racemosa,Senecio racemosus (M.Bieb.) DC.,Senecio racemosus,Jacobaea,Senecio
89510,Viguiera hemsleyana S.F.Blake,Aldama ghiesbreghtii (Hemsl.) E.E.Schill. & Panero,Aldama ghiesbreghtii (Hemsl.) E.E.Schill. & Panero,Aldama ghiesbreghtii (Hemsl.) E.E.Schill. & Panero,Aldama ghiesbreghtii,Viguiera hemsleyana S.F.Blake,Viguiera hemsleyana,Aldama,Viguiera
89515,Cacalia revoluta Kuntze,Lepidaploa aurea (Mart. ex DC.) H.Rob.,Lepidaploa aurea (Mart. ex DC.) H.Rob.,Lepidaploa aurea (Mart. ex DC.) H.Rob.,Lepidaploa aurea,Stenocephalum hystrix (Chodat) H.Rob.,Stenocephalum hystrix,Lepidaploa,Stenocephalum
89524,Vernonia parvuliceps Ekman,Lepidaploa arborescens (L.) H.Rob.,Lepidaploa arborescens (L.) H.Rob.,Lepidaploa arborescens (L.) H.Rob.,Lepidaploa arborescens,Vernonia arborescens (L.) Sw.,Vernonia arborescens,Lepidaploa,Vernonia
89546,Vernonia jucunda Gleason,Stenocephalum jucundum (Gleason) H.Rob.,Stenocephalum jucundum (Gleason) H.Rob.,Stenocephalum jucundum (Gleason) H.Rob.,Stenocephalum jucundum,Vernonia jucunda Gleason,Vernonia jucunda,Stenocephalum,Vernonia
89593,Leontopodium gnaphalioides (Kunth) Hieron.,Pseudognaphalium antennarioides (DC.) Anderb.,Pseudognaphalium antennarioides (DC.) Anderb.,Pseudognaphalium antennarioides (DC.) Anderb.,Pseudognaphalium antennarioides,Antennaria gnaphalioides (Kunth) Standl. ex R.Knuth,Antennaria gnaphalioides,Pseudognaphalium,Antennaria
89610,Haplopappus whitneyi A.Gray,Hazardia whitneyi Greene,Hazardia whitneyi Greene,Hazardia whitneyi Greene,Hazardia whitneyi,Adeia whitneyi (A.Gray) G.L.Nesom,Adeia whitneyi,Hazardia,Adeia
89619,Vernonia andohii C.D.Adams,Brenandendron donianum (DC.) H.Rob.,Brenandendron donianum (DC.) H.Rob.,Brenandendron donianum (DC.) H.Rob.,Brenandendron donianum,Vernonia andohii C.D.Adams,Vernonia andohii,Brenandendron,Vernonia
89620,Cicerbita leucophaea Wallr.,Cicerbita alpina Wallr.,Cicerbita alpina Wallr.,Cicerbita alpina Wallr.,Cicerbita alpina,Lactuca biennis (Moench) Fernald,Lactuca biennis,Cicerbita,Lactuca
89658,Stenotheca tristis (Willd. ex Spreng.) Schljakov,Pilosella tristis F.W.Schultz & Sch.Bip.,Pilosella tristis F.W.Schultz & Sch.Bip.,Pilosella tristis F.W.Schultz & Sch.Bip.,Pilosella tristis,Hieracium triste Willd. ex Spreng.,Hieracium triste,Pilosella,Hieracium
89665,Tanacetum rupestre Popov ex Nevski,Xylanthemum fisherae (Aitch. & Hemsl.) Tzvelev,Xylanthemum fisherae (Aitch. & Hemsl.) Tzvelev,Xylanthemum fisherae (Aitch. & Hemsl.) Tzvelev,Xylanthemum fisherae,Tanacetum rupestre Popov ex Nevski,Tanacetum rupestre,Xylanthemum,Tanacetum
89670,Tanacetum pjataevae Kovalevsk.,Tanacetopsis pjataevae (Kovalevsk.) Karmysch.,Tanacetopsis pjataevae (Kovalevsk.) Karmysch.,Tanacetopsis pjataevae (Kovalevsk.) Karmysch.,Tanacetopsis pjataevae,Tanacetum pjataevae Kovalevsk.,Tanacetum pjataevae,Tanacetopsis,Tanacetum
89690,Gnaphalium globuliferum E.Mey. ex DC.,Helichrysum serpentinicola Wild,Helichrysum serpentinicola Wild,Helichrysum serpentinicola Wild,Helichrysum serpentinicola,Plecostachys serpyllifolia (P.J.Bergius) Hilliard & B.L.Burtt,Plecostachys serpyllifolia,Helichrysum,Plecostachys
89704,Skirrhophorus muellerianus Sond.,Chthonocephalus muellerianus P.S.Short,Chthonocephalus muellerianus P.S.Short,Chthonocephalus muellerianus P.S.Short,Chthonocephalus muellerianus,Pogonolepis muelleriana (Sond.) P.S.Short,Pogonolepis muelleriana,Chthonocephalus,Pogonolepis
89721,Baziasa humilis Steud.,Eclipta prostrata Lour.,Eclipta prostrata Lour.,Blainvillea acmella (L.) Philipson,Blainvillea acmella,Sabazia humilis Cass.,Sabazia humilis,Blainvillea,Sabazia
89725,Cineraria elata Steud.,Ligularia sibirica subsp. sibirica ,Ligularia sibirica subsp. sibirica ,Ligularia sibirica subsp. sibirica ,Ligularia sibirica,Senecio ligularia Hook.f.,Senecio ligularia,Ligularia,Senecio
89728,Seriphidium monogynum (Waldst. & Kit.) Poljakov,Seriphidium santonicum subsp. santonicum ,Seriphidium santonicum subsp. santonicum ,Seriphidium santonicum subsp. santonicum ,Seriphidium santonicum,Artemisia santonicum L.,Artemisia santonicum,Seriphidium,Artemisia
89731,Shawia axillaris Sch.Bip.,Olearia axillaris (DC.) Benth.,Olearia axillaris (DC.) Benth.,Olearia axillaris (DC.) Benth.,Olearia axillaris,Shawia axillaris Sch.Bip.,Shawia axillaris,Olearia,Shawia
89739,Senecio pleopterus Diels,Jacobaea graciliflora (DC.) Sennikov,Jacobaea graciliflora (DC.) Sennikov,Jacobaea graciliflora (DC.) Sennikov,Jacobaea graciliflora,Senecio graciliflorus DC.,Senecio graciliflorus,Jacobaea,Senecio
89762,Cineraria sumneviczii (Schischk. & Serg.) Kamelin,Tephroseris turczaninovii subsp. turczaninovii ,Tephroseris turczaninovii subsp. turczaninovii ,Tephroseris turczaninovii (DC.) Holub,Tephroseris turczaninovii,Senecio sumneviczii Schischk. & Serg.,Senecio sumneviczii,Tephroseris,Senecio
89768,Erigeron heterochaeta (Benth.) Botsch.,Aster asterodes Kuntze,Aster asterodes Kuntze,Aster asterodes Kuntze,Aster asterodes,Erigeron heterochaeta (Benth.) Botsch.,Erigeron heterochaeta,Aster,Erigeron
89771,Senecio yunnanensis Franch.,Ligularia yunnanensis (Franch.) C.C.Chang,Ligularia yunnanensis (Franch.) C.C.Chang,Ligularia yunnanensis (Franch.) C.C.Chang,Ligularia yunnanensis,Senecio nudicaulis Buch.-Ham. ex D.Don,Senecio nudicaulis,Ligularia,Senecio
89849,Verbesina arborescens (L.) M.Gómez,Borrichia arborescens (L.) DC.,Borrichia arborescens (L.) DC.,Borrichia arborescens (L.) DC.,Borrichia arborescens,Verbesina arborescens (L.) M.Gómez,Verbesina arborescens,Borrichia,Verbesina
89911,Hieracium orizabaeum Arv.-Touv.,Pilosella abscissa F.W.Schultz & Sch.Bip.,Pilosella abscissa F.W.Schultz & Sch.Bip.,Pilosella abscissa F.W.Schultz & Sch.Bip.,Pilosella abscissa,Hieracium abscissum Less.,Hieracium abscissum,Pilosella,Hieracium
89966,Conyza schimperi Sch.Bip. ex A.Rich.,Erigeron schimperi Sch.Bip. ex Schweinf.,Erigeron schimperi Sch.Bip. ex Schweinf.,Erigeron trilobus Boiss.,Erigeron trilobus,Conyza schimperi Sch.Bip. ex A.Rich.,Conyza schimperi,Erigeron,Conyza
89979,Hieracium friesii Sch.Bip.,Pilosella friesii F.W.Schultz & Sch.Bip.,Pilosella friesii F.W.Schultz & Sch.Bip.,Pilosella friesii F.W.Schultz & Sch.Bip.,Pilosella friesii,Hieracium schultzii Fr.,Hieracium schultzii,Pilosella,Hieracium
89989,Cotula reptans Benth.,Leptinella reptans (Benth.) D.G.Lloyd & C.J.Webb,Leptinella reptans (Benth.) D.G.Lloyd & C.J.Webb,Leptinella reptans (Benth.) D.G.Lloyd & C.J.Webb,Leptinella reptans,Cotula reptans Benth.,Cotula reptans,Leptinella,Cotula
89991,Senecio floribundus Sch.Bip.,Critoniopsis floribunda (Kunth) H.Rob.,Critoniopsis floribunda (Kunth) H.Rob.,Critoniopsis floribunda (Kunth) H.Rob.,Critoniopsis floribunda,Senecio floribundus Sch.Bip.,Senecio floribundus,Critoniopsis,Senecio
90010,Tanacetum monanthos L.,Anacyclus monanthos subsp. monanthos ,Anacyclus monanthos subsp. monanthos ,Anacyclus monanthos subsp. monanthos ,Anacyclus monanthos,Flaveria bidentis (L.) Kuntze,Flaveria bidentis,Anacyclus,Flaveria
90022,Senecio jurgensenii Hemsl.,Roldana jurgensenii (Hemsl.) H.Rob. & Brettell,Roldana jurgensenii (Hemsl.) H.Rob. & Brettell,Roldana jurgensenii (Hemsl.) H.Rob. & Brettell,Roldana jurgensenii,Senecio jurgensenii Hemsl.,Senecio jurgensenii,Roldana,Senecio
90034,Stenoseris tenuis C.Shih,Melanoseris tenuis (C.Shih) N.Kilian,Melanoseris tenuis (C.Shih) N.Kilian,Melanoseris tenuis (C.Shih) N.Kilian,Melanoseris tenuis,Stenoseris tenuis C.Shih,Stenoseris tenuis,Melanoseris,Stenoseris
90102,Vernonia pseudolinearifolia Hieron.,Vernonanthura pseudolinearifolia (Hieron.) A.J.Vega & Dematt.,Vernonanthura pseudolinearifolia (Hieron.) A.J.Vega & Dematt.,Vernonanthura pseudolinearifolia (Hieron.) A.J.Vega & Dematt.,Vernonanthura pseudolinearifolia,Vernonia pseudolinearifolia Hieron.,Vernonia pseudolinearifolia,Vernonanthura,Vernonia
90142,Vernonia secundifolia Bojer ex DC.,Eirmocephala brachiata (Benth. ex Oerst.) H.Rob.,Eirmocephala brachiata (Benth. ex Oerst.) H.Rob.,Eirmocephala brachiata (Benth. ex Oerst.) H.Rob.,Eirmocephala brachiata,Gymnanthemum secundifolium (Bojer ex DC.) H.Rob.,Gymnanthemum secundifolium,Eirmocephala,Gymnanthemum
90165,Podospermum intermedium DC.,Epilasia hemilasia C.B.Clarke,Epilasia hemilasia C.B.Clarke,Epilasia hemilasia C.B.Clarke,Epilasia hemilasia,Podospermum laciniatum (L.) DC.,Podospermum laciniatum,Epilasia,Podospermum
90221,Senecio missionum Cabrera,Dendrophorbium pluricephalum (Cabrera) C.Jeffrey,Dendrophorbium pluricephalum (Cabrera) C.Jeffrey,Dendrophorbium pluricephalum (Cabrera) C.Jeffrey,Dendrophorbium pluricephalum,Senecio pluricephalus Cabrera,Senecio pluricephalus,Dendrophorbium,Senecio
90246,Calcitrapa patibilcensis Kunth,Plectocephalus americanus (Nutt.) D.Don,Plectocephalus americanus (Nutt.) D.Don,Plectocephalus americanus (Nutt.) D.Don,Plectocephalus americanus,Centaurea melitensis L.,Centaurea melitensis,Plectocephalus,Centaurea
90252,Hieracium fulvipes Wedd.,Pilosella fulvipes F.W.Schultz & Sch.Bip.,Pilosella fulvipes F.W.Schultz & Sch.Bip.,Pilosella fulvipes F.W.Schultz & Sch.Bip.,Pilosella fulvipes,Hieracium fulvipes Wedd.,Hieracium fulvipes,Pilosella,Hieracium
