24873,Eupatorium areolatum Perr. ex DC.,Ethulia conyzoides subsp. conyzoides ,Ethulia conyzoides subsp. conyzoides ,Ethulia conyzoides subsp. conyzoides ,Ethulia conyzoides,Piptothrix areolaris (DC.) R.M.King & H.Rob.,Piptothrix areolaris,Ethulia,Piptothrix
24890,Eupatorium dendroides Spreng.,Raulinoreitzia crenulata (Spreng.) R.M.King & H.Rob.,Raulinoreitzia crenulata (Spreng.) R.M.King & H.Rob.,Raulinoreitzia crenulata (Spreng.) R.M.King & H.Rob.,Raulinoreitzia crenulata,Ageratina dendroides (Spreng.) R.M.King & H.Rob.,Ageratina dendroides,Raulinoreitzia,Ageratina
24903,Hieracium contractum Brenner,Pilosella cymosa subsp. vaillantii (Tausch) S.Bräut. & Greuter,Pilosella cymosa subsp. vaillantii (Tausch) S.Bräut. & Greuter,Pilosella cymosa subsp. vaillantii (Tausch) S.Bräut. & Greuter,Pilosella cymosa,Hieracium contractum Brenner,Hieracium contractum,Pilosella,Hieracium
25032,Senecio sanguisorbae DC.,Packera sanguisorbae (DC.) C.Jeffrey,Packera sanguisorbae (DC.) C.Jeffrey,Packera sanguisorbae (DC.) C.Jeffrey,Packera sanguisorbae,Senecio sanguisorbae DC.,Senecio sanguisorbae,Packera,Senecio
25064,Oligocarpus calendulaceus Less.,Osteospermum calendulaceum L.f.,Osteospermum calendulaceum L.f.,Osteospermum calendulaceum L.f.,Osteospermum calendulaceum,Oligocarpus calendulaceus Less.,Oligocarpus calendulaceus,Osteospermum,Oligocarpus
25153,Vernonia retusa Sch.Bip. ex H.Rob.,"Baccharoides longipedunculata var. retusa (R.E.Fr.) Isawumi, El-Ghazaly & B.Nord.","Baccharoides longipedunculata var. retusa (R.E.Fr.) Isawumi, El-Ghazaly & B.Nord.","Baccharoides longipedunculata var. retusa (R.E.Fr.) Isawumi, El-Ghazaly & B.Nord.",Baccharoides longipedunculata,Vernonia retusa Sch.Bip. ex H.Rob.,Vernonia retusa,Baccharoides,Vernonia
25173,Senecio quercetorum Greene,Packera quercetorum (Greene) C.Jeffrey,Packera quercetorum (Greene) C.Jeffrey,Packera quercetorum (Greene) C.Jeffrey,Packera quercetorum,Senecio quercetorum Greene,Senecio quercetorum,Packera,Senecio
25184,Aster orientalis S.G.Gmel.,"Pentanema britannicum (L.) D.Gut.Larr., Santos-Vicente, Anderb., E.Rico & M.M.Mart.Ort.","Pentanema britannicum (L.) D.Gut.Larr., Santos-Vicente, Anderb., E.Rico & M.M.Mart.Ort.","Pentanema britannicum (L.) D.Gut.Larr., Santos-Vicente, Anderb., E.Rico & M.M.Mart.Ort.",Pentanema britannicum,Inula britannica L.,Inula britannica,Pentanema,Inula
25195,Osteospermum fruticosum (L.) Norl.,Dimorphotheca fruticosa (L.) Less.,Dimorphotheca fruticosa (L.) Less.,Dimorphotheca fruticosa (L.) Less.,Dimorphotheca fruticosa,Osteospermum fruticosum (L.) Norl.,Osteospermum fruticosum,Dimorphotheca,Osteospermum
25277,Cousinia abolinii Kult. ex Tscherneva,"Arctium abolinii (Kult. ex Tscherneva) S.López, Romasch., Susanna & N.Garcia","Arctium abolinii (Kult. ex Tscherneva) S.López, Romasch., Susanna & N.Garcia","Arctium abolinii (Kult. ex Tscherneva) S.López, Romasch., Susanna & N.Garcia",Arctium abolinii,Cousinia abolinii Kult. ex Tscherneva,Cousinia abolinii,Arctium,Cousinia
25287,Senecio nikoensis Miq.,Nemosenecio nikoensis (Miq.) B.Nord.,Nemosenecio nikoensis (Miq.) B.Nord.,Nemosenecio nikoensis (Miq.) B.Nord.,Nemosenecio nikoensis,Senecio nikoensis Miq.,Senecio nikoensis,Nemosenecio,Senecio
25354,Hieracium uruguayense Arv.-Touv.,Pilosella semiglabrata Sch.Bip. & F.W.Schultz,Pilosella semiglabrata Sch.Bip. & F.W.Schultz,Pilosella semiglabrata Sch.Bip. & F.W.Schultz,Pilosella semiglabrata,Hieracium commersonii Monnier,Hieracium commersonii,Pilosella,Hieracium
25358,Eupatoriadelphus dubius (Willd. ex Poir.) R.M.King & H.Rob.,Eutrochium dubium (Willd. ex Poir.) E.E.Lamont,Eutrochium dubium (Willd. ex Poir.) E.E.Lamont,Eutrochium dubium (Willd. ex Poir.) E.E.Lamont,Eutrochium dubium,Eupatorium dubium Willd. ex Poiret,Eupatorium dubium,Eutrochium,Eupatorium
25448,Eupatorium tubiflorum Benth.,Ageratina areolaris (DC.) D.Gage ex B.L.Turner,Ageratina areolaris (DC.) D.Gage ex B.L.Turner,Ageratina areolaris (DC.) D.Gage ex B.L.Turner,Ageratina areolaris,Piptothrix areolaris (DC.) R.M.King & H.Rob.,Piptothrix areolaris,Ageratina,Piptothrix
25493,Othonna athanasiae L.f.,Othonna daucifolia J.C.Manning & Goldblatt,Othonna daucifolia J.C.Manning & Goldblatt,Othonna daucifolia J.C.Manning & Goldblatt,Othonna daucifolia,Euryops speciosissimus DC.,Euryops speciosissimus,Othonna,Euryops
25539,Carduus pauciflorus Lam.,Cirsium waldsteinii Rouy,Cirsium waldsteinii Rouy,Cirsium waldsteinii Rouy,Cirsium waldsteinii,Carduus defloratus L.,Carduus defloratus,Cirsium,Carduus
25618,Heterotheca breweri (A.Gray) Shinners,Eucephalus breweri (A.Gray) G.L.Nesom,Eucephalus breweri (A.Gray) G.L.Nesom,Eucephalus breweri (A.Gray) G.L.Nesom,Eucephalus breweri,Aster breweri (A.Gray) Semple,Aster breweri,Eucephalus,Aster
25711,Aster limonifolius B.Fedtsch.,Rhinactinidia limoniifolia Novopokr. ex Botsch.,Rhinactinidia limoniifolia Novopokr. ex Botsch.,Rhinactinidia limoniifolia Novopokr. ex Botsch.,Rhinactinidia limoniifolia,Aster limonifolius B.Fedtsch.,Aster limonifolius,Rhinactinidia,Aster
25767,Vernonia ruficoma Schlecht. ex Mart.,Vernonanthura membranacea (Gardner) H.Rob.,Vernonanthura membranacea (Gardner) H.Rob.,Vernonanthura membranacea (Gardner) H.Rob.,Vernonanthura membranacea,Vernonia ruficoma Schlecht. ex Mart.,Vernonia ruficoma,Vernonanthura,Vernonia
25826,Hieracium denticuliferum Norrl.,Pilosella cymosa subsp. vaillantii (Tausch) S.Bräut. & Greuter,Pilosella cymosa subsp. vaillantii (Tausch) S.Bräut. & Greuter,Pilosella cymosa subsp. vaillantii (Tausch) S.Bräut. & Greuter,Pilosella cymosa,Hieracium denticuliferum Norrl.,Hieracium denticuliferum,Pilosella,Hieracium
25842,Inula wissmanniana Hand.-Mazz.,Duhaldea wissmanniana (Hand.-Mazz.) Anderb.,Duhaldea wissmanniana (Hand.-Mazz.) Anderb.,Duhaldea wissmanniana (Hand.-Mazz.) Anderb.,Duhaldea wissmanniana,Inula wissmanniana Hand.-Mazz.,Inula wissmanniana,Duhaldea,Inula
25848,Gifola gallica (L.) Myrz.,Logfia gallica Coss. & Germ.,Logfia gallica Coss. & Germ.,Logfia gallica Coss. & Germ.,Logfia gallica,Filago gallica L.,Filago gallica,Logfia,Filago
25852,Kleinia crassulifolia DC.,Curio crassulifolius (DC.) P.V.Heath,Curio crassulifolius (DC.) P.V.Heath,Curio crassulifolius (DC.) P.V.Heath,Curio crassulifolius,Senecio crassulifolius Sch.Bip.,Senecio crassulifolius,Curio,Senecio
25889,"Sphaeromeria ruthiae A.H.Holmgren, L.M.Shultz & Lowrey","Artemisia ruthiae (A.H.Holmgren, L.M.Shultz & Lowrey) Sòn.Garcia, Garnatje, McArthur, Pellicer, S.C.Sand. & Vallès-Xirau","Artemisia ruthiae (A.H.Holmgren, L.M.Shultz & Lowrey) Sòn.Garcia, Garnatje, McArthur, Pellicer, S.C.Sand. & Vallès-Xirau","Artemisia ruthiae (A.H.Holmgren, L.M.Shultz & Lowrey) Sòn.Garcia, Garnatje, McArthur, Pellicer, S.C.Sand. & Vallès-Xirau",Artemisia ruthiae,"Sphaeromeria ruthiae A.H.Holmgren, L.M.Shultz & Lowrey",Sphaeromeria ruthiae,Artemisia,Sphaeromeria
25902,Youngia nansiensis Y.Z.Zhao & L.Ma,Crepidiastrum akagii (Kitag.) J.W.Zhang & N.Kilian,Crepidiastrum akagii (Kitag.) J.W.Zhang & N.Kilian,Crepidiastrum akagii (Kitag.) J.W.Zhang & N.Kilian,Crepidiastrum akagii,Youngia nansiensis Y.Z.Zhao & L.Ma,Youngia nansiensis,Crepidiastrum,Youngia
25903,Doria sonchifolia Thunb.,Senecio cymbalariifolius Less.,Senecio cymbalariifolius Less.,Senecio cymbalariifolius Less.,Senecio cymbalariifolius,Cineraria sonchifolia (L.) L.,Cineraria sonchifolia,Senecio,Cineraria
25937,Hieracium triste Willd. ex Spreng.,Pilosella tristis F.W.Schultz & Sch.Bip.,Pilosella tristis F.W.Schultz & Sch.Bip.,Pilosella tristis F.W.Schultz & Sch.Bip.,Pilosella tristis,Hieracium triste Willd. ex Spreng.,Hieracium triste,Pilosella,Hieracium
25954,Lapsana lampsanifolia Mill.,Rhagadiolus stellatus (L.) Gaertn.,Rhagadiolus stellatus (L.) Gaertn.,Rhagadiolus stellatus (L.) Gaertn.,Rhagadiolus stellatus,Lapsana lampsanifolia Mill.,Lapsana lampsanifolia,Rhagadiolus,Lapsana
25994,Eupatorium stenolepis Steetz,Ayapana stenolepis (Steetz) R.M.King & H.Rob.,Ayapana stenolepis (Steetz) R.M.King & H.Rob.,Ayapana stenolepis (Steetz) R.M.King & H.Rob.,Ayapana stenolepis,Chromolaena hirsuta (Hook. & Arn.) R.M.King & H.Rob.,Chromolaena hirsuta,Ayapana,Chromolaena
26000,Gnaphalium seriphioides P.J.Bergius,Metalasia brevifolia (Lam.) Levyns,Metalasia brevifolia (Lam.) Levyns,Metalasia brevifolia (Lam.) Levyns,Metalasia brevifolia,Ifloga ambigua (L.) Druce,Ifloga ambigua,Metalasia,Ifloga
26060,Gochnatia sessilis Alain,Anastraphia sessilis (Alain) Ventosa & V.A.Funk,Anastraphia sessilis (Alain) Ventosa & V.A.Funk,Anastraphia sessilis (Alain) Ventosa & V.A.Funk,Anastraphia sessilis,Gochnatia sessilis Alain,Gochnatia sessilis,Anastraphia,Gochnatia
26074,Crepis stenotheca Fries ex Walp.,Hieracium crepidispermum Fr.,Hieracium crepidispermum Fr.,Hieracium crepidispermum Fr.,Hieracium crepidispermum,Crepis stenotheca Fries ex Walp.,Crepis stenotheca,Hieracium,Crepis
26100,Vernonia monticola Mart. ex DC.,Stenocephalum apiculatum Sch.Bip.,Stenocephalum apiculatum Sch.Bip.,Stenocephalum apiculatum Sch.Bip.,Stenocephalum apiculatum,Mikania monticola (Mart. ex DC.) Sch.Bip.,Mikania monticola,Stenocephalum,Mikania
26102,Gnaphalium niveum Cass. ex DC.,Helichrysum anomalum Less.,Helichrysum anomalum Less.,Helichrysum anomalum Less.,Helichrysum anomalum,Senecio aspelina DC.,Senecio aspelina,Helichrysum,Senecio
26122,Senecio chapalensis S.Watson,Roldana chapalensis (S.Watson) H.Rob. & Brettell,Roldana chapalensis (S.Watson) H.Rob. & Brettell,Roldana chapalensis (S.Watson) H.Rob. & Brettell,Roldana chapalensis,Senecio chapalensis S.Watson,Senecio chapalensis,Roldana,Senecio
26165,Chrysanthemum abolinii (Kovalevsk.) H.Ohashi & Yonek.,Ajania abolinii Kovalevsk.,Ajania abolinii Kovalevsk.,Ajania abolinii Kovalevsk.,Ajania abolinii,Chrysanthemum abolinii (Kovalevsk.) H.Ohashi & Yonek.,Chrysanthemum abolinii,Ajania,Chrysanthemum
26191,Lapsana taraxaconoides J.F.Gmel.,Aposeris foetida Less.,Aposeris foetida Less.,Aposeris foetida Less.,Aposeris foetida,Lapsana taraxaconoides J.F.Gmel.,Lapsana taraxaconoides,Aposeris,Lapsana
26291,Liatris lanata Spreng. ex DC.,Himalaiella albescens (DC.) Raab-Straube,Himalaiella albescens (DC.) Raab-Straube,Himalaiella albescens (DC.) Raab-Straube,Himalaiella albescens,Saussurea albescens Hook.f & Thomson,Saussurea albescens,Himalaiella,Saussurea
26303,Cacalia volkameriifolia Kuntze,Monosis volkameriifolia (DC.) H.Rob. & Skvarla,Monosis volkameriifolia (DC.) H.Rob. & Skvarla,Monosis volkameriifolia (DC.) H.Rob. & Skvarla,Monosis volkameriifolia,Vernonia volkameriifolia DC.,Vernonia volkameriifolia,Monosis,Vernonia
26402,Centaurea visianii Radić,Crupina crupinastrum (Moris) Vis.,Crupina crupinastrum (Moris) Vis.,Crupina crupinastrum (Moris) Vis.,Crupina crupinastrum,Centaurea visianii Radić,Centaurea visianii,Crupina,Centaurea
26409,Chrysanthemum pamiricum O.Hoffm. ex Paulsen,Xylanthemum pamiricum (O.Hoffm.) Tzvelev,Xylanthemum pamiricum (O.Hoffm.) Tzvelev,Xylanthemum pamiricum (O.Hoffm.) Tzvelev,Xylanthemum pamiricum,Cancrinia pamirica (O.Hoffm.) P.Poliakov,Cancrinia pamirica,Xylanthemum,Cancrinia
26454,Eupatorium hieronymi S.E.Freire,Grazielia brevipetiolata (Sch.Bip. ex Baker) R.M.King & H.Rob.,Grazielia brevipetiolata (Sch.Bip. ex Baker) R.M.King & H.Rob.,Grazielia brevipetiolata (Sch.Bip. ex Baker) R.M.King & H.Rob.,Grazielia brevipetiolata,Eupatorium hieronymi S.E.Freire,Eupatorium hieronymi,Grazielia,Eupatorium
26477,Trichocline beckeri H.Rob.,Chaptalia hieracioides (Kunth) X.D.Xu & W.Zheng,Chaptalia hieracioides (Kunth) X.D.Xu & W.Zheng,Chaptalia hieracioides (Kunth) X.D.Xu & W.Zheng,Chaptalia hieracioides,Trichocline hieracioides (Kunth) Ferreyra,Trichocline hieracioides,Chaptalia,Trichocline
26489,Eupatorium tequendamense Hieron.,Chromolaena uromeres (B.L.Rob.) R.M.King & H.Rob.,Chromolaena uromeres (B.L.Rob.) R.M.King & H.Rob.,Chromolaena uromeres (B.L.Rob.) R.M.King & H.Rob.,Chromolaena uromeres,Eupatorium tequendamense Hieron.,Eupatorium tequendamense,Chromolaena,Eupatorium
26500,Anisopappus candelabrum H.Lév.,Anisopappus chinensis subsp. chinensis ,Anisopappus chinensis subsp. chinensis ,Anisopappus chinensis subsp. chinensis ,Anisopappus chinensis,Adenostemma lavenia var. lavenia ,Adenostemma lavenia,Anisopappus,Adenostemma
26525,Hieracium praemorsiforme Sch.Bip.,Pilosella mexicana F.W.Schultz & Sch.Bip.,Pilosella mexicana F.W.Schultz & Sch.Bip.,Pilosella mexicana F.W.Schultz & Sch.Bip.,Pilosella mexicana,Hieracium mexicanum Less.,Hieracium mexicanum,Pilosella,Hieracium
26542,Carpesium gigas H.Lév. & Vaniot,Artemisia sieversiana Ehrh. ex Willd.,Artemisia sieversiana Ehrh. ex Willd.,Artemisia sieversiana Ehrh. ex Willd.,Artemisia sieversiana,Carpesium gigas H.Lév. & Vaniot,Carpesium gigas,Artemisia,Carpesium
26553,Tripteris scariosa DC.,Osteospermum monstrosum (Burm.f.) J.C.Manning & Goldblatt,Osteospermum monstrosum (Burm.f.) J.C.Manning & Goldblatt,Osteospermum monstrosum (Burm.f.) J.C.Manning & Goldblatt,Osteospermum monstrosum,Monoculus monstrosus (Burm.f.) B.Nord.,Monoculus monstrosus,Osteospermum,Monoculus
26582,Cacalia harveyi Kuntze,Lessingianthus monocephalus (Gardner) H.Rob.,Lessingianthus monocephalus (Gardner) H.Rob.,Lessingianthus monocephalus (Gardner) H.Rob.,Lessingianthus monocephalus,Vernonia galpinii Klatt,Vernonia galpinii,Lessingianthus,Vernonia
26598,Lactuca deltoidea DC. ex C.A.Mey.,Cicerbita deltoidea Beauverd,Cicerbita deltoidea Beauverd,Cicerbita deltoidea Beauverd,Cicerbita deltoidea,Lactuca deltoidea DC. ex C.A.Mey.,Lactuca deltoidea,Cicerbita,Lactuca
26602,Amellus salignus (L.) Opiz,Symphyotrichum × salignum (Willd.) G.L.Nesom,Symphyotrichum × salignum (Willd.) G.L.Nesom,Symphyotrichum × salignum (Willd.) G.L.Nesom,Symphyotrichum salignum,Tripolium pannonicum subsp. tripolium (L.) Greuter,Tripolium pannonicum,Symphyotrichum,Tripolium
26715,Heteropappus villosus Komarov,Aster hispidus Thunb.,Aster hispidus Thunb.,Aster hispidus Thunb.,Aster hispidus,Heteropappus villosus Komarov,Heteropappus villosus,Aster,Heteropappus
26725,Vernonia pseudocentauropsis Humbert,Oliganthes pseudocentauropsis (Humbert) Humbert,Oliganthes pseudocentauropsis (Humbert) Humbert,Oliganthes pseudocentauropsis (Humbert) Humbert,Oliganthes pseudocentauropsis,Vernonia pseudocentauropsis Humbert,Vernonia pseudocentauropsis,Oliganthes,Vernonia
26752,Aphyllocladus decussatus Hieron.,Famatinanthus decussatus (Hieron.) Ariza & S.E.Freire,Famatinanthus decussatus (Hieron.) Ariza & S.E.Freire,Famatinanthus decussatus (Hieron.) Ariza & S.E.Freire,Famatinanthus decussatus,Aphyllocladus decussatus Hieron.,Aphyllocladus decussatus,Famatinanthus,Aphyllocladus
26757,Isocarpha kunthii Cass.,Acmella leucantha (Kunth) R.K.Jansen,Acmella leucantha (Kunth) R.K.Jansen,Acmella leucantha (Kunth) R.K.Jansen,Acmella leucantha,Spilanthes leucantha Kunth,Spilanthes leucantha,Acmella,Spilanthes
26791,Inula helenioides f. lutescens Pau,"Pentanema helenioides (DC.) D.Gut.Larr., Santos-Vicente, Anderb., E.Rico & M.M.Mart.Ort.","Pentanema helenioides (DC.) D.Gut.Larr., Santos-Vicente, Anderb., E.Rico & M.M.Mart.Ort.","Pentanema helenioides (DC.) D.Gut.Larr., Santos-Vicente, Anderb., E.Rico & M.M.Mart.Ort.",Pentanema helenioides,Inula helenioides DC.,Inula helenioides,Pentanema,Inula
26822,Matricaria tetragonosperma (F.Schmidt) Hara & Kitam.,Tripleurospermum tetragonospermum (F.Schmidt) Pobed.,Tripleurospermum tetragonospermum (F.Schmidt) Pobed.,Tripleurospermum tetragonospermum (F.Schmidt) Pobed.,Tripleurospermum tetragonospermum,Matricaria tetragonosperma (F.Schmidt) Hara & Kitam.,Matricaria tetragonosperma,Tripleurospermum,Matricaria
26831,Eupatorium areolare DC.,Ageratina areolaris (DC.) D.Gage ex B.L.Turner,Ageratina areolaris (DC.) D.Gage ex B.L.Turner,Ageratina areolaris (DC.) D.Gage ex B.L.Turner,Ageratina areolaris,Piptothrix areolaris (DC.) R.M.King & H.Rob.,Piptothrix areolaris,Ageratina,Piptothrix
26841,Senecio adenophylloides Sch.Bip. ex Wedd.,Culcitium rufescens Bonpl.,Culcitium rufescens Bonpl.,Culcitium rufescens Bonpl.,Culcitium rufescens,Senecio rufescens DC.,Senecio rufescens,Culcitium,Senecio
26879,Conyza andryaloides DC.,Psychrogeton andryaloides Novopokr. ex Krasch.,Psychrogeton andryaloides Novopokr. ex Krasch.,Psychrogeton andryaloides Novopokr. ex Krasch.,Psychrogeton andryaloides,Erigeron poncinsii (Franch.) Botsch.,Erigeron poncinsii,Psychrogeton,Erigeron
26909,Achaetogeron sophiaefolius Larsen,Laennecia sophiifolia (Kunth) G.L.Nesom,Laennecia sophiifolia (Kunth) G.L.Nesom,Laennecia sophiifolia (Kunth) G.L.Nesom,Laennecia sophiifolia,Erigeron neomexicanus A.Gray,Erigeron neomexicanus,Laennecia,Erigeron
26920,Cacalia madagascariensis Kuntze,Distephanus madagascariensis (Less.) H.Rob. & V.A.Funk,Distephanus madagascariensis (Less.) H.Rob. & V.A.Funk,Distephanus madagascariensis (Less.) H.Rob. & V.A.Funk,Distephanus madagascariensis,Vernonia madagascariensis Less.,Vernonia madagascariensis,Distephanus,Vernonia
26945,Marshallia williamsonii Small,Marshallia graminifolia subsp. graminifolia ,Marshallia graminifolia subsp. graminifolia ,Marshallia graminifolia (Walter) Small,Marshallia graminifolia,Vernonia angustifolia Michx.,Vernonia angustifolia,Marshallia,Vernonia
26998,Senecio plattensis Nutt.,Packera plattensis (Nutt.) W.A.Weber & Á.Löve,Packera plattensis (Nutt.) W.A.Weber & Á.Löve,Packera plattensis (Nutt.) W.A.Weber & Á.Löve,Packera plattensis,Senecio plattensis Nutt.,Senecio plattensis,Packera,Senecio
27001,Inula confertiflora A.Rich.,"Pentanema confertiflorum (A.Rich.) D.Gut.Larr., Santos-Vicente, Anderb., E.Rico & M.M.Mart.Ort.","Pentanema confertiflorum (A.Rich.) D.Gut.Larr., Santos-Vicente, Anderb., E.Rico & M.M.Mart.Ort.","Pentanema confertiflorum (A.Rich.) D.Gut.Larr., Santos-Vicente, Anderb., E.Rico & M.M.Mart.Ort.",Pentanema confertiflorum,Inula confertiflora A.Rich.,Inula confertiflora,Pentanema,Inula
27060,Tripteris clandestina Less.,Osteospermum monstrosum (Burm.f.) J.C.Manning & Goldblatt,Osteospermum monstrosum (Burm.f.) J.C.Manning & Goldblatt,Osteospermum monstrosum (Burm.f.) J.C.Manning & Goldblatt,Osteospermum monstrosum,Monoculus monstrosus (Burm.f.) B.Nord.,Monoculus monstrosus,Osteospermum,Monoculus
27113,Cirsium polyanthos d'Urv.,Carduus collinus subsp. collinus ,Carduus collinus subsp. collinus ,Carduus collinus subsp. collinus ,Carduus collinus,Cirsium creticum d'Urv.,Cirsium creticum,Carduus,Cirsium
27124,Conyza ivifolia (L.) Less.,Nidorella ivifolia (L.) J.C.Manning & Goldblatt,Nidorella ivifolia (L.) J.C.Manning & Goldblatt,Nidorella ivifolia (L.) J.C.Manning & Goldblatt,Nidorella ivifolia,Erigeron ivifolius Sch.Bip.,Erigeron ivifolius,Nidorella,Erigeron
27154,Senecio acanthifolius Hombr. & Jacquinot ex Decne.,Iocenes acanthifolius subsp. acanthifolius ,Iocenes acanthifolius subsp. acanthifolius ,Iocenes acanthifolius (Hombr. & Jacq.) B.Nord.,Iocenes acanthifolius,Senecio acanthifolius Hombr. & Jacquinot ex Decne.,Senecio acanthifolius,Iocenes,Senecio
27167,Cnicus arenarius Willd.,Onopordum arenarium (Desf.) Pomel,Onopordum arenarium (Desf.) Pomel,Onopordum arenarium (Desf.) Pomel,Onopordum arenarium,Carduus litigiosus Nocca & Balb.,Carduus litigiosus,Onopordum,Carduus
27169,Artemisia nachitscevanica Rzazade,Seriphidium lercheanum (Weber ex Stechm.) Poljakov,Seriphidium lercheanum (Weber ex Stechm.) Poljakov,Seriphidium lercheanum (Weber ex Stechm.) Poljakov,Seriphidium lercheanum,Artemisia nachitscevanica Rzazade,Artemisia nachitscevanica,Seriphidium,Artemisia
27194,Cacalia haworthii Sweet,Caputia tomentosa (Haw.) B.Nord. & Pelser,Caputia tomentosa (Haw.) B.Nord. & Pelser,Caputia tomentosa (Haw.) B.Nord. & Pelser,Caputia tomentosa,Senecio haworthii Sch.Bip.,Senecio haworthii,Caputia,Senecio
27211,Eupatorium maculatum L.,Eutrochium maculatum (L.) E.E.Lamont,Eutrochium maculatum (L.) E.E.Lamont,Eutrochium maculatum (L.) E.E.Lamont,Eutrochium maculatum,Eupatorium maculatum L.,Eupatorium maculatum,Eutrochium,Eupatorium
27235,Pyrethrum ferulaceum Sch.Bip.,Gonospermum ferulaceum (Webb) Febles,Gonospermum ferulaceum (Webb) Febles,Gonospermum ferulaceum (Webb) Febles,Gonospermum ferulaceum,Tanacetum ferulaceum Sch.Bip.,Tanacetum ferulaceum,Gonospermum,Tanacetum
27269,Stenoseris taliensis (Franch.) C.Shih,Melanoseris graciliflora (DC.) N.Kilian,Melanoseris graciliflora (DC.) N.Kilian,Melanoseris graciliflora (DC.) N.Kilian,Melanoseris graciliflora,Stenoseris graciliflora (Wall. ex DC.) C.Shih,Stenoseris graciliflora,Melanoseris,Stenoseris
27282,Achillea leptophylla K.Koch ex Nyman,Achillea crithmifolia Waldst. & Kit.,Achillea crithmifolia Waldst. & Kit.,Aspilia floribunda Baker,Aspilia floribunda,Achillea arabica Kotschy.,Achillea arabica,Aspilia,Achillea
27293,Gnaphalium montanum Huds.,Logfia minima Dumort.,Logfia minima Dumort.,Logfia minima Dumort.,Logfia minima,Filago minima (Sm.) Pers.,Filago minima,Logfia,Filago
27308,Phyllocephalum frutescens Blume,Centratherum frutescens (Blume) Benth.,Centratherum frutescens (Blume) Benth.,Centratherum frutescens (Blume) Benth.,Centratherum frutescens,Phyllocephalum frutescens Blume,Phyllocephalum frutescens,Centratherum,Phyllocephalum
27348,Pyrethrum hybridum (Guss.) Guss.,Tanacetum macrophyllum Sch.Bip.,Tanacetum macrophyllum Sch.Bip.,Tanacetum macrophyllum Sch.Bip.,Tanacetum macrophyllum,Coleostephus myconis (L.) Rchb.f.,Coleostephus myconis,Tanacetum,Coleostephus
27407,Chrysocoma aspera F.Dietr.,"Pentanema germanicum (L.) D.Gut.Larr., Santos-Vicente, Anderb., E.Rico & M.M.Mart.Ort.","Pentanema germanicum (L.) D.Gut.Larr., Santos-Vicente, Anderb., E.Rico & M.M.Mart.Ort.","Pentanema germanicum (L.) D.Gut.Larr., Santos-Vicente, Anderb., E.Rico & M.M.Mart.Ort.",Pentanema germanicum,Inula germanica L.,Inula germanica,Pentanema,Inula
27422,Vernonia praestans Ekman ex Urb.,Lepidaploa purpurata (Gleason) H.Rob.,Lepidaploa purpurata (Gleason) H.Rob.,Lepidaploa purpurata (Gleason) H.Rob.,Lepidaploa purpurata,Vernonia praestans Ekman ex Urb.,Vernonia praestans,Lepidaploa,Vernonia
27438,Gnaphalium ustulatum Nutt.,Gamochaeta ustulata (Nutt.) Holub,Gamochaeta ustulata (Nutt.) Holub,Gamochaeta ustulata (Nutt.) Holub,Gamochaeta ustulata,Gnaphalium ustulatum Nutt.,Gnaphalium ustulatum,Gamochaeta,Gnaphalium
27459,Tessaria plucheoides Hassl.,Tessaria dodoneifolia subsp. dodoneifolia ,Tessaria dodoneifolia subsp. dodoneifolia ,Tessaria dodoneifolia subsp. dodoneifolia ,Tessaria dodoneifolia,Pluchea dodonaeifolia (Hook. & Arn.) H.Rob. & Cuatrec.,Pluchea dodonaeifolia,Tessaria,Pluchea
27511,Eupatoriadelphus maculatus (L.) R.M.King & H.Rob.,Eutrochium maculatum (L.) E.E.Lamont,Eutrochium maculatum (L.) E.E.Lamont,Eutrochium maculatum (L.) E.E.Lamont,Eutrochium maculatum,Eupatorium maculatum L.,Eupatorium maculatum,Eutrochium,Eupatorium
27524,Culcitium rufescens Humb. & Bonpl.,Senecio rufescens DC.,Senecio rufescens DC.,Senecio rufescens DC.,Senecio rufescens,Culcitium rufescens Humb. & Bonpl.,Culcitium rufescens,Senecio,Culcitium
27536,Heteropappus oldhamii (Hemsl.) Kitam.,Aster oldhamii Hemsl.,Aster oldhamii Hemsl.,Kalimeris hispida Nees,Kalimeris hispida,Heteropappus oldhamii (Hemsl.) Kitam.,Heteropappus oldhamii,Kalimeris,Heteropappus
27647,Conyza asteroides Host ex Beck,"Pentanema bifrons (L.) D.Gut.Larr., Santos-Vicente, Anderb., E.Rico & M.M.Mart.Ort.","Pentanema bifrons (L.) D.Gut.Larr., Santos-Vicente, Anderb., E.Rico & M.M.Mart.Ort.","Pentanema bifrons (L.) D.Gut.Larr., Santos-Vicente, Anderb., E.Rico & M.M.Mart.Ort.",Pentanema bifrons,Inula bifrons L.,Inula bifrons,Pentanema,Inula
27672,Artemisia kasakorum (Krasch.) Pavlov,Seriphidium kasakorum (Krasch.) K.Bremer & Humphries,Seriphidium kasakorum (Krasch.) K.Bremer & Humphries,Seriphidium kasakorum (Krasch.) K.Bremer & Humphries,Seriphidium kasakorum,Artemisia kasakorum (Krasch.) Pavlov,Artemisia kasakorum,Seriphidium,Artemisia
27676,Senecio scaposus DC.,Caputia scaposa (DC.) B.Nord. & Pelser,Caputia scaposa (DC.) B.Nord. & Pelser,Caputia scaposa (DC.) B.Nord. & Pelser,Caputia scaposa,Senecio scaposus DC.,Senecio scaposus,Caputia,Senecio
27714,Eupatorium paucicapitulatum Hieron.,Chromolaena callilepis (Sch.Bip. ex Baker) R.M.King & H.Rob.,Chromolaena callilepis (Sch.Bip. ex Baker) R.M.King & H.Rob.,Chromolaena callilepis (Sch.Bip. ex Baker) R.M.King & H.Rob.,Chromolaena callilepis,Eupatorium paucicapitulatum Hieron.,Eupatorium paucicapitulatum,Chromolaena,Eupatorium
27740,Eupatorium grandiflorum André,Ageratina vernalis (Vatke & Kurtz) R.M.King & H.Rob.,Ageratina vernalis (Vatke & Kurtz) R.M.King & H.Rob.,Ageratina vernalis (Vatke & Kurtz) R.M.King & H.Rob.,Ageratina vernalis,Bartlettina sordida (Less.) R.M.King & H.Rob.,Bartlettina sordida,Ageratina,Bartlettina
27772,Electra galeottii A.Gray,"Electranthera mutica var. subvillosa (DC.) Mesfin, D.J.Crawford & Pruski","Electranthera mutica var. subvillosa (DC.) Mesfin, D.J.Crawford & Pruski","Electranthera mutica var. subvillosa (DC.) Mesfin, D.J.Crawford & Pruski",Electranthera mutica,Coreopsis mutica var. subvillosa DC.,Coreopsis mutica,Electranthera,Coreopsis
28051,Leptocoma racemosa Less.,"Aster verticillatus (Reinw.) Brouillet, Semple & Y.L.Chen","Aster verticillatus (Reinw.) Brouillet, Semple & Y.L.Chen","Aster verticillatus (Reinw.) Brouillet, Semple & Y.L.Chen",Aster verticillatus,Rhynchospermum verticillatum Reinw.,Rhynchospermum verticillatum,Aster,Rhynchospermum
28084,Heteropappus medius (Krylov) Tamamsch.,Aster medius (Krylov) Serg.,Aster medius (Krylov) Serg.,Kalimeris altaica (Willd.) Nees ex Fisch.Mey. & Avé-Lall.,Kalimeris altaica,Heteropappus medius (Krylov) Tamamsch.,Heteropappus medius,Kalimeris,Heteropappus
28088,Eupatorium charpinii Cabrera,Chromolaena ferruginea (Gardner) R.M.King & H.Rob.,Chromolaena ferruginea (Gardner) R.M.King & H.Rob.,Chromolaena ferruginea (Gardner) R.M.King & H.Rob.,Chromolaena ferruginea,Eupatorium charpinii Cabrera,Eupatorium charpinii,Chromolaena,Eupatorium
28090,Gnaphalium minimum Sm.,Logfia minima Dumort.,Logfia minima Dumort.,Logfia minima Dumort.,Logfia minima,Filago minima (Sm.) Pers.,Filago minima,Logfia,Filago
