51317,Vernonia amygdalina Delile,Gymnanthemum amygdalinum (Delile) Sch.Bip.,Gymnanthemum amygdalinum (Delile) Sch.Bip.,Gymnanthemum amygdalinum (Del.) Sch.Bip.ex Walp.,Gymnanthemum amygdalinum,Vernonia amygdalina Delile,Vernonia amygdalina,Gymnanthemum,Vernonia
51320,Senecio veresczaginii Schischk. & Serg.,Tephroseris vereszczaginii (Siskin & Serg.) Holub,Tephroseris vereszczaginii (Siskin & Serg.) Holub,Tephroseris vereszczaginii (Siskin & Serg.) Holub,Tephroseris vereszczaginii,Senecio veresczaginii Schischk. & Serg.,Senecio veresczaginii,Tephroseris,Senecio
51339,Koelpinia sessilis Boiss.,Dipterocome pusilla Fisch. & C.A.Mey.,Dipterocome pusilla Fisch. & C.A.Mey.,Dipterocome pusilla Fisch. & C.A.Mey.,Dipterocome pusilla,Koelpinia sessilis Boiss.,Koelpinia sessilis,Dipterocome,Koelpinia
51356,Aster angustus Torr. & A.Gray,Symphyotrichum ciliatum (Ledeb.) G.L.Nesom,Symphyotrichum ciliatum (Ledeb.) G.L.Nesom,Symphyotrichum ciliatum (Ledeb.) G.L.Nesom,Symphyotrichum ciliatum,Aster angustus Torr. & A.Gray,Aster angustus,Symphyotrichum,Aster
51372,Conyza verbascifolia Friv. ex Nyman,"Pentanema aschersonianum (Janka) D.Gut.Larr., Santos-Vicente, Anderb., E.Rico & M.M.Mart.Ort.","Pentanema aschersonianum (Janka) D.Gut.Larr., Santos-Vicente, Anderb., E.Rico & M.M.Mart.Ort.","Pentanema aschersonianum (Janka) D.Gut.Larr., Santos-Vicente, Anderb., E.Rico & M.M.Mart.Ort.",Pentanema aschersonianum,Inula aschersoniana Janka,Inula aschersoniana,Pentanema,Inula
51432,Lactuca laevigata var. saxatilis (Edgew.) C.B.Clarke,Melanoseris macrorhiza (Royle) N.Kilian,Melanoseris macrorhiza (Royle) N.Kilian,Melanoseris macrorhiza (Royle) N.Kilian,Melanoseris macrorhiza,Lactuca macrorhiza Hook.f.,Lactuca macrorhiza,Melanoseris,Lactuca
51467,Tanacetum submarginatum Kovalevsk.,Tanacetopsis submarginata (Kovalevsk.) Kovalevsk.,Tanacetopsis submarginata (Kovalevsk.) Kovalevsk.,Tanacetopsis submarginata (Kovalevsk.) Kovalevsk.,Tanacetopsis submarginata,Tanacetum submarginatum Kovalevsk.,Tanacetum submarginatum,Tanacetopsis,Tanacetum
51500,Cicerbita azurea var. glabra Sennikov,Cicerbita azurea Beauverd,Cicerbita azurea Beauverd,Cicerbita azurea Beauverd,Cicerbita azurea,Lactuca azurea Danguy,Lactuca azurea,Cicerbita,Lactuca
51585,Linochilus rosmarinifolius Benth.,Diplostephium rosmarinifolium Wedd.,Diplostephium rosmarinifolium Wedd.,Diplostephium rosmarinifolium Wedd.,Diplostephium rosmarinifolium,Linochilus rosmarinifolius Benth.,Linochilus rosmarinifolius,Diplostephium,Linochilus
51635,Vernonia zollingeriana Sch.Bip.,Cyanthillium cinereum (L.) H.Rob.,Cyanthillium cinereum (L.) H.Rob.,Cyanthillium cinereum (L.) H.Rob.,Cyanthillium cinereum,Vernonia zollingeriana Sch.Bip.,Vernonia zollingeriana,Cyanthillium,Vernonia
51658,Spilanthes sessilis Poepp. & Endl.,Jaegeria hirta Less.,Jaegeria hirta Less.,Jaegeria hirta Less.,Jaegeria hirta,Spilanthes sessilis Poepp. & Endl.,Spilanthes sessilis,Jaegeria,Spilanthes
51673,Coreopsis mutica var. subvillosa DC.,"Electranthera mutica var. subvillosa (DC.) Mesfin, D.J.Crawford & Pruski","Electranthera mutica var. subvillosa (DC.) Mesfin, D.J.Crawford & Pruski","Electranthera mutica var. subvillosa (DC.) Mesfin, D.J.Crawford & Pruski",Electranthera mutica,Coreopsis mutica var. subvillosa DC.,Coreopsis mutica,Electranthera,Coreopsis
51680,Centaurea stoebe Ledeb.,Phalacrachena calva (Ledeb.) Iljin,Phalacrachena calva (Ledeb.) Iljin,Phalacrachena calva (Ledeb.) Iljin,Phalacrachena calva,Centaurea stoebe Ledeb.,Centaurea stoebe,Phalacrachena,Centaurea
51690,Felicia petitiana Lisowski,Jeffreya petitiana (Lisowski) Beentje,Jeffreya petitiana (Lisowski) Beentje,Jeffreya petitiana (Lisowski) Beentje,Jeffreya petitiana,Felicia petitiana Lisowski,Felicia petitiana,Jeffreya,Felicia
51691,Cancrinia karatavica Tzvelev,Tanacetopsis karataviensis (Kovalevsk.) Kovalevsk.,Tanacetopsis karataviensis (Kovalevsk.) Kovalevsk.,Tanacetopsis karataviensis (Kovalevsk.) Kovalevsk.,Tanacetopsis karataviensis,Tanacetum karataviense Kovalevsk.,Tanacetum karataviense,Tanacetopsis,Tanacetum
51707,Eupatorium marquezianum Gómez de la Maza,Mikania cordifolia (L.f.) Willd.,Mikania cordifolia (L.f.) Willd.,Mikania cordifolia (L.f.) Willd.,Mikania cordifolia,Eupatorium marquezianum Gómez de la Maza,Eupatorium marquezianum,Mikania,Eupatorium
51708,Prenanthes sikkimensis Hook.f.,Melanoseris violifolia (Decne.) N.Kilian,Melanoseris violifolia (Decne.) N.Kilian,Melanoseris violifolia (Decne.) N.Kilian,Melanoseris violifolia,Lactuca sikkimensis (Hook.f.) Stebbins,Lactuca sikkimensis,Melanoseris,Lactuca
51732,Conyza sumatrensis (S.F.Blake) Pruski & G.Sancho,Erigeron sumatrensis Retz.,Erigeron sumatrensis Retz.,Erigeron sumatrensis Retz.,Erigeron sumatrensis,Conyza sumatrensis (S.F.Blake) Pruski & G.Sancho,Conyza sumatrensis,Erigeron,Conyza
51745,Senecio robustus Sch.Bip.,Ligularia robusta DC.,Ligularia robusta DC.,Ligularia robusta DC.,Ligularia robusta,Senecio robustus Sch.Bip.,Senecio robustus,Ligularia,Senecio
51767,Bidens fruticosa L.,Tilesia baccata (L.) Pruski,Tilesia baccata (L.) Pruski,Tilesia baccata (L.) Pruski,Tilesia baccata,Lasianthaea fruticosa (L.) K.M.Becker,Lasianthaea fruticosa,Tilesia,Lasianthaea
51799,Conyza pinnatilobata DC.,Nidorella pinnata (L.f.) J.C.Manning & Goldblatt,Nidorella pinnata (L.f.) J.C.Manning & Goldblatt,Nidorella pinnata (L.f.) J.C.Manning & Goldblatt,Nidorella pinnata,Conyza pinnata (L.f.) Kuntze,Conyza pinnata,Nidorella,Conyza
51896,Vernonia pyrrhopappus Sch.Bip. ex Klatt,Decaneuropsis obovata (Gaudich.) H.Rob. & Skvarla,Decaneuropsis obovata (Gaudich.) H.Rob. & Skvarla,Decaneuropsis obovata (Gaudich.) H.Rob. & Skvarla,Decaneuropsis obovata,Vernonia pyrrhopappus Sch.Bip. ex Klatt,Vernonia pyrrhopappus,Decaneuropsis,Vernonia
51899,Artemisia santonicum subsp. santonicum ,Seriphidium santonicum subsp. santonicum ,Seriphidium santonicum subsp. santonicum ,Seriphidium santonicum subsp. santonicum ,Seriphidium santonicum,Artemisia santonicum subsp. santonicum ,Artemisia santonicum,Seriphidium,Artemisia
51916,Conyza wulfenii Host ex Beck,"Pentanema bifrons (L.) D.Gut.Larr., Santos-Vicente, Anderb., E.Rico & M.M.Mart.Ort.","Pentanema bifrons (L.) D.Gut.Larr., Santos-Vicente, Anderb., E.Rico & M.M.Mart.Ort.","Pentanema bifrons (L.) D.Gut.Larr., Santos-Vicente, Anderb., E.Rico & M.M.Mart.Ort.",Pentanema bifrons,Inula bifrons L.,Inula bifrons,Pentanema,Inula
51948,Senecio sparsifolius Bojer ex DC.,Hubertia adenodonta (DC.) C.Jeffrey,Hubertia adenodonta (DC.) C.Jeffrey,Hubertia adenodonta (DC.) C.Jeffrey,Hubertia adenodonta,Senecio adenodontus DC.,Senecio adenodontus,Hubertia,Senecio
52009,Sabazia humilis Cass.,Eclipta prostrata Lour.,Eclipta prostrata Lour.,Blainvillea acmella (L.) Philipson,Blainvillea acmella,Sabazia humilis Cass.,Sabazia humilis,Blainvillea,Sabazia
52035,Lapsana taraxacoides Forssk.,Aposeris foetida Less.,Aposeris foetida Less.,Aposeris foetida Less.,Aposeris foetida,Lapsana taraxacoides Forssk.,Lapsana taraxacoides,Aposeris,Lapsana
52056,Hieracium gracile subsp. antarcticum Zahn,Pilosella magellanica (Sch.Bip.) Sch.Bip. & F.W.Schultz,Pilosella magellanica (Sch.Bip.) Sch.Bip. & F.W.Schultz,Pilosella magellanica (Sch.Bip.) Sch.Bip. & F.W.Schultz,Pilosella magellanica,Hieracium antarcticum d'Urv.,Hieracium antarcticum,Pilosella,Hieracium
52099,Hieracium rubellum Vuk.,Crepis rubra L.,Crepis rubra L.,Crepis rubra L.,Crepis rubra,Hieracium rubellum Vuk.,Hieracium rubellum,Crepis,Hieracium
52133,Erigeron asteroides Wall.,Blumea obliqua (L.) Druce,Blumea obliqua (L.) Druce,Blumea obliqua (L.) Druce,Blumea obliqua,Erigeron asteroides Wall.,Erigeron asteroides,Blumea,Erigeron
52170,Webbia kraussii Sch.Bip.,Nidorella obscura (DC.) J.C.Manning & Goldblatt,Nidorella obscura (DC.) J.C.Manning & Goldblatt,Nidorella obscura (DC.) J.C.Manning & Goldblatt,Nidorella obscura,Conyza obscura DC.,Conyza obscura,Nidorella,Conyza
52173,Cineraria hirta Vahl ex DC.,Felicia elongata (Thunb.) O.Hoffm. ex O.Hoffm.,Felicia elongata (Thunb.) O.Hoffm. ex O.Hoffm.,Felicia elongata (Thunb.) O.Hoffm. ex O.Hoffm.,Felicia elongata,Solidago elongata Nutt.,Solidago elongata,Felicia,Solidago
52177,Pectis seemannii Sch.Bip.,Oxypappus scaber Benth.,Oxypappus scaber Benth.,Oxypappus scaber Benth.,Oxypappus scaber,Pectis bonplandiana Kunth,Pectis bonplandiana,Oxypappus,Pectis
52210,Inula ensifolia L.,"Pentanema ensifolium (L.) D.Gut.Larr., Santos-Vicente, Anderb., E.Rico & M.M.Mart.Ort.","Pentanema ensifolium (L.) D.Gut.Larr., Santos-Vicente, Anderb., E.Rico & M.M.Mart.Ort.","Pentanema ensifolium (L.) D.Gut.Larr., Santos-Vicente, Anderb., E.Rico & M.M.Mart.Ort.",Pentanema ensifolium,Inula ensifolia L.,Inula ensifolia,Pentanema,Inula
52262,Calopappus acerosus Meyen,Nassauvia acerosa Wedd.,Nassauvia acerosa Wedd.,Nassauvia acerosa Wedd.,Nassauvia acerosa,Calopappus acerosus Meyen,Calopappus acerosus,Nassauvia,Calopappus
52265,Senecio greggii Rydb.,Packera tampicana (DC.) C.Jeffrey,Packera tampicana (DC.) C.Jeffrey,Packera tampicana (DC.) C.Jeffrey,Packera tampicana,Senecio tampicanus DC.,Senecio tampicanus,Packera,Senecio
52279,Gnaphalium filaginoides Hook. & Arn.,Filago californica Nutt.,Filago californica Nutt.,Filago californica Nutt.,Filago californica,Logfia filaginoides (Hook. & Arn.) Morefield,Logfia filaginoides,Filago,Logfia
52309,Tripteris macroptera DC.,Osteospermum oppositifolium (Ait.) Norl.,Osteospermum oppositifolium (Ait.) Norl.,Osteospermum oppositifolium (Ait.) Norl.,Osteospermum oppositifolium,Tripteris oppositifolia (Aiton) B.Nord.,Tripteris oppositifolia,Osteospermum,Tripteris
52356,Eupatorium celebicum Blume,Strobocalyx arborea (Buch.-Ham.) Sch.Bip.,Strobocalyx arborea (Buch.-Ham.) Sch.Bip.,Strobocalyx arborea (Buch.-Ham.) Sch.Bip.,Strobocalyx arborea,Vernonia arborea Buch.-Ham.,Vernonia arborea,Strobocalyx,Vernonia
52398,Achillea pectinata Lam.,Achillea odorata L.,Achillea odorata L.,Verbesina montevidensis Spreng.,Verbesina montevidensis,Achillea nobilis L.,Achillea nobilis,Verbesina,Achillea
52463,Serratula dissecta Ledeb.,Klasea dissecta (Ledeb.) L.Martins,Klasea dissecta (Ledeb.) L.Martins,Klasea dissecta (Ledeb.) L.Martins,Klasea dissecta,Serratula dissecta Ledeb.,Serratula dissecta,Klasea,Serratula
52487,Vernonia liatroides DC.,Vernonanthura liatroides (A.DC.) H.Rob.,Vernonanthura liatroides (A.DC.) H.Rob.,Vernonanthura liatroides (A.DC.) H.Rob.,Vernonanthura liatroides,Vernonia liatroides DC.,Vernonia liatroides,Vernonanthura,Vernonia
52506,Erigeron dentatus Burm.f.,Nidorella ivifolia (L.) J.C.Manning & Goldblatt,Nidorella ivifolia (L.) J.C.Manning & Goldblatt,Nidorella ivifolia (L.) J.C.Manning & Goldblatt,Nidorella ivifolia,Conyza scabrida DC.,Conyza scabrida,Nidorella,Conyza
52541,Senecio tatsienensis Bureau & Franch.,Parasenecio roborowskii (Maxim.) Y.L.Chen,Parasenecio roborowskii (Maxim.) Y.L.Chen,Parasenecio roborowskii (Maxim.) Y.L.Chen,Parasenecio roborowskii,Ligularia pleurocaulis Hand.-Mazz.,Ligularia pleurocaulis,Parasenecio,Ligularia
52577,Atractylis scabra Boiss.,Thevenotia scabra Boiss.,Thevenotia scabra Boiss.,Thevenotia scabra Boiss.,Thevenotia scabra,Atractylis scabra Boiss.,Atractylis scabra,Thevenotia,Atractylis
52579,Aster umbrosus (Benth.) Govaerts,Neobrachyactis roylei (DC.) Brouillet,Neobrachyactis roylei (DC.) Brouillet,Neobrachyactis roylei (DC.) Brouillet,Neobrachyactis roylei,Erigeron umbrosus Boiss.,Erigeron umbrosus,Neobrachyactis,Erigeron
52625,Hieracium polymnoon (Nägeli & Peter) Norrl.,Pilosella cymosa subsp. vaillantii (Tausch) S.Bräut. & Greuter,Pilosella cymosa subsp. vaillantii (Tausch) S.Bräut. & Greuter,Pilosella cymosa subsp. vaillantii (Tausch) S.Bräut. & Greuter,Pilosella cymosa,Hieracium polymnoon (Nägeli & Peter) Norrl.,Hieracium polymnoon,Pilosella,Hieracium
52653,Adenostyles rhombifolia (Willd.) Pimenov,Caucasalia macrophylla (M.Bieb.) B.Nord.,Caucasalia macrophylla (M.Bieb.) B.Nord.,Caucasalia macrophylla (M.Bieb.) B.Nord.,Caucasalia macrophylla,Adenostyles rhombifolia (Willd.) Pimenov,Adenostyles rhombifolia,Caucasalia,Adenostyles
52671,Sonchus canadensis L.,Cicerbita alpina Wallr.,Cicerbita alpina Wallr.,Cicerbita alpina Wallr.,Cicerbita alpina,Lactuca alpina (L.) A.Gray,Lactuca alpina,Cicerbita,Lactuca
52702,Microglossa oblongifolia O.Hoffm.,Microglossa pyrrhopappa (A.Rich.) Agnew,Microglossa pyrrhopappa (A.Rich.) Agnew,Microglossa pyrrhopappa (A.Rich.) Agnew,Microglossa pyrrhopappa,Conyza pyrrhopappa Sch.Bip. ex A.Rich.,Conyza pyrrhopappa,Microglossa,Conyza
52736,Gymnolomia patens A.Gray,Hymenostephium cordatum S.F.Blake,Hymenostephium cordatum S.F.Blake,Hymenostephium cordatum S.F.Blake,Hymenostephium cordatum,Viguiera cordata (Hook. & Arn.) D'Arcy,Viguiera cordata,Hymenostephium,Viguiera
52771,Aequatorium pascoense H.Beltrán & H.Rob.,Nordenstamia pascoensis (H.Beltrán & H.Rob.) B.Nord.,Nordenstamia pascoensis (H.Beltrán & H.Rob.) B.Nord.,Nordenstamia pascoensis (H.Beltrán & H.Rob.) B.Nord.,Nordenstamia pascoensis,Aequatorium pascoense H.Beltrán & H.Rob.,Aequatorium pascoense,Nordenstamia,Aequatorium
52823,Galatella tenuifolia Lindl. ex DC.,Cosmos bipinnatus Cav.,Cosmos bipinnatus Cav.,Cosmos bipinnatus Cav.,Cosmos bipinnatus,Galatella hauptii Lindl. ex DC.,Galatella hauptii,Cosmos,Galatella
52829,Marshallia tenuifolia var. tenuifolia ,Marshallia graminifolia (Walter) Small,Marshallia graminifolia (Walter) Small,Marshallia graminifolia (Walter) Small,Marshallia graminifolia,Vernonia angustifolia Michx.,Vernonia angustifolia,Marshallia,Vernonia
52833,Aster bowiei Harv.,Afroaster bowiei (Harv.) J.C.Manning & Goldblatt,Afroaster bowiei (Harv.) J.C.Manning & Goldblatt,Afroaster bowiei (Harv.) J.C.Manning & Goldblatt,Afroaster bowiei,Aster bowiei Harv.,Aster bowiei,Afroaster,Aster
52870,Eupatorium purpusi Brandegee,Ageratina grandifolia (Regel) R.M.King & H.Rob.,Ageratina grandifolia (Regel) R.M.King & H.Rob.,Ageratina grandifolia (Regel) R.M.King & H.Rob.,Ageratina grandifolia,Fleischmannia purpusii R.M.King & H.Rob.,Fleischmannia purpusii,Ageratina,Fleischmannia
52926,Cineraria hypoleuca Rchb. ex DC.,Synotis rufinervis (DC.) C.Jeffrey & Y.L.Chen,Synotis rufinervis (DC.) C.Jeffrey & Y.L.Chen,Synotis rufinervis (DC.) C.Jeffrey & Y.L.Chen,Synotis rufinervis,Senecio rufinervis DC.,Senecio rufinervis,Synotis,Senecio
52941,Chaetanthera stuebelii Hieron.,Oriastrum stuebelii (Hieron.) A.M.R.Davies,Oriastrum stuebelii (Hieron.) A.M.R.Davies,Oriastrum stuebelii (Hieron.) A.M.R.Davies,Oriastrum stuebelii,Chaetanthera stuebelii Hieron.,Chaetanthera stuebelii,Oriastrum,Chaetanthera
52957,Achillea latifolia Salisb.,Achillea macrophylla L.,Achillea macrophylla L.,Aspilia platyphylla S.F.Blake,Aspilia platyphylla,Tanacetum macrophyllum Sch.Bip.,Tanacetum macrophyllum,Aspilia,Tanacetum
52982,Vernonia vaniotii H.Lév.,Strobocalyx arborea (Buch.-Ham.) Sch.Bip.,Strobocalyx arborea (Buch.-Ham.) Sch.Bip.,Strobocalyx arborea (Buch.-Ham.) Sch.Bip.,Strobocalyx arborea,Vernonia arborea Buch.-Ham.,Vernonia arborea,Strobocalyx,Vernonia
53058,Vernonia rigescens Malme,Lessingianthus rigescens (Malme) Dematt.,Lessingianthus rigescens (Malme) Dematt.,Lessingianthus rigescens (Malme) Dematt.,Lessingianthus rigescens,Vernonia rigescens Malme,Vernonia rigescens,Lessingianthus,Vernonia
53071,Tanacetum tenuifolium Jacquem. ex DC.,Ajania tenuifolia (Jacq.) Tzvelev,Ajania tenuifolia (Jacq.) Tzvelev,Ajania tenuifolia (Jacq.) Tzvelev,Ajania tenuifolia,Tanacetum tenuifolium Jacquem. ex DC.,Tanacetum tenuifolium,Ajania,Tanacetum
53114,Vernonia icosantha DC.,Lepidaploa arborescens (L.) H.Rob.,Lepidaploa arborescens (L.) H.Rob.,Lepidaploa arborescens (L.) H.Rob.,Lepidaploa arborescens,Vernonia arborescens (L.) Sw.,Vernonia arborescens,Lepidaploa,Vernonia
53166,Cineraria purpurascens Banks & Sol. ex Hook.f.,Iocenes acanthifolius subsp. acanthifolius ,Iocenes acanthifolius subsp. acanthifolius ,Iocenes acanthifolius (Hombr. & Jacq.) B.Nord.,Iocenes acanthifolius,Senecio acanthifolius Hombr. & Jacquinot ex Decne.,Senecio acanthifolius,Iocenes,Senecio
53185,Strobocalyx pyrrhopappa Sch.Bip.,Decaneuropsis obovata (Gaudich.) H.Rob. & Skvarla,Decaneuropsis obovata (Gaudich.) H.Rob. & Skvarla,Decaneuropsis obovata (Gaudich.) H.Rob. & Skvarla,Decaneuropsis obovata,Strobocalyx pyrrhopappa Sch.Bip.,Strobocalyx pyrrhopappa,Decaneuropsis,Strobocalyx
53204,Senecio heracleifolius Hemsl.,Roldana heracleifolia (Hemsl.) H.Rob. & Brettell,Roldana heracleifolia (Hemsl.) H.Rob. & Brettell,Roldana heracleifolia (Hemsl.) H.Rob. & Brettell,Roldana heracleifolia,Senecio heracleifolius Hemsl.,Senecio heracleifolius,Roldana,Senecio
53248,Viguiera sessilifolia DC.,Aldama hispida (Kunth) E.E.Schill. & Panero,Aldama hispida (Kunth) E.E.Schill. & Panero,Simsia hispida Cass.,Simsia hispida,Viguiera sessilifolia DC.,Viguiera sessilifolia,Simsia,Viguiera
53274,Lagoseris purpurea Steven ex DC.,Crepis sancta subsp. sancta ,Crepis sancta subsp. sancta ,Crepis sancta subsp. sancta ,Crepis sancta,Lagoseris purpurea Steven ex DC.,Lagoseris purpurea,Crepis,Lagoseris
53306,Gymnaster yuanqunensis J.Q.Fu,"Aster yuanqunensis (J.Q.Fu) Brouillet, Semple & Y.L.Chen","Aster yuanqunensis (J.Q.Fu) Brouillet, Semple & Y.L.Chen","Aster yuanqunensis (J.Q.Fu) Brouillet, Semple & Y.L.Chen",Aster yuanqunensis,Miyamayomena yuanqunensis (J.Q.Fu) J.Q.Fu,Miyamayomena yuanqunensis,Aster,Miyamayomena
53369,Bellium bellioides G.Don,Bellium bellidioides L.,Bellium bellidioides L.,Bellium bellidioides L.,Bellium bellidioides,Bellis annua L.,Bellis annua,Bellium,Bellis
53371,Senecio talinoides Sch.Bip.,Curio talinoides var. talinoides ,Curio talinoides var. talinoides ,Curio talinoides (DC.) P.V.Heath,Curio talinoides,Senecio talinoides Sch.Bip.,Senecio talinoides,Curio,Senecio
53380,Vernonia lugarensis O.Hoffm.,Brachythrix lugarensis (O.Hoffm.) Wild & G.V.Pope,Brachythrix lugarensis (O.Hoffm.) Wild & G.V.Pope,Brachythrix lugarensis (O.Hoffm.) Wild & G.V.Pope,Brachythrix lugarensis,Vernonia lugarensis O.Hoffm.,Vernonia lugarensis,Brachythrix,Vernonia
53471,Hieracium horridum Fr.,Pilosella horrida F.W.Schultz & Sch.Bip.,Pilosella horrida F.W.Schultz & Sch.Bip.,Pilosella horrida F.W.Schultz & Sch.Bip.,Pilosella horrida,Hieracium horridum Fr.,Hieracium horridum,Pilosella,Hieracium
53479,Vernonia arborea var. conferta (DC.) J.Kost.,Strobocalyx arborea (Buch.-Ham.) Sch.Bip.,Strobocalyx arborea (Buch.-Ham.) Sch.Bip.,Strobocalyx arborea (Buch.-Ham.) Sch.Bip.,Strobocalyx arborea,Vernonia arborea var. conferta (DC.) J.Kost.,Vernonia arborea,Strobocalyx,Vernonia
53515,Anthemis inodora Gilib.,Anthemis arvensis subsp. arvensis ,Anthemis arvensis subsp. arvensis ,Anthemis arvensis subsp. arvensis ,Anthemis arvensis,Cota coelopoda (Boiss.) Boiss.,Cota coelopoda,Anthemis,Cota
53519,Vernonia rubricaulis var. bonplandiana Less.,Lessingianthus rubricaulis (Humb. & Bonpl.) H.Rob.,Lessingianthus rubricaulis (Humb. & Bonpl.) H.Rob.,Lessingianthus rubricaulis (Humb. & Bonpl.) H.Rob.,Lessingianthus rubricaulis,Vernonia rubricaulis Bonpl.,Vernonia rubricaulis,Lessingianthus,Vernonia
53545,Cirsium hippolyti Link ex Steud.,Carduus collinus subsp. collinus ,Carduus collinus subsp. collinus ,Carduus collinus subsp. collinus ,Carduus collinus,Cirsium creticum d'Urv.,Cirsium creticum,Carduus,Cirsium
53590,Cacalia quadrifolia Kuntze,Strobocalyx secundifolia Sch.Bip.,Strobocalyx secundifolia Sch.Bip.,Strobocalyx secundifolia Sch.Bip.,Strobocalyx secundifolia,Gymnanthemum secundifolium (Bojer ex DC.) H.Rob.,Gymnanthemum secundifolium,Strobocalyx,Gymnanthemum
53610,Vernonia paniculata DC.,Eremosis tomentosa Gleason,Eremosis tomentosa Gleason,Eremosis tomentosa Gleason,Eremosis tomentosa,Vernonia paniculata DC.,Vernonia paniculata,Eremosis,Vernonia
53621,Vernonia chthonocephala O.Hoffm.,Vernonella chthonocephala (O.Hoffm.) H.Rob. & Skvarla,Vernonella chthonocephala (O.Hoffm.) H.Rob. & Skvarla,Vernonella chthonocephala (O.Hoffm.) H.Rob. & Skvarla,Vernonella chthonocephala,Vernonia chthonocephala O.Hoffm.,Vernonia chthonocephala,Vernonella,Vernonia
53626,Aphanopappus micranthus Hiern,Wollastonia micrantha subsp. micrantha ,Wollastonia micrantha subsp. micrantha ,Wollastonia micrantha subsp. micrantha ,Wollastonia micrantha,Melanthera micrantha subsp. micrantha ,Melanthera micrantha,Wollastonia,Melanthera
53640,Vernonia rubricaulis Bonpl.,Lessingianthus rubricaulis (Humb. & Bonpl.) H.Rob.,Lessingianthus rubricaulis (Humb. & Bonpl.) H.Rob.,Lessingianthus rubricaulis (Humb. & Bonpl.) H.Rob.,Lessingianthus rubricaulis,Vernonia rubricaulis Bonpl.,Vernonia rubricaulis,Lessingianthus,Vernonia
53666,Chrysanthemum trilobatum (Poljakov) H.Ohashi & Yonek.,Ajania trilobata Poljakov,Ajania trilobata Poljakov,Ajania trilobata Poljakov,Ajania trilobata,Chrysanthemum trilobatum (Poljakov) H.Ohashi & Yonek.,Chrysanthemum trilobatum,Ajania,Chrysanthemum
53696,Tessaria viscosa Lillo,Tessaria dodoneifolia subsp. dodoneifolia ,Tessaria dodoneifolia subsp. dodoneifolia ,Tessaria dodoneifolia subsp. dodoneifolia ,Tessaria dodoneifolia,Pluchea dodonaeifolia (Hook. & Arn.) H.Rob. & Cuatrec.,Pluchea dodonaeifolia,Tessaria,Pluchea
53717,Eupatorium auriculatum Vahl,Humbertacalia tomentosa (Lam.) C.Jeffrey,Humbertacalia tomentosa (Lam.) C.Jeffrey,Humbertacalia tomentosa (Lam.) C.Jeffrey,Humbertacalia tomentosa,Senecio penicillatus Sch.Bip.,Senecio penicillatus,Humbertacalia,Senecio
53720,Rhysolepis morelensis S.F.Blake,Aldama morelensis (S.F.Blake) E.E.Schill. & Panero,Aldama morelensis (S.F.Blake) E.E.Schill. & Panero,Aldama morelensis (S.F.Blake) E.E.Schill. & Panero,Aldama morelensis,Rhysolepis morelensis S.F.Blake,Rhysolepis morelensis,Aldama,Rhysolepis
53744,Actinopappus perpusillus Hook.f. ex A.Gray,Rutidosis multiflora B.L.Rob.,Rutidosis multiflora B.L.Rob.,Rutidosis multiflora B.L.Rob.,Rutidosis multiflora,Siloxerus multiflorus (Nees) Nees,Siloxerus multiflorus,Rutidosis,Siloxerus
53748,Youngia afghanica Podlech,Askellia flexuosa (Ledeb.) W.A.Weber,Askellia flexuosa (Ledeb.) W.A.Weber,Askellia flexuosa (Ledeb.) W.A.Weber,Askellia flexuosa,Crepidifolium afghanicum (Podlech) Sennikov,Crepidifolium afghanicum,Askellia,Crepidifolium
53772,Porophyllum tridentatum Benth.,"Bajacalia tridentata (Benth.) Loockerman, B.L.Turner & R.K.Jansen","Bajacalia tridentata (Benth.) Loockerman, B.L.Turner & R.K.Jansen","Bajacalia tridentata (Benth.) Loockerman, B.L.Turner & R.K.Jansen",Bajacalia tridentata,Porophyllum tridentatum Benth.,Porophyllum tridentatum,Bajacalia,Porophyllum
53823,Crocodilodes andongensis Hiern,Hirpicium gorterioides subsp. gorterioides ,Hirpicium gorterioides subsp. gorterioides ,Hirpicium gorterioides subsp. gorterioides ,Hirpicium gorterioides,Berkheya angolensis O.Hoffm.,Berkheya angolensis,Hirpicium,Berkheya
53829,Cnicus macrostylus Moretti,Cirsium arvense (L.) Scop.,Cirsium arvense (L.) Scop.,Cirsium arvense (L.) Scop.,Cirsium arvense,Dasyphyllum tomentosum var. multiflorum (Baker) Cabrera,Dasyphyllum tomentosum,Cirsium,Dasyphyllum
53878,Eupatorium laevigatum Torr.,Eutrochium purpureum (L.) E.E.Lamont,Eutrochium purpureum (L.) E.E.Lamont,Eutrochium purpureum (L.) E.E.Lamont,Eutrochium purpureum,Eupatorium purpureum L.,Eupatorium purpureum,Eutrochium,Eupatorium
53948,Eupatorium subhastatum Hook. & Arn.,Chromolaena hirsuta (Hook. & Arn.) R.M.King & H.Rob.,Chromolaena hirsuta (Hook. & Arn.) R.M.King & H.Rob.,Chromolaena hirsuta (Hook. & Arn.) R.M.King & H.Rob.,Chromolaena hirsuta,Badilloa steetzii (B.L.Rob.) R.M.King & H.Rob.,Badilloa steetzii,Chromolaena,Badilloa
53968,Vernonia hookeriana Arn.,Cyanthillium hookerianum (Arn.) H.Rob.,Cyanthillium hookerianum (Arn.) H.Rob.,Cyanthillium hookerianum (Arn.) H.Rob.,Cyanthillium hookerianum,Vernonia hookeriana Arn.,Vernonia hookeriana,Cyanthillium,Vernonia
53972,Wedelia montana (Blume) Boerl.,Indocypraea montana (Blume) Orchard,Indocypraea montana (Blume) Orchard,Indocypraea montana (Blume) Orchard,Indocypraea montana,Wedelia montana (Blume) Boerl.,Wedelia montana,Indocypraea,Wedelia
53985,Galinsoga calva Sch.Bip.,Galinsoga parviflora Cav.,Galinsoga parviflora Cav.,Galinsoga parviflora Cav.,Galinsoga parviflora,Jaegeria hirta Less.,Jaegeria hirta,Galinsoga,Jaegeria
54002,Carthamus calvus var. glaucescens (Faure & Maire) Maire,Carthamus calvus Batt.,Carthamus calvus Batt.,Carthamus calvus Batt.,Carthamus calvus,Carduncellus calvus Boiss. & Reut.,Carduncellus calvus,Carthamus,Carduncellus
54104,Chrysanthemum glaucum Pers.,Argyranthemum pinnatifidum subsp. pinnatifidum ,Argyranthemum pinnatifidum subsp. pinnatifidum ,Argyranthemum pinnatifidum subsp. pinnatifidum ,Argyranthemum pinnatifidum,Chrysanthemum multifidum Desf.,Chrysanthemum multifidum,Argyranthemum,Chrysanthemum
54110,Crepis chanetii H.Lév.,Tephroseris subdentata (Bunge) Holub,Tephroseris subdentata (Bunge) Holub,Tephroseris subdentata (Bunge) Holub,Tephroseris subdentata,Crepis chanetii H.Lév.,Crepis chanetii,Tephroseris,Crepis
54114,Chuquiraga insignis var. armata Wedd.,Dasyphyllum armatum (J.Kost.) Cabrera,Dasyphyllum armatum (J.Kost.) Cabrera,Dasyphyllum armatum (J.Kost.) Cabrera,Dasyphyllum armatum,Chuquiraga jussieui J.F.Gmel.,Chuquiraga jussieui,Dasyphyllum,Chuquiraga
54157,Eupatorium asperum Roxb.,Acilepis aspera (Buch.-Ham.) H.Rob.,Acilepis aspera (Buch.-Ham.) H.Rob.,Acilepis aspera (Buch.-Ham.) H.Rob.,Acilepis aspera,Vernonia aspera Buch.-Ham.,Vernonia aspera,Acilepis,Vernonia
54245,Aster burgessii Britton,Symphyotrichum burgessii (Britton) G.L.Nesom,Symphyotrichum burgessii (Britton) G.L.Nesom,Symphyotrichum burgessii (Britton) G.L.Nesom,Symphyotrichum burgessii,Aster burgessii Britton,Aster burgessii,Symphyotrichum,Aster
54276,Senecio pluricephalus Cabrera,Dendrophorbium pluricephalum (Cabrera) C.Jeffrey,Dendrophorbium pluricephalum (Cabrera) C.Jeffrey,Dendrophorbium pluricephalum (Cabrera) C.Jeffrey,Dendrophorbium pluricephalum,Senecio pluricephalus Cabrera,Senecio pluricephalus,Dendrophorbium,Senecio
